,Data
12,drayton foods llc terms of use skip to content terms of use last revised: december 20 2021 acceptance of the terms of use these terms of use are entered into by and between you and schwans shared services llc company we or us the following terms and conditions together with any documents they expressly incorporate herein collectively terms of use govern your access to and use of this website including any content functionality and offerings offered on or through this website website please read the terms of use carefully before you start to use the website by continuing to use the website or by clicking to accept or agree to the terms of use if and when such option is made available to you you accept and agree to be bound and abide by these terms of use our privacy notice found at wwwdraytonfoodscom/privacy-notice and incorporated herein by reference our user-generated content terms and conditions found at wwwdraytonfoodscom/ugc-terms and incorporated herein by reference user-generated content terms and applicable laws and regulations if you do not want to agree to these terms of use the privacy notice the user-generated content terms and applicable laws and regulations you must immediately stop accessing or using the website this website is offered and available to users who are 16 years of age or older by using this website you represent and warrant that you are 16 years of age or older if you are not at least 16 years of age you must immediately stop accessing or using this website changes to the terms of use we may revise and update these terms of use from time to time in our sole discretion all changes will become effective immediately when we post them and your continued use of the website following the posting of revised terms of use means that you accept and agree to the changes please check this page from time to time so you are aware of any changes as they are binding on you accessing the website/modifications to website we reserve the right to withdraw or amend this website including by removing content in our sole discretion without notice additionally from time to time we may restrict access to some parts of the website or the entire website to users we will not be liable if for any reason all or any part of the website is unavailable at any time or for any period we may also in the future offer new services and/or features through the website including the release of new tools and/or resources such new services and/or features will also be subject to these terms of use visitor online conduct you may use this website only for lawful purposes and in accordance with these terms of use you agree to not use the website: in any way that violates any applicable federal state local or international law or regulation including without limitation any laws regarding the export of data or software to and from the us or other countries to transmit or procure the sending of any advertising or promotional material including any junk mail chain letter spam or any other similar solicitation to impersonate or attempt to impersonate the company an affiliate an employee of company or a company affiliate another user or any other person or entity including without limitation by using email addresses associated with any of the foregoing to engage in any other conduct that restricts inhibits or disrupts anyones use or enjoyment of the website or which as determined by us may harm the company or users of the website or expose them to liability to attempt to obtain access to any portion of this website any computer server account network software and/or hardware with the website from which you are restricted you agree you are solely responsible for any actions you undertake while visiting this website and you warrant that all information you provide through this website is accurate and truthful intellectual property rights the website and its entire contents features and functionality including but not limited to all information software text displays images video and audio and the design selection and arrangement thereof are owned by the company its licensors or other providers of such material and are protected by united states and international copyright trademark patent trade secret and other intellectual property or proprietary rights laws no right title or interest in or to the website or any content on the website is transferred to you and the company its licensors or other providers of such material as applicable expressly reserve all rights in and to all content on the website no license is granted to you in connection with any such content and any unauthorized use or misuse of such content is prohibited as provided by these terms of use you cannot reproduce modify create derivative works of distribute download display republish store transmit or sell in any form in part or in whole any of the content on the website without express permission of the copyright owner prior to the action your personal and non-commercial use to display copy distribute print and/or download the content will be granted but you must not: a modify the content; or b delete or alter any copyright trademark or other proprietary rights notices from copies of materials from the website if you do modify the content you must have prior written permission to do so you may print copies of the information for your personal use store the files for your personal use or reference this website for your own use/information in its sole discretion the company or its licensors may seek to enforce their intellectual property rights to the fullest extent of the law including through criminal prosecution additionally the company name trademarks trade names logos and all related product names design marks and slogans which appear on the website are the trademarks registered or unregistered of the company or its licensors you must not use such marks without the prior written permission of the company all other names logos product and service names designs and slogans on this website are the trademarks of their respective owners reporting claims of copyright infringement we take claims of copyright infringement seriously we will respond to notices of alleged copyright infringement that comply with applicable law if you believe any materials accessible on or from the website infringe your copyright you may request removal of those materials or access to them from the website by submitting written notification to our copyright agent designated below in accordance with the online copyright infringement liability limitation act of the digital millennium copyright act 17 usc â§ 512 dmca the written notice the dmca notice must include substantially the following: your physical or electronic signature identification of the copyrighted work you believe to have been infringed or if the claim involves multiple works on the website a representative list of such works identification of the material you believe to be infringing in a sufficiently precise manner to allow us to locate that material adequate information by which we can contact you including your name postal address telephone number and if available email address a statement that you have a good faith belief that use of the copyrighted material is not authorized by the copyright owner its agent or the law a statement that the information in the written notice is accurate a statement under penalty of perjury that you are authorized to act on behalf of the copyright owner our designated copyright agent to receive dmca notices is the companys law department which can be reached at if you fail to comply with all of the requirements of section 512c3 of the dmca your dmca notice may not be effective please be aware that if you knowingly materially misrepresent that material or activity on the website is infringing your copyright you may be held liable for damages including costs and attorneys fees under section 512f of the dmca information about you and your visits to the website all information we collect on this website is subject to our privacy notice by using the website you consent to all actions taken by us with respect to your information in compliance with the privacy notice links to third party sites the website may contain links to other sites and resources not owned or controlled by us this includes links contained in advertisements including banner advertisements and sponsored links we have no control over the contents of those sites or resources and accept no responsibility for them or for any loss or damage that may arise from your use of them if you decide to access any of the third-party websites linked to this website you do so entirely at your own risk and subject to the terms and conditions of use for such websites user-generated content companys rights and permissions with respect to content that you create and post on this website or elsewhere that relates to company website companys affiliates companys products and/or companys affiliates products are outlined in the user-generated content terms optional tools we may provide you with access to third-party tools on the website that we do not monitor and over which we do not have control and/or input we provide access to such tools as is and as available without any warranties representations or conditions of any kind and without any endorsement we expressly disclaim all liability whatsoever arising from or relating to your use of optional third-party tools your use of optional tools offered through the website is entirely at your own risk and discretion and you should ensure that you are familiar with and approve of the terms on which tools are provided by the relevant third-party providers geographic restrictions the company is based in the united states we provide this website for use only by persons located in the united states we make no claims that the website or any of its content is accessible or appropriate outside of the united states access to the website may not be legal by certain persons or in certain countries if you access the website from outside the united states you do so on your own initiative and are responsible for compliance with local laws disclaimer; limitation of liabilities you understand that we cannot and do not guarantee or warrant that files available for downloading from the internet or the website will be free of viruses or other destructive code you are responsible for implementing sufficient procedures and checkpoints to satisfy your particular requirements for anti-virus protection and accuracy of data input and output and for maintaining a means external to our website for any reconstruction of any lost data to the fullest extent provided by law the company hereby disclaims all warranties of any kind whether express or implied statutory or otherwise including but not limited to any warranties of merchantability non-infringement and fitness for particular purpose to the fullest extent provided by law in no event will the company its affiliates or their licensors service providers employees agents officers or directors be liable for damages of any kind under any legal theory arising out of or in connection with your use or inability to use the website any websites linked to it any content on the website or such other websites including any direct indirect special incidental consequential or punitive damages including but not limited to personal injury pain and suffering emotional distress loss of revenue loss of profits loss of business or anticipated savings loss of use loss of goodwill loss of data and whether caused by tort including negligence breach of contract or otherwise even if foreseeable the foregoing does not affect any liability that cannot be excluded or limited under applicable law indemnification you agree to defend indemnify and hold harmless the company its affiliates licensors and service providers and its and their respective officers directors employees contractors agents licensors suppliers successors and assigns from and against any claims liabilities damages judgments awards losses costs expenses or fees including reasonable attorneys fees arising out of or relating to your violation of these terms of use or your use of the website including but not limited to any contribution you make to the website any use of the websites content services and products other than as expressly authorized in these terms of use or your use of any information obtained from the website governing law and venue all matters relating to the website and these terms of use and any dispute or claim arising therefrom or related thereto in each case including non-contractual disputes or claims will be governed by and construed in accordance with the internal laws of the state of minnesota without giving effect to any choice or conflict of law provision or rule any legal suit action or proceeding arising out of or related to these terms of use or the website will be instituted exclusively in the federal or state courts located in hennepin county minnesota you waive any and all objections to the exercise of jurisdiction over you by such courts and to venue in such courts waiver and severability no waiver by the company of any term or condition set out in these terms of use will be effective unless expressly consented to by the company in writing nor will any such waiver be deemed a further or continuing waiver of such term or condition or a waiver of any other term or condition any failure of the company to assert a right or provision under these terms of use will not constitute a waiver of such right or provision if any provision of these terms of use is held by a court or other tribunal of competent jurisdiction to be invalid illegal or unenforceable for any reason such provision will be eliminated or limited to the minimum extent such that the remaining provisions of the terms of use will continue in full force and effect entire agreement the terms of use our privacy notice and our user-generated content terms constitute the sole and entire agreement between you and the company regarding the website and supersede all prior and contemporaneous understandings agreements representations and warranties both written and oral regarding the website your comments and concerns this website is operated by schwans shared services llc 8500 normandale lake boulevard suite 2000 bloominon mn 55437 all notices of copyright infringement claims should be sent to the copyright agent designated in the section above entitled reporting claims of copyright infringement all feedback comments requests for technical support and other communications relating to the website should be directed to
13,contact drayton foods llc skip to content contact us wed love to hear from you if you have questions or comments send us a note with our easy form if you would like to talk to someone you can call us at 701-277-9947 monday â friday 8am â 5pm central time what is your question or comment regarding please choose an option love your product locate a product all other thank you for your interest in drayton foods llc unfortunately we are unable to give coupons out upon request first name: last name: address 1: address 2: state: select state al ak az ar ca co ct de dc fl ga hi id il in ia ks ky la me md ma mi mn ms mo mt ne nv nh nj nm ny nc nd oh ok or pa ri sc sd tn tx ut vt va wa wv wi wy city: zip code: email address: upc code: where is the upc code help locating the upc code can be found on the side of the package it is what the store scans product identification code / proof of purchase where is the product identification code help locating the product identification code / proof of purchase is a 10–digit number that can be found just below the best buy date on the side of the box product name: which stores did you shop at for this product comments: using 500 characters or less please share your comments acceptable characters include letters numbers and special characters: ; = \ : using other characters may cause the form to error phone number: format: xxx-xxx-xxxx sweepstakes social media website unknown source: submit denotes required field
itations, or as we believe is reasonably necessary to comply with applicable law, regulation, legal process or governmental request. In some circumstances we may anonymize your personal information (so that it can no longer be associated with you) for research or statistical purposes, in which case we may use this information indefinitely without further notice to you. IX. MARKETING AND PROMOTIONAL COMMUNICATIONS You may unsubscribe from receiving marketing and promotional messages from Schwan's, if those messages are powered by Schwan's, by following the instructions in those messages. If you decide to unsubscribe, you will still receive non-promotional communications relevant to your use of our Offerings. X. CHILDREN'S ONLINE PRIVACY PROTECTION ACT (COPPA) COMPLIANCE AND RELATED INFORMATION None of our sites are intended for children under 16 years of age. It is our policy to refrain from knowingly collecting or maintaining personal information relating to any person under the age of 16. If you are under the age of 16, please do not supply any personal information through the sites. If you are under the age of 16 and have already provided personal information through the sites, please have your parent or guardian contact us immediately using the information provided under CONTACT INFORMATION so that we can remove such information from our files. If you believe we might have any information from or about a child under 16, please contact us at CONTACT INFORMATION. XI. SECURITY We take reasonable measures, including administrative, technical, and physical safeguards, to protect your information from loss, theft, misuse, and unauthorized access, disclosure, alteration, and destruction. That said the security of personal data transmitted through the internet or via a mobile device can never be guaranteed. We are not responsible for any interception or interruption of any communications through the internet or for changes to or losses of data. We hold information about you both at our own premises and with the assistance of third-party service providers. Further public disclosure here of our security measures could aid those who might attempt to circumvent those security measures. If you are utilizing a web-based login through any Offerings, you are responsible for maintaining the security of any password, user ID, or other form of authentication involved in obtaining access to password protected or secure areas of the Offerings. In order to protect you and your information, we may suspend your account and use of any of the Offerings, without notice, pending an investigation, if any breach of security is suspected. XII. YOUR STATE PRIVACY RIGHTS AND ADDITIONAL DISCLOSURES YOUR PRIVACY RIGHTS Depending on the state in which you reside, you may have certain privacy rights regarding your personal information. Throughout this Notice you will find information required by such state laws regarding the categories of personal information collected from you, the purposes for which we use personal information, and the categories of third parties with which your data may be shared. This information is current as of the date of the Notice and is applicable in the 12 months preceding the last revised date of the Notice. If you are a California resident, please see our âNOTICE TO CALIFORNIA RESIDENTSâ section below. For other state residents, your privacy rights may include (if applicable): The right to confirm whether or not we are processing your personal information and to access such personal information; The right to obtain a copy of your personal information that we collected from and/or about you in a portable and, to the extent technically feasible, readily usable format that allows you to transmit the information to another controller without hindrance, where the processing is carried out by automated means; The right to delete personal information that we collected from and/or about you, subject to certain exceptions; The right to correct inaccurate personal information that we maintain about you, subject to certain exceptions; The right, if applicable, to opt out of the processing of your personal information for purposes of (1) targeted advertising; (2) the âsaleâ of your personal information (as that term is defined by applicable law); and (3) profiling in furtherance of decisions that produce legal or similarly significant effects concerning you; If we are required by applicable law to obtain your consent to process sensitive personal information, the right to withdraw your consent; and The right not to receive discriminatory treatment by us for the exercise of your privacy rights. Requests you make regarding your personal information collected and retained may be subject to certain exceptions. For example, Schwanâs cannot delete your personal information if it is being used as a part of a current contract or transaction. Schwanâs will inform you of such exceptions in its response to your request. Depending on how the applicable privacy law defines a âsale,â we may sell personal information to third parties. For instance, if you are a resident of Colorado or Connecticut, our use of cookies and tracking technologies constitutes a sale of personal information to third-party advertisers. Please note, Schwanâs does not sell, re-sell, distribute for re-sale, or share your personal information except where our use of website tracking technology equates to a âsaleâ of personal information. We also use cookies and other tracking technologies to display advertisements about our products to you on nonaffiliated websites, applications, and online services. This is âtargeted advertisingâ under applicable privacy laws. We do not use personal information for profiling in furtherance of decisions that produce legal or similarly significant effects concerning individuals MAKING A REQUEST AND VERIFICATION If we receive a request from you, we will first make a determination regarding the applicability of your stateâs law, and we will then take steps to verify your identity prior to responding. The steps to verify your identity may vary based on our relationship with you, but, at a minimum for your protection, Schwan's is required to collect certain information from you to verify your identity before we respond to any request submitted by you. To verify any request or exercising of rights described here, you will be required to provide information to verify your identity (e.g., name, address, and e-mail address). Failure to do so could result in Schwan's inability to comply with your request. The information you provide to verify your identity will only be used for verification purposes, and a record of your request, including certain information contained within it, will be maintained by Schwan's for its files. If you would like to exercise your privacy rights and make a request as described here, please use the information provided under CONTACT INFORMATION and contact Schwan's. Depending on your jurisdiction, you may make requests regarding your data one",,,,,,,,,,,,,,,,,,,,,,,,,,,,,,,,,,,,,,,,,,,,,,,,,,,,,,,,,,,,,,,,,,,,,,,,,,,,,,,,,,,,,,,,,,,,,,,,,,,,,,,,,,,,,,,,,,,,,,,,,,,,,,,,,,
