,Data
0,drayton foods llc skip to content our products ▾ ▴ self-rising pizza crusts sheeted pizza crusts dough balls & dough pucks breadsticks dinner rolls employment our story drayton foods llc americas number one frozen dough supplier drayton foods llc pioneered and perfected the self-rising live yeast technology our innovative process provides fresh baked products from raw dough in as little as 10 minutes this freezer to oven convenience has been accepted by the worldâs finest bakers and is instrumental in creating professional bakers from inexperienced employees find your favorite product self-rising pizza crusts sheeted pizza crusts dough balls & dough pucks breadsticks dinner rolls products self-rising pizza crusts sheeted pizza crusts dough balls & dough pucks breadsticks dinner rolls employment our story site map privacy notice cookie notice terms of use contact us careers ca transparency in supply chains act © drayton foods llc
1,drayton foods llc products skip to content drayton foods llc products self-rising pizza crusts drayton foods llc self-rising pizza crusts known for their consistency can be customized to the required weights and sizes for your business while helping you reduce labor waste and preparation time drayton delivers top quality innovation at affordable prices sheeted pizza crusts drayton foods llc sheeted pizza crusts known for their consistency can be customized to the required weights and sizes for your business while helping you reduce labor waste and preparation time drayton delivers top quality innovation at affordable prices dough balls & dough pucks drayton foods llc dough balls and dough pucks are available in all weights and sizes to fit your needs make a hand made product while saving on labor and time of mixing dough breadsticks drayton foods llc breadsticks come in multiple menu options including appetizers entrã©e add-ons and buffets dinner rolls drayton foods llc dinner rolls come in a wide variety of shapes and flavors
2,drayton foods llc self-rising pizza crusts skip to content self-rising pizza crusts drayton foods llc self-rising pizza crusts known for their consistency can be customized to the required weights and sizes for your business while helping you reduce labor waste and preparation time drayton delivers top quality innovation at affordable prices freezer to oven convenience â eliminates thawing and proofing quality and flavor of pizza dough made from scratch our deli pizza crusts have up to a 5 day refrigerated shelf life â perfect for any take-and-bake concept available in traditional flat or rolled edge styles trans fat free formulas available contact us today
3,drayton foods llc sheeted pizza crusts skip to content sheeted pizza crusts drayton foods llc sheeted pizza crusts known for their consistency can be customized to the required weights and sizes for your business while helping you reduce labor waste and preparation time drayton delivers top quality innovation at affordable prices provides a natural non-proofed dough option that allows you to proof naturally ferment top and bake gives a hand tossed appearance with impressive flavor multiple menu options such as thin crust calzones and strombolis trans fat free formulas available contact us today
4,drayton foods llc dough balls & dough pucks skip to content dough balls & dough pucks drayton foods llc dough balls and dough pucks are available in all weights and sizes to fit your needs make a hand made product while saving on labor and time of mixing dough contact us today
5,drayton foods llc breadsticks skip to content breadsticks drayton foods llc breadsticks come in multiple menu options including appetizers entrã©e add-ons and buffets consistent size and shape every time allows you to create your own signature item variety of sizes and flavors customized to your needs freezer to oven convenience â eliminates thawing and proofing great grab-n-go meal option ideal for restaurants and c-stores contact us today
6,drayton foods llc dinner rolls skip to content dinner rolls drayton foods llc dinner rolls come in a wide variety of shapes and flavors available in freezer to oven or proof and bake formulas saves time and labor â no mixing required consistent quality with homemade taste perfect for breakfast lunch or dinner contact us today
7,employment at drayton foods llc skip to content employment work environment our environment is fast-paced and full of growth potential we are always looking for goal-oriented people to join our team and make a difference drayton offers a variety of jobs with various levels of responsibility and accountability our hours can work with anyones schedule we have 3 shifts: day swing and overnight if you are ready to grow join team drayton view current openings
8,about drayton foods llc skip to content our story quality drayton foods llc recognizes the importance of producing a wholesome product for all consumers it is with this in the forefront of our thinking that we aggressively maintain a food safety and quality assurance program which strives to protect all consumers all products produced will be scrutinized to ensure they conform to company legal and governmental standards to the best of our ability in an effort to maintain compliance with the food safety modernization act as well as achieve certification in the global standard for food safety through the british retail consortium brc drayton foods llc has several quality assurance & quality control programs in place that assist in maintaining outstanding audit scores these programs include but are not limited to the following: food safety hazard analysis and critical control points & good manufacturing practices food defense food and drug administrations employee first alert program pre-operational checks & line inspections qa audits of raw and frozen product and processing attributes incoming and outgoing shipping receiving audits defined handling of allergic material program child nurtritional certification program and labeling verification cataloged retention samples our commitment to our customers at drayton foods llc were inspired every day by how our customers use our products for creative solutions in menu planning food design / development and the breakthrough for new concepts in our industry we run our business with the founding principal that if the customer first succeeds the partnership will succeed were committed to our customers and believe our five departments ensure this success sales: our national team of trained sales personnel offer hands on experience with our customers to build a complete understanding of their business and unique needs marketing: our marketing department works to internally develop our customers needs with our own company strenhs research and development: once identified through sales and marketing the goals of our customers become our own and our fully staffed r&d team goes to work on building solutions manufacturing operations and logistics: from purchase order to final delivery our process of managing our customers orders is âhands onâ at all stages with the most innovative technologies being used we strive for nothing less than perfection at all stages of the order process quality assurance: with the fast pace of todays business there is no margin for error our quality assurance department has established itself as an industry leader and continues to train adapt and innovate to stay at the forefront of the ever changing regulations requirements and consumer demands we exist for our customers success which in turn guarantees our success
9,draytonfoodscom site map skip to content site map home our products self rising pizza crusts sheeted pizza crusts dough balls & dough pucks breadsticks dinner rolls employment our story privacy notice terms of use contact us request to know/request to delete
10,drayton foods llc privacy notice skip to content privacy notice aviso de privacidad â mã©xico privacy notice â mexico last revised: september 12 2023 schwans company and its subsidiaries collectively schwans respect your privacy and are committed to protecting it through our compliance with applicable laws and this privacy notice notice this notice describes how schwans collects uses discloses transfers stores retains or otherwise processes your information when you whether in your individual or business capacity access or use in any manner any content products or related activities collectively offerings as well as offerings through its affiliates that might take place on websites owned and/or operated by schwans or through other channels the internet domains owned and/or operated by schwans include but are not limited to:
11,drayton foods llc cookie notice skip to content cookie notice last revised: january 1 2023 this cookie notice applies to any web page operated by or on behalf of schwanâs company or its subsidiaries collectively âschwanâsâ which may include other interactive properties linked through this and other web pages âschwanâs offeringsâ or âofferingsâ references in this cookie notice to âweâ and through similar words such as âusâ âourâ etc refer to schwanâs as the operator and distributor of the offerings by clicking to accept cookies you are consenting to our use of cookies and similar technologies in accordance with this cookie notice and as further described by following the link to our cookie management page if you do not agree to our use of cookies and similar technologies you can modify your cookies settings or opt out of âsharingâ for cross context advertising as defined by california and similar terms under other states laws for the schwanâs offerings by clicking here although you are not required to accept cookies when you visit the schwanâs offerings please be aware that restricting cookies may impact how the offerings operate for you and you may be unable to use all of the functionality of the offerings if you reject certain cookies the website tools we use or allow are an accepted part of e-commerce and important to your use of the schwanâs offerings like many online platforms schwans and its analytics vendors use server logs and automated data collection tools such as browser cookies pixel tags scripts and web beacons these tools are used for analytics purposes to enable schwans to understand how users interact with the offerings including the sites the information collected by cookies does not explicitly identify you but some information may be considered personal information in certain jurisdictions; it includes but is not limited to general information about your computer settings your connection to the internet eg operating system and platform ip address your browsing patterns and timings of browsing on the website and your location schwans and its analytics vendors may also tie the information gathered by the website tools to the identity of users location data may be collected through targeting cookies and is typically used for purposes such as providing targeted advertisements that are relevant to your geographical location but will not provide precise location information further details about the types of cookies that schwanâs utilizes can be found below any personal information you do provide to us through the offerings would be governed by schwanâs privacy notice i what is a cookie cookies and similar technologies like pixels web beacons etc are pieces of data issued by a website that among other things allow your computer to utilize all the features on the website if and when your computer accepts a cookie the cookie may be stored on the computerâs hard drive below we provide more information about the specific types of cookies utilized by the schwanâs offerings and what those cookies do ii what data is collected by cookies each time a computer visits the schwanâs offerings we may collect certain data from that computer this data is automatically collected from the computerâs web browser and may include data such as the following: the type of web browser software the computer uses for example google chrome or internet explorer; the name of the domain from which the computer accessed the internet; the internet address of the website from which the computer linked directly to the schwanâs offering; the date and time the computer accessed the offering we may use this data to help us make the schwanâs offerings more useful to you and for other business purposes for example we may tell business partners how many computers visited the offerings or what pages were most popular we may prepare reports and other materials using the data we may use this data for any other purposes as described herein and may share the data with third parties iii what kind of cookies do the schwanâs offerings use session cookies are used to identify a particular visit to schwans offerings and collect information about your interaction with those offerings these cookies expire after a short time or when the user closes their web browser after using the sites schwans uses these cookies to identify a user during a single browsing session this helps schwans improve the offerings including the sites as well as improve the users browsing experience a persistent cookie will remain on a users device for a set period of time specified in the cookie or until you manually delete your cookies via your browser these cookies do not expire when you close your browser by assigning your computer a unique identifier through a persistent cookie we are able to create a database of your previous choices and preferences which can be provided by us automatically saving you time and effort on future visits in addition schwans may use tracking technology to determine if a certain page was visited or whether an email sent by schwans was opened or clicked on by a user and to customize the experience of individual users by recommending specific content 1 strictly necessary cookies strictly necessary cookies enable basic functions on the schwanâs offerings like page navigation and access to secure areas of the offerings the schwanâs offerings cannot function properly without these cookies as such necessary cookies will always be collected regardless of your cookie settings necessary cookies are used for the following purposes including: preserving your website session state across page requests; distributing traffic to the schwanâs offerings across several servers in order to optimize response times and improve your website experience; identifying trusted web traffic to keep the schwanâs offerings secure; storing your cookie consent state for the current schwanâs offerings youâre visiting 2 functional/preference cookies functional also referred to as preference cookies which are a type of persistent cookie enable the schwanâs offerings to remember information that changes the way the website behaves or looks during your experience like your preferred language the font text appears in or the region that youâre located in preference cookies are used to establish a unique user id that recognizes you on returning visits in order to improve and personalize your website experience for example schwanâs uses preference cookies in the following ways: provide a more personalized experience to users with more relevant content and content recommendations; allow users to more easily log in to use the offerings; remember information about a users browser and settings preferences such as preferred language to make the experience more functional and customized; make the experience of using the offerings better like remembering the sound volume level selected by the user; test different versions of the offerings to see which particular features or content users prefer to optimize the sites; and authentication and security cookies to enable you to log in or stay logged in to access the sites protect user accounts against fraudulent log-ins by others and help detect and protect against abuse or unauthorized usage of user accounts 3 performance/statistics cookies performance also referred to as âstatisticsâ cookies help us understand how visitors interact with the schwanâs offerings by collecting and reporting information anonymously statistics cookies are used for the following purposes: anonymously logging details about your browser and computer through a website like google analytics; collecting anonymous data on your visits to the schwanâs offerings such as the number of visits average time spent on the website and what pages have been loaded in order to generate reports for optimizing the schwanâs offerings content; determining what type of device smartphones tablets computers tvs etc is being used to access the schwanâs offerings; and gathering anonymous technical information regarding your browser operating system ip address and screen resolution as well as your navigation on the website 4 targeting/advertising cookies targeting also referred to as âadvertisingâ or âmarketingâ cookies are used to track visitors across the schwanâs offerings and possibly other websites the intention is to display ads that are relevant and engaging for each individual user of the schwanâs offerings you may opt out of the collection of marketing cookies at any time marketing cookies are used for the following purposes: registering a unique id that identifies your device for the purpose of targeted ads auto-populating forms validating if certain contact information is correct keeping statistics about third party sites used/accessed through the schwanâs offerings; registering anonymized user data such as ip address geographical location visited websites and what ads you have clicked with the purpose of optimizing ad display based on your movement on websites that use the same ad network; collecting data on your visits to the website such as what pages have been accessed number of visits average time spent on the website in order to categorize your interest and demographic profiles in terms of resales for targeted marketing identifying traffic patterns on the schwanâs offerings and carrying out surveys to better understand your preferences; evaluating efficacy of advertisements and likelihood of groups to engage with the schwanâs offerings and purchase schwanâs products or services; and registering your sharing of content via social media iv do third parties get my cookie information schwanâs may use service providers to provide site metrics and other analytics services for example: reviewing and analyzing user browser and wireless device technical information; reviewing user activity across sites for example schwans analyzes trends user traffic and usage information to determine the performance of content research reports or events; measuring tracking and analyzing trends and usage in connection with your use or the performance of our offerings; and determining the popularity of certain content and to better understand how you use our sites we and/or such third parties also may use these technologies to collect information about your online activities over time and across third-party websites or other online services behavioral tracking additionally our sites may include social media features such as the facebook like button our integration of these features may allow third-party social media to collect certain information such as your ip address and which pages you are visiting when using our sites and to set a cookie to enable that feature to function properly your interactions with these features are governed by the privacy policy of the company providing such features the service providers that we engage are bound by confidentiality obligations and other restrictions with respect to their use and collection of your information v third party ad networks schwanâs may use third parties such as network advertisers to serve advertisements on third party websites or other media for example a third-party social networking website this enables schwanâs and these third parties to target advertisements on those third-party websites to you for products offered by us and products and websites offered by third parties in which you might be interested third party ad network providers advertisers sponsors and/or traffic measurement websites may use cookies javascript web beacons flash cookies or local shared objects and other tracking technologies to measure the effectiveness of their ads and to personalize advertising content to you this cookie notice does not apply to those third parties and we cannot control their activities you should consult the respective privacy or cookie policies of these third-party ad servers or ad networks for more information on their practices and for instructions on how to opt-out of certain practices for example you may go to the digital advertising alliance âdaaâ consumer choice page for information about opting out of interest-based advertising and choices regarding having information used by daa companies you may also go to the network advertising initiative ânaiâ consumer opt-out pagefor information about opting out of interest-based advertising and choices regarding having information used by third party companies who are nai members opting out from one or more companies listed on the daa consumer choice page or the nai consumer opt-out page will remove you from those companiesâ delivery of interest-based content or ads to you but it does not mean you will no longer receive any advertising through the schwanâs offerings or on other third party websites even if you opt-out from one or more companies listed on the daa consumer choice page or the nai consumer opt-out page you may continue to receive advertisements for example based on the particular website that you are viewing ie contextually based ads also if your browsers are configured to reject cookies when you opt-out on the daa or nai websites your opt-out action may not be effective additional information is available on the daaâs website atwwwaboutadsinfo or the naiâs website at
