,Data
33,"Locations | WestRock Skip to content Our Packaging Solutions Markets Beauty & Personal Care Beverage Commercial Print E-commerce Food Foodservice Healthcare Home & Garden Luxury Packaging Media & Electronics Retail Tobacco Products Corrugated Solutions Corrugated Containers Displays Consumer Packaging Solutions Folding Cartons Specialty Printing & Packaging Recycling Solutions Recycling Machinery Solutions Automation Paper Solutions Containerboard Kraft Paper Paperboard Pulp Our Sustainability Story Sustainability Sustainability Supporting People & Communities Innovating to Serve Our Customers Bettering the Planet Data & Resource Center Sustainable Forestry Innovation Innovation Insights Sustainability Highlight EcoPush® A sustainable alternative to traditional single use plastics Learn More Our Company About WestRock About WestRock Careers Locations Investors Community Diversity Resources Customer Experience Forest Resources Supplier Resources Employee Resources Government Relations Top News Blog News Awards Connect With Us Facebook Twitter LinkedIn Instagram YouTube Contact Us English Français Español Português 简体中文 Search English Français Español Português 简体中文 Home Locations Search Our Locations Filters Distance Kilometers Miles Any Distance 25 50 100 200 500 from Sort By: Disabled. Please configure the distance resources component. Collapse Footer Menu Markets Beauty & Personal Care Beverage Commercial Printing E-commerce Food Foodservice Healthcare Home & Garden Luxury Packaging Media & Electronics Retail Tobacco Consumer Packaging Solutions Folding Cartons Specialty Printing & Packaging Partitions & Protective Packaging Machinery Solutions Automation Corrugated Solutions Corrugated Containers Merchandising Displays Paper Solutions Containerboard Kraft Paper Paperboard Pulp Regions Brazil China India Japan Mexico Company Careers Insights Sustainability Customer Resources Supplier Resources Employee Resources Forest Resources News Investors Government Relations Contact Us Expand English Français Español Português 简体中文 Cookie Settings © 2023 WestRock Company. WESTROCK, WestRock and Design, and the WestRock Logo are trademarks owned by WestRock Company. All rights reserved. Privacy | Legal | Cookies | Accessibility"
34,"WestRock Corporate Giving | Economic and Environmental Sustainability Skip to content Our Packaging Solutions Markets Beauty & Personal Care Beverage Commercial Print E-commerce Food Foodservice Healthcare Home & Garden Luxury Packaging Media & Electronics Retail Tobacco Products Corrugated Solutions Corrugated Containers Displays Consumer Packaging Solutions Folding Cartons Specialty Printing & Packaging Recycling Solutions Recycling Machinery Solutions Automation Paper Solutions Containerboard Kraft Paper Paperboard Pulp Our Sustainability Story Sustainability Sustainability Supporting People & Communities Innovating to Serve Our Customers Bettering the Planet Data & Resource Center Sustainable Forestry Innovation Innovation Insights Sustainability Highlight EcoPush® A sustainable alternative to traditional single use plastics Learn More Our Company About WestRock About WestRock Careers Locations Investors Community Diversity Resources Customer Experience Forest Resources Supplier Resources Employee Resources Government Relations Top News Blog News Awards Connect With Us Facebook Twitter LinkedIn Instagram YouTube Contact Us English Français Español Português 简体中文 Search English Français Español Português 简体中文 Home Company Community WestRock Corporate Giving WestRock connects our communities to economic and environmental sustainability. We make strategic investments to conserve forests and build the manufacturing workforce of the future. We're unboxing good in our own backyard.At WestRock, we care about our communities. We want them to be vibrant and prosperous – places where our more than 58,000 employees and their families can live, work and play.We invest in our communities through programmatic grants that align with our strategic areas of focus – developing a workforce skilled for a successful career in advanced manufacturing and protecting forests and urban tree canopies.We also partner with local organizations through sponsorship of community events and programs and when our team members give back to their communities through volunteerism and financial donations,we recognize their generosity through our Matching Gifts and Grants for Volunteers programs. Connecting with WestRock We always enjoy connecting with our neighbors to learn about great events and programs in our communities. If you are interested in sharing information about your organization with our team, follow the guidelines below to reach us.Local event sponsorshipIf you would like to share event sponsorship information with one of our local teams, feel free to contact them directly or click here to send the information to our home office and we will forward to them. Be sure to include the address of the WestRock location you’re trying to reach, keeping in mind that we generally focus our sponsorships within the communities immediately surrounding our facilities. Programmatic grantIn addition to local sponsorships, we partner to create greater awareness for careers in advanced manufacturing and ensure the workforce of tomorrow has the skills necessary for a successful start in the industry. We also invest in strategic projects that protect forests and urban tree canopies, ensuring family landowners have access to education and resources to manage their land sustainably and that all members of a community have equitable access to the health and environmental benefits of thriving tree canopies.We are currently partnering with several organizations aligned with our strategic areas of focus and are not actively seeking new partners at this time. However, we are always happy to learn about prospective partners that align with our strategic areas of focus and accept letters of introduction year-round and keep them on-file in case we have an opportunity to consider a new partner. We value your time, so please ensure your letter of introduction is no more than two pages and outlines your organization’s mission and operational footprint and highlights a success story that aligns with WestRock’s strategic areas of focus. Letters can be sent to our Corporate Giving team by clicking here. Employee programsWestRock team members, and their spouse/domestic partners, are eligible to leverage our Matching Gifts and Grants for Volunteers programs to enhance their personal community engagement. Current team members can use the button below to log on to the community engagement portal. SIGN-IN Related Articles A shared passion for forests 09/09/2022 Advancing social equity through forestry 02/21/2023 WestRock Partners with Atlanta Braves for a Recycling Home Run 09/23/2021 Our Employee Relief Fund provides financial assistance to team members who suffer hardship due to a natural or man-made disaster. Since the Fund was established in 2005, more than 1,200 grants totaling more than $2.9 million have been provided to WestRock teammates. Learn More Collapse Footer Menu Markets Beauty & Personal Care Beverage Commercial Printing E-commerce Food Foodservice Healthcare Home & Garden Luxury Packaging Media & Electronics Retail Tobacco Consumer Packaging Solutions Folding Cartons Specialty Printing & Packaging Partitions & Protective Packaging Machinery Solutions Automation Corrugated Solutions Corrugated Containers Merchandising Displays Paper Solutions Containerboard Kraft Paper Paperboard Pulp Regions Brazil China India Japan Mexico Company Careers Insights Sustainability Customer Resources Supplier Resources Employee Resources Forest Resources News Investors Government Relations Contact Us Expand English Français Español Português 简体中文 Cookie Settings © 2023 WestRock Company. WESTROCK, WestRock and Design, and the WestRock Logo are trademarks owned by WestRock Company. All rights reserved. Privacy | Legal | Cookies | Accessibility"
35,"Diversity, Inclusion, Equity and Belonging at WestRock Skip to content Our Packaging Solutions Markets Beauty & Personal Care Beverage Commercial Print E-commerce Food Foodservice Healthcare Home & Garden Luxury Packaging Media & Electronics Retail Tobacco Products Corrugated Solutions Corrugated Containers Displays Consumer Packaging Solutions Folding Cartons Specialty Printing & Packaging Recycling Solutions Recycling Machinery Solutions Automation Paper Solutions Containerboard Kraft Paper Paperboard Pulp Our Sustainability Story Sustainability Sustainability Supporting People & Communities Innovating to Serve Our Customers Bettering the Planet Data & Resource Center Sustainable Forestry Innovation Innovation Insights Sustainability Highlight EcoPush® A sustainable alternative to traditional single use plastics Learn More Our Company About WestRock About WestRock Careers Locations Investors Community Diversity Resources Customer Experience Forest Resources Supplier Resources Employee Resources Government Relations Top News Blog News Awards Connect With Us Facebook Twitter LinkedIn Instagram YouTube Contact Us English Français Español Português 简体中文 Search English Français Español Português 简体中文 Home Company Diversity Diversity, Inclusion, Equity and Belonging at WestRock WestRock will be a company where each of us genuinely belongs, is respected and valued, can do our best work, and where diversity, inclusion and equity are competitive advantages.​ WestRock Resource Groups Our seven WestRock Resource Groups (WRGs) bring an inclusive perspective to our company, the business and each other. They offer innovative ideas for change, increase employee engagement and are essential to our business success. AABA African American/Black + Allies African American/Black + Allies To foster the success of African-American/Black employees at WestRock through personal and professional development, engagement, service and integrate aspects of our rich, diverse culture across the enterprise. Differing Abilities Differing Abilities, Caregivers + Allies Differing Abilities, Caregivers + Allies Institute a team that supports an inclusive workplace for individuals with differing abilities and their caregivers where they feel safe and valued, while also creating an environment where these individuals feel as if they belong and are accepted. Early Careers Early Careers + Allies Early Careers + Allies To connect, develop and empower WestRock’s next leaders by creating opportunities for both professional and personal growth to enable a diverse and inclusive workplace for the future. OLA Organization for Latinx/Hispanic Advancement + Allies Organization for Latinx/Hispanic Advancement + Allies To support WestRock’s Diversity & Inclusion mission to be a company committed to equity, where we Latinx/Hispanics genuinely belong, are respected and valued, and can do our best work, and where diversity and inclusion are competitive advantages. PRIDE PRIDE + Allies PRIDE + Allies To be a strategic partner between WestRock and the LGBTQIA+ community focused on promoting a culture of Professionalism, Respect, Integrity, Diversity, and Excellence through inclusion, education, and trust. W+A Women + Allies Women + Allies The Women + Allies (W+A) Resource Group is committed to the advancement of women across WestRock. We engage women and allies through professional development, mentoring, and sponsorship, to amplify our accelerated approach to diversity and inclusion. As we promote equity, we maximize the impact on our businesses, our customers, and the communities we serve. WVET Veterans Engagement Team + Allies Veterans Engagement Team + Allies Create WestRock veterans and allies community to attract, retain, develop and showcase the skills of the military veterans in our business while engaging and providing support in the veteran communities where we operate. Advancing DIEB at WestRock Advancing DIEB at WestRock Throughout WestRock, we seek to advance our diversity, inclusion, equity and belonging work focusing on three main areas:EducationEngagementRecruitmentClick through to learn more about how each supports our progress towards our goals. Education Education In 2021, 86% of all WestRock managers participated in inclusive leadership training. This training increases awareness of some of the challenges team members face and builds capabilities key to leading more inclusive teams and organizations. WestRock also designed a new learning experience called “Blind Spots,” which teaches both hourly and salaried team members how to identify and address unconscious biases. In 2022, we finished very strong with Blind Spots training: 102 US sites trained, 62% of hourly workforce and 82% of salaried workforce trained. Close Engagement Engagement Our WestRock Resource Groups (WRGs) continue to grow and have positive effects within our company. After launching five WRGs in 2020 (African American Black + Allies, Early Careers + Allies, WestRock Veterans + Allies and Women + Allies) we added two more in 2021: P.R.I.D.E. + Allies (LGBTQIA+) and Differing Abilities, Caregivers + Allies. The WRGs, which have an intentional focus on allyship, had a combined membership of more than 4,300 teammates around the globe as of January 2023. Our WRGs continue to be impactful to the overall business - team members belonging to at least one resource group scored 9 points higher on the FY22 Employee Engagement Survey Index compared to those that do not belong to a resource group. Close Recruitment Recruitment WestRock’s talent acquisition team and programs focused on increasing our diverse hiring – overall, on college campuses, in our rotational programs and through veteran and military programs. A variety of efforts, including posting open positions both internally and externally, seeking diverse slates of candidates and establishing diverse interview panels, made a notable impact on our overall results. Our external partnerships continue to expand with 7 Historically Black Colleges and Universities (HBCUs) along with advanced military and veteran recruiting: 857 hires in FY22 with 7% of our U.S. workforce self-identifying as veterans. Close Advancing DIEB at WestRock Throughout WestRock, we seek to advance our diversity, inclusion, equity and belonging work focusing on three main areas:EducationEngagementRecruitmentClick through to learn more about how each supports our progress towards our goals. External Partnerships WestRock partners with external organizations aligned with our values to help maximize impact and reach. CALIBR Global Leadership NetworkThe Executive Leadership CouncilSociety of Women Engineers Thurgood Marshall College FundThe Valuable 500 Women in Manufacturing Collapse Footer Menu Markets Beauty & Personal Care Beverage Commercial Printing E-commerce Food Foodservice Healthcare Home & Garden Luxury Packaging Media & Electronics Retail Tobacco Consumer Packaging Solutions Folding Cartons Specialty Printing & Packaging Partitions & Protective Packaging Machinery Solutions Automation Corrugated Solutions Corrugated Containers Merchandising Displays Paper Solutions Containerboard Kraft Paper Paperboard Pulp Regions Brazil China India Japan Mexico Company Careers Insights Sustainability Customer Resources Supplier Resources Employee Resources Forest Resources News Investors Government Relations Contact Us Expand English Français Español Português 简体中文 Cookie Settings © 2023 WestRock Company. WESTROCK, WestRock and Design, and the WestRock Logo are trademarks owned by WestRock Company. All rights reserved. Privacy | Legal | Cookies | Accessibility"
36,"Customer Experience | WestRock Skip to content Our Packaging Solutions Markets Beauty & Personal Care Beverage Commercial Print E-commerce Food Foodservice Healthcare Home & Garden Luxury Packaging Media & Electronics Retail Tobacco Products Corrugated Solutions Corrugated Containers Displays Consumer Packaging Solutions Folding Cartons Specialty Printing & Packaging Recycling Solutions Recycling Machinery Solutions Automation Paper Solutions Containerboard Kraft Paper Paperboard Pulp Our Sustainability Story Sustainability Sustainability Supporting People & Communities Innovating to Serve Our Customers Bettering the Planet Data & Resource Center Sustainable Forestry Innovation Innovation Insights Sustainability Highlight EcoPush® A sustainable alternative to traditional single use plastics Learn More Our Company About WestRock About WestRock Careers Locations Investors Community Diversity Resources Customer Experience Forest Resources Supplier Resources Employee Resources Government Relations Top News Blog News Awards Connect With Us Facebook Twitter LinkedIn Instagram YouTube Contact Us English Français Español Português 简体中文 Search English Français Español Português 简体中文 Home Company Customer Experience Jump to a section Intro Partnerships in action Subscribe Back to the top Customer experience WestRock helps our customers succeed through innovation, quality and service. We dream big about the future of packaging, we act boldly: taking risks, learning from experience and thinking long term. Working with WestRock WestRock is more than a supplier. We’re a partner. Working in close collaboration with our customers, our industry-leading innovation engine is creating the next generation of renewable, recyclable packaging. By putting our customers first, we work together to meet the most pressing business challenges, supply chain complexities and sustainability goals. Your packaging partner Your packaging partnerWe believe in the power of fiber-based packaging to drive a more sustainable future. WestRock helps our customers overcome today’s challenges and capture opportunities so they can achieve their business and sustainability goals.We partner with our customers and together, we:Identify your business and sustainability hurdlesInnovate packaging and automation solutionsCreate shared value for your company and stakeholdersWorking with WestRock means tapping into a talented, committed team with expertise in your specific industry. It means engaging in a dynamic partnership together with innovative, strategic, and dependable thinkers. WestRock’s partnership and innovative solutions have played a key part in our objective to positively impact the environment and our communities. Jenny Fouracre-Petko, director of public relations, Domino's Partnerships in Action Asahi Breweries First Japanese User of WestRock CanCollar® Eco Packaging 10/08/2021 Swiss Chalet partners with WestRock to launch recyclable paperboard packaging 01/14/2022 WestRock partners with Budějovicky Budvar and Mattoni 1873 to advance circularity efforts in Czech Republic beverage industry 08/09/2022 WestRock and Domino’s partnered to educate on pizza box recycling 09/22/2022 Additional Resources It’s easy to work with WestRock. Please contact us if you don’t find what you need here. Contact Us Quick Links Forms Safety Data SheetsTerms and Conditions of SaleAccess W-9s Order Centers Paperboard OnlinePackaging Systems Order Center Client Zone (former RockTenn customer tools)Panama City TariffPanama City Berth ApplicationSOS Portal (Dallas/St. Paul only) Thank You! Subscribe for more! Subscribe to receive product and industry content straight to your inbox. *This is required to submit this form. Connect Collapse Footer Menu Markets Beauty & Personal Care Beverage Commercial Printing E-commerce Food Foodservice Healthcare Home & Garden Luxury Packaging Media & Electronics Retail Tobacco Consumer Packaging Solutions Folding Cartons Specialty Printing & Packaging Partitions & Protective Packaging Machinery Solutions Automation Corrugated Solutions Corrugated Containers Merchandising Displays Paper Solutions Containerboard Kraft Paper Paperboard Pulp Regions Brazil China India Japan Mexico Company Careers Insights Sustainability Customer Resources Supplier Resources Employee Resources Forest Resources News Investors Government Relations Contact Us Expand English Français Español Português 简体中文 Cookie Settings © 2023 WestRock Company. WESTROCK, WestRock and Design, and the WestRock Logo are trademarks owned by WestRock Company. All rights reserved. Privacy | Legal | Cookies | Accessibility"
