,Data
18,"Packaging Machinery & Automation | Corrugated and Paperboard Packaging Systems Skip to content Our Packaging Solutions Markets Beauty & Personal Care Beverage Commercial Print E-commerce Food Foodservice Healthcare Home & Garden Luxury Packaging Media & Electronics Retail Tobacco Products Corrugated Solutions Corrugated Containers Displays Consumer Packaging Solutions Folding Cartons Specialty Printing & Packaging Recycling Solutions Recycling Machinery Solutions Automation Paper Solutions Containerboard Kraft Paper Paperboard Pulp Our Sustainability Story Sustainability Sustainability Supporting People & Communities Innovating to Serve Our Customers Bettering the Planet Data & Resource Center Sustainable Forestry Innovation Innovation Insights Sustainability Highlight EcoPush® A sustainable alternative to traditional single use plastics Learn More Our Company About WestRock About WestRock Careers Locations Investors Community Diversity Resources Customer Experience Forest Resources Supplier Resources Employee Resources Government Relations Top News Blog News Awards Connect With Us Facebook Twitter LinkedIn Instagram YouTube Contact Us English Français Español Português 简体中文 Search English Français Español Português 简体中文 Packaging Machinery & Automation | Corrugated and Paperboard Packaging Systems Jump to a section Automation Options Back to the top Contact Us Request Information Packaging equipment for efficiency and flexibilityWhen market dynamics demand innovation and speed to market, you need a packaging supplier who goes beyond materials to help you commercialize ideas into manufacturable solutions, implemented efficiently by world class automation. As a market leader in fiber-based packaging equipment, WestRock offers a broad portfolio of differentiated, sustainable, innovative solutions to address your industry and channel pressures.Our expertise in packaging design to automation provides you the lowest total cost of ownership by performance matching the right substrate, design, and equipment, ensuring world-class uptime, optimized labor resources and future-proof flexibility. Extending through the life of the placement, our partnership guarantees industry leading after-market service support, and responsive adaptation to your changing needs. CORRUGATED PACKAGING MACHINERY PAPERBOARD PACKAGING MACHINERY E-COMMERCE AND RIGHT-SIZE PACKAGING MACHINERY Parts and service CORRUGATED PACKAGING MACHINERY Efficiency, optimized.How do you improve production line performance and optimize your supply chain? WestRock answers this challenge with innovative structural designs and advanced technologies. From single case erectors to fully integrated line designs, we provide custom turnkey solutions and expertise that go beyond the box to positively impact your bottom line. EXPLORE OUR AUTOMATED PACKAGING SYSTEMS PORTFOLIO PAPERBOARD PACKAGING MACHINERY Complexity, simplified.Today’s packaging demands are more complex than yesterday’s. Consumers demand more variety and retailers expect more choices. More than ever, today’s leading food and beverage manufacturers depend on multipack machinery to streamline operations and deliver on a range of varied demands. EXPLORE OUR MULTIPACK PACKAGING SYSTEMS E-COMMERCE AND RIGHT-SIZE PACKAGING MACHINERY Make any box, sized right, every time–on site and on demand. EXPLORE OUR BOX ON DEMAND SOLUTIONS Pak On Demand™ Mailer System creates a lightweight, curbside recyclable mailer on demand and seals the package for shipment. Explore Our Pak On Demand Solutions Parts and service Where you need us, when you need us.WestRock is committed to providing top-tier support through a full range of services including parts, technical support, installation and more.Keeping your operations running is our goal. That’s why our dedicated team is available 24 hours a day, 7 days a week. PARTS AND SERVICES CONTACT OUR PRODUCT EXPERTS Collapse Footer Menu Markets Beauty & Personal Care Beverage Commercial Printing E-commerce Food Foodservice Healthcare Home & Garden Luxury Packaging Media & Electronics Retail Tobacco Consumer Packaging Solutions Folding Cartons Specialty Printing & Packaging Partitions & Protective Packaging Machinery Solutions Automation Corrugated Solutions Corrugated Containers Merchandising Displays Paper Solutions Containerboard Kraft Paper Paperboard Pulp Regions Brazil China India Japan Mexico Company Careers Insights Sustainability Customer Resources Supplier Resources Employee Resources Forest Resources News Investors Government Relations Contact Us Expand English Français Español Português 简体中文 Cookie Settings © 2023 WestRock Company. WESTROCK, WestRock and Design, and the WestRock Logo are trademarks owned by WestRock Company. All rights reserved. Privacy | Legal | Cookies | Accessibility"
19,"Containerboard Products | Full Suite of Containerboard Offerings | WestRock Containerboard Solutions Skip to content Our Packaging Solutions Markets Beauty & Personal Care Beverage Commercial Print E-commerce Food Foodservice Healthcare Home & Garden Luxury Packaging Media & Electronics Retail Tobacco Products Corrugated Solutions Corrugated Containers Displays Consumer Packaging Solutions Folding Cartons Specialty Printing & Packaging Recycling Solutions Recycling Machinery Solutions Automation Paper Solutions Containerboard Kraft Paper Paperboard Pulp Our Sustainability Story Sustainability Sustainability Supporting People & Communities Innovating to Serve Our Customers Bettering the Planet Data & Resource Center Sustainable Forestry Innovation Innovation Insights Sustainability Highlight EcoPush® A sustainable alternative to traditional single use plastics Learn More Our Company About WestRock About WestRock Careers Locations Investors Community Diversity Resources Customer Experience Forest Resources Supplier Resources Employee Resources Government Relations Top News Blog News Awards Connect With Us Facebook Twitter LinkedIn Instagram YouTube Contact Us English Français Español Português 简体中文 Search English Français Español Português 简体中文 Containerboard Jump to a section DiamondTop® FeatherWeight™ Enduraliner™ and EnduraFlute™ Hyperform™ and Fibrelok® Contact Back to the top Contact Us Get more information CONTAINERBOARD A leading portfolio of containerboard grades engineered for your packaging needs Your goals quickly become ours. That’s the WestRock difference. And while we are a global leading producer of containerboard, our greatest asset is our people. And their greatest focus is you. The challenges you face. The solutions you seek. The goals you set. Each of these pursuits drives each and every person at WestRock.From people to product, reliability remains consistent at WestRock. No matter your need, chances are strong we can meet it. After all, we have an unparalleled portfolio of superior and proven containerboard solutions. A long tenure in the corrugated packaging industry means we get you. Your goals. Your challenges. Your product needs. Contact Us DIAMONDTOP® When you need it to be right, every time. When reliable print quality matters. When appearance and smoothness demand consistency. Then, rely on DiamondTop®. Constant quality is woven into every roll to ensure printed graphics of the highest quality. Whether your package is headed to a warehouse or directly to a retail shelf, graphics get noticed with our DiamondTop®. DiamondTop® Uncoated DiamondTop® Uncoated DiamondTop® is a multi-ply sheet with a white printing surface over a kraft base sheet. Designed for post print and direct print applications, DiamondTop® provides a smooth, bright surface for high quality, multicolor graphics typically used in retail-ready corrugated consumer packaging. DiamondTop® 1C DiamondTop® 1C DiamondTop® 1C enables high print gloss and rich ink density and offers reliable and consistent runnability and convertibility. Featuring a light clay coating, it’s post-printable in many cases without the aid of dryers and it’s suitable for the graphic demands of preprint applications. DiamondTop® 2C DiamondTop® 2C DiamondTop® 2C is a solid bleached sulfate (SBS) sheet designed specifically for the demands of roll-fed, preprint, flexographic printing. Offering a smooth, bright, double clay-coated printing surface, DiamondTop® 2C enables high-quality printability for outstanding graphic reproduction. Engineered for strength, it resists cracking while meeting box ECT requirements. DiamondTop® High Performance DiamondTop® High Performance DiamondTop® High Performance offers the high-quality printability of DiamondTop® with the performance of standard liners, but at lower basis weights. DiamondTop® Solid DiamondTop® Solid DiamondTop® Solid is excellent for applications where the highest levels of print gloss are not required. It features a single-ply sheet of bleached fibers produced with moderate calendaring, and an added surface treatment ensures optimal ink hold-out. This linerboard is ideal for solid coverage printing and it is also well suited for the clean, white packaging needs of high-end markets such as pharmaceuticals or retail. DiamondTop® Waxable DiamondTop® Waxable DiamondTop® WX, a multi-ply sheet with a white printing surface over a kraft base sheet, is optimized to retain a white appearance even when the sheet is coated or saturated with wax. DiamondTop® Wet Strength DiamondTop® Wet Strength DiamondTop® WS, a multi-ply sheet with a white printing surface over a kraft base sheet, is designed to provide added strength under damp conditions and is beneficial for post print or direct print packaging that must undergo extreme transport or storage conditions. DiamondTop® HZ DiamondTop® HZ DiamondTop® HZ is designed for HazMat packaging. It provides a smooth, bright surface for printing high quality, multicolor graphics typically used in retail-ready corrugated consumer packaging. Additional Product Information SustainabilityAll WestRock North American containerboard mills are certified to the SFI®, PEFC™, FSC© Standards. Contact your WestRock containerboard sales manager for certified fiber availability for this product.Environmental & Product SafetyNotices under US California Proposition 65 and the EU REACH regulation are not requiredElemental chlorine free (ECF) bleached fiberMeets heavy metal limits of the US Model Toxics in Packaging rules and Article 11 of EU Directive 94/62/ECThis information is subject to change without notice. Food ContactMeets multiple national requirements for food contact packaging, e.g., US and Canada. Contact your sales representative for information on specific markets and end-uses.QualityProduced at ISO 9001:2015 registered millsProduced at a FSSC 22000, Category M certified facility FEATHERWEIGHT™ Featherweight™ Liners Featherweight™ Mediums Featherweight™ Liners FeatherWeight™ Liners are ultra lightweight liners engineered to help corrugators design rightweighted packaging that still meets box performance standards. Featherweight™ Mediums Want to design lighter-weight packages to reduce your customers’ transportation costs? FeatherWeight™ Medium is a lightweight substrate that offers corrugators the ability to rightweight their designs while meeting box performance requirements. Request more information Additional Product Information SustainabilityAll WestRock North American containerboard mills are certified to the SFI®, PEFC™, FSC© Standards. Contact your WestRock containerboard sales manager for certified fiber availability for this product.Environmental & Product SafetyNotices under US California Proposition 65 and the EU REACH regulation are not requiredMeets heavy metal limits of the US Model Toxics in Packaging rules and Article 11 of EU Directive 94/62/ECThis information is subject to change without notice. Food ContactMeets multiple national requirements for food contact packaging, e.g., US and Canada. Contact your WestRock containerboard sales manager for information on specific markets and end-uses.QualityProduced at ISO 9001:2015 registered mills ENDURALINER™ AND ENDURAFLUTE™ Mediums and liners engineered for box performanceMake a good impression in both the look and the performance of your packaging. Our EnduraLiner™ and EnduraFlute™ medium grades provide flexibility in designing traditional Mullen class-stamped or ECT packaging. EnduraFlute™ EnduraFlute™ What’s on the inside matters! EnduraFlute™ grades offer reliability and consistency and are engineered for a variety of uses and requirements. EnduraFlute™ HT EnduraFlute™ HT EnduraFlute™ HT Medium provides high, dry and humid strength and offers flexibility in meeting ECT packaging requirements. EnduraFlute™ HP WS EnduraFlute™ HP WS EnduraFlute™ High Performance Wet Strength Medium grades are produced with either 100% recycled fiber or a blend of recycled and virgin fiber furnish (NSSC). Our wet strength products are manufactured to provide excellent performance in damp, humid or wet conditions. EnduraLiner™ Hazardous Material EnduraLiner™ Hazardous Material EnduraLiner™ HZ meets or exceeds requirements for HazMat packaging, and is engineered to meet burst or high-performance strength requirements as well. This functionality enables flexibility in designing traditional Mullen class-stamped or ECT packaging. Optimized for production of high performance packaging structures, EnduraLiner™ HZ is available with either 100% recycled fiber or a blend of virgin and recycled fiber. Enduraliner™ Hazardous Material High Performance Enduraliner™ Hazardous Material High Performance EnduraLiner™ HZ HP is designed to meet the requirements for HazMat packaging and is specified to meet burst or high performance strength requirements for greater flexibility in designing traditional class stamped or ECT packaging. Optimized for production of high performance packaging structures, EnduraLiner™ HP HZ is available with either 100% recycled fiber or a blend of virgin and recycled fiber and comes in a variety of basis weights. Enduraliner™ High Performance Enduraliner™ High Performance Optimized for production of high performance packaging structures, EnduraLiner™ HP is available with either 100% recycled fiber or a blend of virgin and recycled fiber. EnduraLiner™ HP grades are produced to compression standards and do not have upper or lower basis weight limits. EnduraLiner™ High Performance Max EnduraLiner™ High Performance Max Our strongest liner option, EnduraLiner™ HP MAX takes high performance linerboard to new levels. Produced to compression standards, EnduraLiner™ HP Max grades do not have upper or lower basis weight limits. Additional Product Information SustainabilityAll WestRock North American containerboard mills are certified to the SFI®, PEFC™, FSC© Standards. Contact your WestRock containerboard sales manager for certified fiber availability for this product.Environmental & Product SafetyNotices under US California Proposition 65 and the EU REACH regulation are not requiredMeets heavy metal limits of the US Model Toxics in Packaging rules and Article 11 of EU Directive 94/62/ECThis information is subject to change without notice. Food ContactMeets multiple national requirements for food contact packaging, e.g., US and Canada. Contact your WestRock containerboard sales manager for information on specific markets and end-uses.QualityProduced at ISO 9001:2015 registered mills HYPERFORM™ AND FIBRELOK® Hyperform™ FIBRELOK® Hyperform™ Designed to meet demanding strength requirements at lighter basis weights, HyPerform™ Liner can help streamline your production, optimize the use of your production capacity and provide the performance your products need.*Not available in the U.S. Certification Produced at ISO certified mill and certified by the CERFLOR Chain of Custody, internationally recognized by PEFC. Performance Optimized for production of high performance packaging structures. Sustainability Available as a blend of virgin and recycled fiber. FIBRELOK® Look to the FibreLok® family of linerboard grades when packaging performance is required in high-humidity environments.FibreLok® linerboard has been specifically engineered to resist moisture. It is available in a wide range of standard Mullen and high compression linerboard grades with basis weights covering a full spectrum of end use applications. FibreLok® linerboard can be combined with other paper grades to create specialty packaging solutions that meet specific customer needs.Ideal for End Uses Including:Fresh fruits and vegetablesMeatSeafood Request more information CONTACT Ready to learn more?Our team of experts is ready to talk about your packaging needs. Contact us today. connect with westrock Collapse Footer Menu Markets Beauty & Personal Care Beverage Commercial Printing E-commerce Food Foodservice Healthcare Home & Garden Luxury Packaging Media & Electronics Retail Tobacco Consumer Packaging Solutions Folding Cartons Specialty Printing & Packaging Partitions & Protective Packaging Machinery Solutions Automation Corrugated Solutions Corrugated Containers Merchandising Displays Paper Solutions Containerboard Kraft Paper Paperboard Pulp Regions Brazil China India Japan Mexico Company Careers Insights Sustainability Customer Resources Supplier Resources Employee Resources Forest Resources News Investors Government Relations Contact Us Expand English Français Español Português 简体中文 Cookie Settings © 2023 WestRock Company. WESTROCK, WestRock and Design, and the WestRock Logo are trademarks owned by WestRock Company. All rights reserved. Privacy | Legal | Cookies | Accessibility"
20,"Kraft Paper Products & Suppliers | WestRock Skip to content Our Packaging Solutions Markets Beauty & Personal Care Beverage Commercial Print E-commerce Food Foodservice Healthcare Home & Garden Luxury Packaging Media & Electronics Retail Tobacco Products Corrugated Solutions Corrugated Containers Displays Consumer Packaging Solutions Folding Cartons Specialty Printing & Packaging Recycling Solutions Recycling Machinery Solutions Automation Paper Solutions Containerboard Kraft Paper Paperboard Pulp Our Sustainability Story Sustainability Sustainability Supporting People & Communities Innovating to Serve Our Customers Bettering the Planet Data & Resource Center Sustainable Forestry Innovation Innovation Insights Sustainability Highlight EcoPush® A sustainable alternative to traditional single use plastics Learn More Our Company About WestRock About WestRock Careers Locations Investors Community Diversity Resources Customer Experience Forest Resources Supplier Resources Employee Resources Government Relations Top News Blog News Awards Connect With Us Facebook Twitter LinkedIn Instagram YouTube Contact Us English Français Español Português 简体中文 Search English Français Español Português 简体中文 Kraft Paper Rolls Back to the top Contact Us Get more information Kraft Paper Products you want. People you want to work with. At WestRock, we pride ourselves on delivering the kraft paper products you want. But our people set us apart. They’re not satisfied until you are. They align their goals with yours. Your hurdles become theirs and they work hard to deliver solutions. For them, customer service isn’t a goal; it’s the way they conduct business each and every day.As a leading producer of kraft paper in North America, our kraft paper mill network offers a broad range of both bleached and kraft grades. We deliver a variety of capabilities from virgin fiber to recycled fiber, as well as blended fiber content.WestRock’s kraft paper machines are among the fastest and widest in the industry, yet we can also produce smaller specialty runs to meet your customized needs. With mills in the Northwest and Southeast, we are uniquely positioned to offer you geographical and logistical benefits.ReliaKraft® Kraft PaperOur ReliaKraft® brand of kraft papers is used to create a vast variety of products including but not limited to:quick-serve carryout bagsgrocery and shopping bagsbutcher wrap and freezer paper base stockmultiwall shipping sacksasphalt- and resin-saturating base stocksvarious industrial converting and packaging applicationsprotective packaging applicationsother specialty kraft paper products including wet strength and red rosin Collapse Footer Menu Markets Beauty & Personal Care Beverage Commercial Printing E-commerce Food Foodservice Healthcare Home & Garden Luxury Packaging Media & Electronics Retail Tobacco Consumer Packaging Solutions Folding Cartons Specialty Printing & Packaging Partitions & Protective Packaging Machinery Solutions Automation Corrugated Solutions Corrugated Containers Merchandising Displays Paper Solutions Containerboard Kraft Paper Paperboard Pulp Regions Brazil China India Japan Mexico Company Careers Insights Sustainability Customer Resources Supplier Resources Employee Resources Forest Resources News Investors Government Relations Contact Us Expand English Français Español Português 简体中文 Cookie Settings © 2023 WestRock Company. WESTROCK, WestRock and Design, and the WestRock Logo are trademarks owned by WestRock Company. All rights reserved. Privacy | Legal | Cookies | Accessibility"
21,"Paperboard Products - Virgin & Recycled | WestRock Paperboard Products & Packaging Solutions Skip to content Our Packaging Solutions Markets Beauty & Personal Care Beverage Commercial Print E-commerce Food Foodservice Healthcare Home & Garden Luxury Packaging Media & Electronics Retail Tobacco Products Corrugated Solutions Corrugated Containers Displays Consumer Packaging Solutions Folding Cartons Specialty Printing & Packaging Recycling Solutions Recycling Machinery Solutions Automation Paper Solutions Containerboard Kraft Paper Paperboard Pulp Our Sustainability Story Sustainability Sustainability Supporting People & Communities Innovating to Serve Our Customers Bettering the Planet Data & Resource Center Sustainable Forestry Innovation Innovation Insights Sustainability Highlight EcoPush® A sustainable alternative to traditional single use plastics Learn More Our Company About WestRock About WestRock Careers Locations Investors Community Diversity Resources Customer Experience Forest Resources Supplier Resources Employee Resources Government Relations Top News Blog News Awards Connect With Us Facebook Twitter LinkedIn Instagram YouTube Contact Us English Français Español Português 简体中文 Search English Français Español Português 简体中文 Virgin and Recycled Paperboard Products Jump to a section Calculator Search Products Back to the top Contact Us Get more information Your goals. Your success. Your challenges. These are the things that drive us. Enabling your success is the ultimate goal. So how do we get you there? You can count on us to:Remain focused on continually improving your experience of working with WestRock. Reduce costs, as well as risks. Continually innovate product solutions that enable you to tap into the wants and needs of today’s consumers and brand owners.Work hard to make your sustainability goals a reality. Match your needs with the right product by offering an unrivaled product mix including solid bleached sulfate (SBS) paperboard, coated natural kraft® (CNK™), and coated and uncoated 100 percent recycled paperboard (CRB). We also produce a wide array of specialty extruded products.Why are we so committed to you, our customer? The answer is simple: When you win, we win.Looking for solutions in Europe, Middle East or Africa? Access EMEA product information for Crescendo, PrintKote and other products here and collaborate with WestRock's Consumer Paperboard EMEA team. PAPERBOARD CALCULATOR We have a broad range of products, so we've provided search filters that allow you to find the products that are the best match to your unique specifications. Start your search here. View the paperboard calculator Our products are as diverse as your needs. We have a broad range of paperboard products, so we've provided search filters that allow you to find the products that are the best match to your unique specifications. Start your search here. Collapse Footer Menu Markets Beauty & Personal Care Beverage Commercial Printing E-commerce Food Foodservice Healthcare Home & Garden Luxury Packaging Media & Electronics Retail Tobacco Consumer Packaging Solutions Folding Cartons Specialty Printing & Packaging Partitions & Protective Packaging Machinery Solutions Automation Corrugated Solutions Corrugated Containers Merchandising Displays Paper Solutions Containerboard Kraft Paper Paperboard Pulp Regions Brazil China India Japan Mexico Company Careers Insights Sustainability Customer Resources Supplier Resources Employee Resources Forest Resources News Investors Government Relations Contact Us Expand English Français Español Português 简体中文 Cookie Settings © 2023 WestRock Company. WESTROCK, WestRock and Design, and the WestRock Logo are trademarks owned by WestRock Company. All rights reserved. Privacy | Legal | Cookies | Accessibility"
