,Data
0,"Packaging Solutions to Drive Your Business Growth | WestRock Skip to content Our Packaging Solutions Markets Beauty & Personal Care Beverage Commercial Print E-commerce Food Foodservice Healthcare Home & Garden Luxury Packaging Media & Electronics Retail Tobacco Products Corrugated Solutions Corrugated Containers Displays Consumer Packaging Solutions Folding Cartons Specialty Printing & Packaging Recycling Solutions Recycling Machinery Solutions Automation Paper Solutions Containerboard Kraft Paper Paperboard Pulp Our Sustainability Story Sustainability Sustainability Supporting People & Communities Innovating to Serve Our Customers Bettering the Planet Data & Resource Center Sustainable Forestry Innovation Innovation Insights Sustainability Highlight EcoPush® A sustainable alternative to traditional single use plastics Learn More Our Company About WestRock About WestRock Careers Locations Investors Community Diversity Resources Customer Experience Forest Resources Supplier Resources Employee Resources Government Relations Top News Blog News Awards Connect With Us Facebook Twitter LinkedIn Instagram YouTube Contact Us English Français Español Português 简体中文 Search English Français Español Português 简体中文 Blog WestRock's new blog: The Circular View Blog Blog WestRock's new blog: The Circular Sustainability WestRock's newest sustainability report Learn More Sustainability WestRock's newest sustainability report Partnership How a major craft brewer replaced plastic packaging with WestRock's CanCollar® Learn More Partnership How a major craft brewer replaced plastic packaging with WestRock's CanCollar® Explore our markets & innovative solutions Search for something specific Featured Products View More Products WestRock is dedicated to sustainability 100% of wholly owned fiber-based manufacturing facilities are chain-of-custody certified to internationally recognized standards 7M+ Tons of recovered materials handled by WestRock in 2022 63% Energy produced from renewable sources 42.6% Reduction in coal use, from 2015 baseline Learn More The Circular Sustainable Forestry Recycled fiber vs. virgin fiber While packaging made from 100% recycled material may seem like the optimal choice, the need for virgin fiber, or fresh material, is essential and also supports sustainability. Learn More Brand Activation Sally Hansen x GLAAD, a product launch filled with pride Learn More Sustainability WestRock named to Dow Jones Sustainability Index for North America for third consecutive year Learn More Community Advancing social equity through forestry Learn More Sustainability How a major craft brewer replaced plastic packaging with a paper-based innovation Learn More Insights Pulse packaging survey Learn More Collapse Footer Menu Markets Beauty & Personal Care Beverage Commercial Printing E-commerce Food Foodservice Healthcare Home & Garden Luxury Packaging Media & Electronics Retail Tobacco Consumer Packaging Solutions Folding Cartons Specialty Printing & Packaging Partitions & Protective Packaging Machinery Solutions Automation Corrugated Solutions Corrugated Containers Merchandising Displays Paper Solutions Containerboard Kraft Paper Paperboard Pulp Regions Brazil China India Japan Mexico Company Careers Insights Sustainability Customer Resources Supplier Resources Employee Resources Forest Resources News Investors Government Relations Contact Us Expand English Français Español Português 简体中文 Cookie Settings © 2023 WestRock Company. WESTROCK, WestRock and Design, and the WestRock Logo are trademarks owned by WestRock Company. All rights reserved. Privacy | Legal | Cookies | Accessibility"
1,"Cosmetic Packaging: Beauty and Personal Care | WestRock Skip to content Our Packaging Solutions Markets Beauty & Personal Care Beverage Commercial Print E-commerce Food Foodservice Healthcare Home & Garden Luxury Packaging Media & Electronics Retail Tobacco Products Corrugated Solutions Corrugated Containers Displays Consumer Packaging Solutions Folding Cartons Specialty Printing & Packaging Recycling Solutions Recycling Machinery Solutions Automation Paper Solutions Containerboard Kraft Paper Paperboard Pulp Our Sustainability Story Sustainability Sustainability Supporting People & Communities Innovating to Serve Our Customers Bettering the Planet Data & Resource Center Sustainable Forestry Innovation Innovation Insights Sustainability Highlight EcoPush® A sustainable alternative to traditional single use plastics Learn More Our Company About WestRock About WestRock Careers Locations Investors Community Diversity Resources Customer Experience Forest Resources Supplier Resources Employee Resources Government Relations Top News Blog News Awards Connect With Us Facebook Twitter LinkedIn Instagram YouTube Contact Us English Français Español Português 简体中文 Search English Français Español Português 简体中文 Home Markets Beauty and Personal ... Beauty and Personal Care Jump to a section Cosmetic Packaging Solutions Showcases Related Articles Contact Back to the top Contact Us Get more information Cosmetic Packaging Solutions Good Packaging is Always In StyleAdvanced technology and dedicated professional skills have made WestRock a major supplier to manufacturers of fine fragrances, cosmetics and personal care products. These are often truly global markets, where packaging is judged against the highest international standards and plays a central role in projecting the value of the product.Making product quality visible, many packs feature complex printing and special finishes. Supported by a wide choice of materials, your packaging can deliver a natural, contemporary look and finish – critical in today’s discerning marketplace. With global capabilities to supply cartons, rigid packaging, labels, and specialist tubes, our team delivers ethical, sustainable and consistently high-quality products that set trends, not follow them. Labels Wet-applied, in-mold or self-adhesive labels Cartons Formats include solidboard, board-to-board & windowed DecTech Distinctive packaging requires a creative approach Rigid Boxes We offer slip-case, top-load and complex styles Tubes For premium goods: spirally wound & composite tubes Paperboard Beautiful things aren't just seen, they're experienced.We offer a wide variety of distinct paperboards that serve the unique needs of beauty and personal care markets. Our best-in-class folding carton paperboard solutions include solid bleached sulfate (SBS) and coated and uncoated unbleached kraft (CUK/UUK), producing high-quality packaging that builds an even stronger connection with consumers. Showcases Show and sell.Nine out of 10 times, the path to purchase ends inside a brick-and-mortar store, so make sure your products and brand stand out where it matters most. From attention-grabbing design to seamless manufacturing and fulfillment, we help you achieve your brand objectives and get consumers to stop and take notice. TemporaryLooking for a display partner to deliver standout in-store solutions? We can help you achieve your brand, shopper and retailer objectives at the lowest total costPermanentWant to capture retail space and consumers? Here's the winning formula: your brand + unmatched permanent display solutions by WestRock. Related Articles Coty Adidas Packaging Flirt Eyeshadow Younique Mascara Coty Adidas Packaging A New Carton is BornWestRock Obersulm collaborated with Coty to support the launch of the new adidas Originals fragrance, ""Born Original Today,"" at the beginning of 2017. This new duo follows the successful launch of the signature scent ""Born Original"" in 2015. Read the Article Flirt Eyeshadow Just As Fashionable on the PackageWorking with WestRock, Estee Lauder re-launched the brand as a digital only brand. Short runs in digital enabled Flirt to meet their high turnover, fast-moving inventory strategy, launching a new exciting product every month. Read the Article Younique Mascara It's Chic To Love The Planet In 2016, Younique partnered with WestRock to redesign the packaging for their signature Fiber Lash Mascara, which retails for $29. Read the Article Connect with WestRock Reach out to our professionals and discuss your beauty and personal care packaging ideas. Contact Us. Collapse Footer Menu Markets Beauty & Personal Care Beverage Commercial Printing E-commerce Food Foodservice Healthcare Home & Garden Luxury Packaging Media & Electronics Retail Tobacco Consumer Packaging Solutions Folding Cartons Specialty Printing & Packaging Partitions & Protective Packaging Machinery Solutions Automation Corrugated Solutions Corrugated Containers Merchandising Displays Paper Solutions Containerboard Kraft Paper Paperboard Pulp Regions Brazil China India Japan Mexico Company Careers Insights Sustainability Customer Resources Supplier Resources Employee Resources Forest Resources News Investors Government Relations Contact Us Expand English Français Español Português 简体中文 Cookie Settings © 2023 WestRock Company. WESTROCK, WestRock and Design, and the WestRock Logo are trademarks owned by WestRock Company. All rights reserved. Privacy | Legal | Cookies | Accessibility"
2,"Beverage Packaging Solutions: Multipacks, Bottles & Cans | WestRock Corrugated and Consumer Packaging Solutions Skip to content Our Packaging Solutions Markets Beauty & Personal Care Beverage Commercial Print E-commerce Food Foodservice Healthcare Home & Garden Luxury Packaging Media & Electronics Retail Tobacco Products Corrugated Solutions Corrugated Containers Displays Consumer Packaging Solutions Folding Cartons Specialty Printing & Packaging Recycling Solutions Recycling Machinery Solutions Automation Paper Solutions Containerboard Kraft Paper Paperboard Pulp Our Sustainability Story Sustainability Sustainability Supporting People & Communities Innovating to Serve Our Customers Bettering the Planet Data & Resource Center Sustainable Forestry Innovation Innovation Insights Sustainability Highlight EcoPush® A sustainable alternative to traditional single use plastics Learn More Our Company About WestRock About WestRock Careers Locations Investors Community Diversity Resources Customer Experience Forest Resources Supplier Resources Employee Resources Government Relations Top News Blog News Awards Connect With Us Facebook Twitter LinkedIn Instagram YouTube Contact Us English Français Español Português 简体中文 Search English Français Español Português 简体中文 Home Markets Beverage Beverage Packaging Solutions Jump to a section Multipacks Beverage Packaging Systems Specialty Packaging Decorative Technology Converting Corrugated Containers Craft Displays Paperboard Contact Back to the top Contact Us Get more information SUSTAINABLE BEVERAGE PACKAGING INNOVATIONS Breaking New Ground in Beverage Packaging Today’s consumers expect more from beverage brands – not only in the product they purchase, but also in the way those products are packaged. They want packaging that not only protects products and keeps them safe and hygienic, but also contributes to the circular economy – all while providing a delightful experience.In response, leading beverage brands are reimagining their approach to packaging to meet shifting consumer expectations and achieve operational goals of reducing total cost, increasing sustainability, reducing risks and growing sales.WestRock is a trusted expert who can help you understand and act on market trends and push the boundaries of what is possible in fiber-based packaging and automation by correctly combining the right substrate, structural and graphic design and the machine it should run on to get the results you need.Whether your goal is to reduce your plastic use, differentiate from your competition or overcome labor challenges, WestRock has the industry expertise, integrated global scale and proven solutions to get you there. GET MORE INFORMATION sustainability DESIGN AUTOMATION sustainability FIBER-BASED PACKAGING FOR SUSTAINABILITYMove over, plastic – our fiber innovations hold up to the most demanding supply chains, and provide excellent print quality with sharp, clear graphics, finally making it easy to meet both your company’s sustainability goals and your customers’ expectations. DESIGN PACKAGING DESIGN THAT STANDS OUTFirst impressions matter - 75% of beverage purchase decisions are made in aisle so your packaging must pop, and our global team of graphic and structural design experts work alongside you to design packaging that will set your brand apart and catch the eye of that split-second shopper.¹North America Corrugated Packaging Market - Growth, Trends, COVID-19 Impact, and Forecasts (2022 - 2027). (2022, March 18). Globenewswire.com. Retrieved July 22, 2022, from https://www.globenewswire.com/fr/news-release/2022/03/18/2405863/0/en/North-America-Corrugated-Packaging-Market-Growth-Trends-COVID-19-Impact-and-Forecasts-2022-2027.html 75% of beverage purchase decisions are made in aisle AUTOMATION EFFICIENT AUTOMATIONFrom corrugated tray formers to our innovative and sustainable CanCollar Fortuna® system, our machinery solutions can be customized to fit your footprint, handle your products within your existing processes, increase your efficiency and flexibility, and reduce excess waste and labor costs.Our team of experienced automation experts work with you to understand your goals and manufacturing environment, and then recommend the optimal automation solution. Multipacks Your multipack isn't just a container—it's an opportunity.For beverage brands, the competition at the cash register begins on the shelf. That’s because 75% of beverage purchase decisions are made by consumers as they stand in the aisle, facing a multitude of choices.Our paperboard multipacks are powerful assets that help your beverage brands break through the clutter and connect with consumers. Using CarrierKote® Coated Natural Kraft® paperboard, we create multipack cartons that are strong even when wet—and provide excellent print quality with sharp, clear graphics that help capture attention on the shelf. Bottles Cans Flexibles Cups Liquid Cartons Beverage Packaging Systems Efficiency and flexibility customized for you.Every brand is unique and every facility is different. With over 60 years of experience, we know how to design machines to deliver high-quality basics allowing you to optimize every facet of your supply chain, but we also have an eye to the future.Our world-class engineers are driven to solve for your particular need with cost-effective, innovative and high-performing machinery solutions that deliver superior and measurable value. Explore custom machinery BasketWrap® Multipack Systems Cluster-Pak® Multipack Systems CanCollar® Multipack Systems Fully Enclosed Multipack Systems Specialty Packaging Specialty Products Deserve Specialty PackagingYour custom spirit demands custom packaging. We offer high-end paperboard, cartons, rigid tubes, rigid boxes and labels that protect and promote your products while creating outstanding presentation. Additionally, our high end printing services can create foil, metallic, 3-D, inks, embossing, and varnish effects that take your product to another level. Specialty Printing and Packaging More Specialty Packaging Choices Rigid Boxes Rigid Tubes Labels Decorative Printing Technology Our creative solutions help maximize your products’ presentation and appeal – further enhanced by our world-class use of exclusive finishing effects and luxury materials. Our extensive product offering and expertise allows us to enhance presentation further through the use of labels and booklets for heightened prestige. Our Decorative Technologies help bring images to life with textures, graining, finishes and foils and help set your product apart on the shelf. Explore our Decorative Technology solutions Converting Attract the eye and drive the sale.Our customized packaging solutions are efficient, value-driven and have the scale required for global implementation. We have world-class converting facilities and partners across the globe, all equipped to bring high-impact packaging features to life—including innovative designs for opening, handling and shelf removal as well as cutout and dispensing features. Feel smooth with four-color process + flood UV soft touch coating + spot double hit UV gloss varnish coated side Pop with four-color process+ flood UV dull aqueous+foil+emboss Delight with four color process + flood UV soft touch coating + spot double hit UV gloss varnish Differentiate your craft with 2 spot colors + spot double hit opaque white + die-cut Dazzle and flash with holographic film + 2 spot color + spot double hit opaque white + spot UV dull varnish + foil Shimmer and diffuse with 2 spot colors + flood UV pearlized coating + flood UV gloss coating + spot UV dull varnish + emboss Appeal and elevate with four-color process + spot UV gloss coating + spot double hit UV texture coating + multi-level emboss + die-cut Glow and flash with four-color process + fluorescent pms + spot foil Lift and highlight with four-color process + spot UV gloss coating + spot UV dull varnish + sculptured emboss Shine and lift with metalized film + four-color process + spot double hit opaque white + spot dull UV varnish + emboss Corrugated Containers Protect. Promote. Deliver.Hot, cold, or sparkling, WestRock’s expertise in corrugated beverage packaging provides solutions to customers that go beyond the container.Our corrugated packaging innovations and decorative printing enhancements—including metallic inks, foil stamping, and lamination of foil or holographic material—give containers an eye-catching edge at retail. Graphics, prepress and printing specialists assess your current packaging effectiveness and recommend options to protect your product and elevate your image at the point of purchase. We offer the best solution for your packaging demands and will provide differentiated solutions for the optimal preprint, litho, flexo, or post print method and container end use. Our solutions include:Packaging for all beverage configurationsBrand-building graphicsMulti-channel distribution expertise: Retail, Specialty, Club and C-storesHigh-speed beverage packaging machinery systems Craft Crafted for you. Perhaps no category is more crowded than the growing craft beverage segment. We've made it our business to understand this movement and help budding brands find ways to stand out on the shelf and connect with the shopping consumer.As a craft brewer, you understand that success lies in the details—the ingredients, the timing, the temperature. When done well, you create something special, totally different from every other brew. Something that beer lovers sip and savor and maybe even get a little misty-eyed over. Why not apply that same passion and craft to your packaging? There are many ways to bring your brand to life on pack. Let us help you get noticed on shelf. Case Study Sleeping Giant Brewing Company Case Study Sleeping Giant sourced a full portfolio of corrugated and folding carton packaging options as well as new equipment financing to grow its business. Sleeping Giant Brewing Case Study Displays Show and sell.A product's road to retail success doesn't end at the shelf. Brands need solutions that turn shoppers into stoppers and browsers into buyers.We offer world-class promotional solutions such as temporary floor stands or pallet displays for the world's leading brands and retailers. By providing best-in-class in-store solutions that achieve brand, shopper and retailer objectives at the lowest total cost, we extend your retail reach. TemporaryLooking for a display partner to deliver standout in-store solutions? We can help you achieve your brand, shopper and retailer objectives at the lowest total costPermanentWant to capture retail space and consumers? Here's the winning formula: your brand + unmatched permanent display solutions by WestRock.VisualInterested in dramatically influencing a consumer's buying experience and solidifying brand awareness Your brand will make an impact with eye-catching, high quality signage. Insights & Expertise Insight to in-market. Our unique insight to in-market approach offers a competitive advantage by setting your brand apart on the shelf. We start by conducting in-depth research to identify opportunities to drive loyalty with consumers, then create engaging packaging designs that strengthen the brand experience and help differentiate your products. Article Asahi Breweries First Japanese User of WestRock CanCollar Eco Packaging Replacing packaging with CanCollar® results in up to 81% material reduction CanCollar Innovation Article ""About The Box"" Thinking: A Brewer's Sustainability Story Q&A with David Hayslette from craft beverage and Annie Atwell from JuneShine A Brewer's Sustainability Story Case Study Brewing bold ideas for supply chain improvement Discover how Keurig Green Mountain and WestRock developed a true partnership. Keurig Case Study Article The art of packaging: standing out in a crowd. For tips on how to stand out from the pack, see what WestRock's David Hayslette has to say. Article New Cool Box Sharing Pack: Good Times & Science Fill our new Sol Cool box sharing pack with ice and make a cooler on the go. Cool Box Sharing Pack Paperboard Our products are as diverse as your needs.When wet and cold environments put packaging to the test, our paperboard performs under the pressure. Explore our paperboard options ideally suited for beverage packaging. Explore Paperboard Contact Us Please reach out to our experts sharing your needs and ideas for maximizing your beverage container needs. Contact WestRock Collapse Footer Menu Markets Beauty & Personal Care Beverage Commercial Printing E-commerce Food Foodservice Healthcare Home & Garden Luxury Packaging Media & Electronics Retail Tobacco Consumer Packaging Solutions Folding Cartons Specialty Printing & Packaging Partitions & Protective Packaging Machinery Solutions Automation Corrugated Solutions Corrugated Containers Merchandising Displays Paper Solutions Containerboard Kraft Paper Paperboard Pulp Regions Brazil China India Japan Mexico Company Careers Insights Sustainability Customer Resources Supplier Resources Employee Resources Forest Resources News Investors Government Relations Contact Us Expand English Français Español Português 简体中文 Cookie Settings © 2023 WestRock Company. WESTROCK, WestRock and Design, and the WestRock Logo are trademarks owned by WestRock Company. All rights reserved. Privacy | Legal | Cookies | Accessibility"
