,Data
0,"Windows and Doors | Window and Door Manufacturer | Marvin Skip to content Search Support Center Find a Dealer Technical Specifications Careers Products Windows By Collection Marvin Signature Coastline Modern Ultimate Marvin Elevate Marvin Essential By Type Awning Bay and Bow Casement Corner Double Hung Picture Picture Specialty Shapes Single Hung Sliding Storefront All Windows Doors By Collection Marvin Signature Coastline Modern Ultimate Marvin Elevate Marvin Essential By Type Bi-Fold Commercial Entry Garage Interior Lift and Slide Multi-Slide Pivot Sliding Swinging All Doors Skylights Awaken Marvin Skylight Spaces Solutions Coastal Contemporary Historic Replacement Well-Being Inspiration Product Design Options Photo Gallery Project Gallery Blog Why Marvin Our Story Energy Efficiency In The News For Pros Support Center Find a Dealer Technical Specifications Careers Search Windows and Doors Built for how you LiveView WindowsView Doors At Marvin, we're driven to imagine and create better ways of living. As people spend more time indoors, we recognize that our work isn't just about building better windows and doors–it's about opening new possibilities for how people live, work, and play inside a Marvin space. Since the day we opened our doors in 1912, as a family-owned and -operated cedar and lumber company, we've looked for ways to help people live happier and healthier lives. Learn MoreExpand Your Possibilities With The Elevate Bi-Fold Door Designed to bring air, light and expansive views to life, our newest innovation is accessible for new build, replacement or remodel projects. It’s not a door as we once knew it, it’s everything a door should be.Learn More Our Collections Marvin windows and doors are inspired by how people live. Explore our three product collections organized by degree of design detail, flexibility, and customization possibilities. Learn MoreSignature Collection® Featuring the Ultimate, Modern, and Coastline product lines, this collection offers our broadest range of product types, sizes, configurations, and design options.Learn More Learn MoreElevate Collection® An ideal blend of remarkable design and superior strength, Elevate products strike a perfect balance between enduring style and unmatched performance.Learn More Learn MoreEssential Collection™ Essential products resist fading, chalking, peeling, cracking, and are eight times stronger than vinyl. Simpler features and options streamline the ordering process.Learn More View All WindowsView All Windows Windows by Type Awning Picture Bay and Bow Single Hung Casement Sliding Corner Specialty Shapes Double Hung Storefront View All DoorsView All Doors Doors by Type Bi-Fold Lift and Slide Commercial Multi-Slide Entry Pivot Garage Sliding Interior Swinging Learn MoreDesigned To Mix, Made To Match Bold, timeless, alluring, Gunmetal by Marvin is an exclusive hue designed to transcend styles and fit perfectly into your world. Now available in Elevate and Essential Collections.Learn More Learn MoreReplacement Windows And Doors Whether you’re looking to reinvigorate your home design, replace damaged or outdated windows and doors, or save money through energy efficiency, Marvin is with you every step of the way, no matter the complexity of your replacement window and door project.Learn More New Products at Marvin Learn MoreElevate Bi-Fold Door Designed to bring light, air and expansive views to life, it’s an accessible statement for new build, remodel or replacement projects.Learn More Learn MoreSkycove® Imagine an inviting space, flooded in light, where you can enjoy a cup of coffee with a close friend or escape into a good book.Learn More Learn MoreAwaken® Skylight Research has shown that natural light improves people’s sense of well-being. Awaken is the first and only skylight to offer supplemental, tunable lighting.Learn More Learn MoreLiving Well with Light, Air, and Views The spaces we occupy can have a positive effect on our well-being. Spending time in spaces flooded in natural light, rejuvenated with an abundant supply of fresh air, and generously furnished with views of the outdoors, can be just as important to our health as exercise and a good diet.Learn More Marvin experts are experienced in working with architects, builders and homeowners to ensure your vision becomes a reality.Find A Dealer Products Our Collections All Windows All Doors Skylights Spaces Solutions Coastal Contemporary Historic Design Replacement Well-Being Design & Inspiration Product Design Options Photo Gallery Project Gallery Blog Why Marvin Our Story Careers Energy Efficiency In The News International TruStile Marvin Replacement Support Support Center Care and Maintenance Glossary of Terms Owner's Manuals Parts Manuals Warranty Professionals AIA Courses Architectural Resources Drawing and 3D Models Energy Data Technical Specifications Tours and Training Find A Dealer Request Literature Email Sign Up Privacy Statement Terms of Use California Users/Privacy"
1,"Coastline Windows and Doors | Marvin Skip to content Search Support Center Find a Dealer Technical Specifications Careers Products Windows By Collection Marvin Signature Coastline Modern Ultimate Marvin Elevate Marvin Essential By Type Awning Bay and Bow Casement Corner Double Hung Picture Picture Specialty Shapes Single Hung Sliding Storefront All Windows Doors By Collection Marvin Signature Coastline Modern Ultimate Marvin Elevate Marvin Essential By Type Bi-Fold Commercial Entry Garage Interior Lift and Slide Multi-Slide Pivot Sliding Swinging All Doors Skylights Awaken Marvin Skylight Spaces Solutions Coastal Contemporary Historic Replacement Well-Being Inspiration Product Design Options Photo Gallery Project Gallery Blog Why Marvin Our Story Energy Efficiency In The News For Pros Support Center Find a Dealer Technical Specifications Careers Search Marvin Signature® Collection Coastline Designed for the best coastal views, engineered for the worst coastal weather. Part of the Marvin Signature collection, Coastline is a versatile product portfolio that combines advanced, impact performance with inspiring design flexibility. The extruded all aluminum frames and impact-resistant glass are engineered to withstand high winds and flying debris generated by severe storms and hurricanes. With the ability to achieve oversized, one-of-a-kind designs, even the most ambitious visions for coastal homes are possible. Designed and manufactured in Florida, Coastline products are available in select southeast coastal regions. Unsurpassed Protection, Limitless Possibilities Designed for Coastal Weather Coastline windows and doors are high velocity hurricane zone (HVHZ) approved, engineered to sustain high winds and flying debris generated by a tropical storm or hurricane. Made with extruded aluminum and impact-resistant glass, Coastline products meet stringent Miami-Dade County and state of Florida code requirements. Premium Aesthetics Coastline products feature a range of product types, sizes, configurations, and design options. Narrow sightlines provide a clean, shutter-free, well-maintained aesthetic to your home. Made with industrial-grade finishes to withstand corrosion and resist fading so your products retain their color, gloss, and beauty for years to come. Dramatically Large Sizes Marvin Coastline offers expansive views with big glass and dramatically large sizes to bring your most ambitious projects to life. Make a statement with a decorative, large-scale entry door or show off stunning views with vast expanses of glass on the interior—all customized to give you the freedom to design boldly. Coastline Windows Awning Awning window sashes are hinged at the top of the frame and swing out at the bottom. They are ideal for bringing in a breeze even in damp weather.Learn More Casement Provide vast, unobstructed expanses of glass while providing a clean feel and narrow sightlines. Perfect for hard to reach areas like over a sink or counter.Learn More Glider Also known as a horizontal roller window, a glider features an operating sash equipped with durable brass tandem rollers for easy operation.Learn More Single Hung A traditional design that instills a sense of warmth, the Single Hung window features a stationary top window and a well-balanced bottom sash.Learn More Picture Specialty Shapes These windows are available in hundreds of geometric shapes providing design freedom to create unique architectural statements.Learn More Picture The glass is glazed directly into the frame, eliminating the need for a sash, which results in narrow sightlines, more light, and larger unobstructed views.Learn More Storefront Perfect for any home or business to create massive expanses of glass, capture scenic views, and blur the lines between indoors and out.Learn More Coastline Doors Bi-Fold The Bi-Fold door is a great way to take advantage of the inspiring vistas and abundance of brilliant sunshine that life near the coast has to offer.Learn More Entry Create a statement piece with options such as lead glass, a wood grain finish, custom color, or a one-of-a-kind ornamental wrought iron grill pattern.Learn More Garage A Coastline Garage door will boost curb appeal and is a perfect complement to any modern, contemporary, or transitional style.Learn More Multi-Slide Two doors can be designed to meet in the center or at a 90-degree corner angle, and the panels can be configured to tuck into a wall pocket.Learn More Swinging French Inswing and outswing Coastline French doors offer custom divided lite patterns and finish options, which allow for a unique and traditional design aesthetic.Learn More Pivot When open, a Pivot door panel appears to hover in midair. You can choose an all-glass panel or configure a Pivot door to match any style or decor.Learn More Download NowGet the Coastline product catalogs Get detailed information on Marvin Coastline including types of windows and doors, color and finish options, sizing, hardware, and other key details.Download Now Explore Other Marvin Impact Rated Products Learn MoreUltimate Impact Products Ultimate wood and wood-clad windows and doors are available in our most extensive selection of shapes, styles, sizes, and options.Learn More Learn MoreElevate Impact Products A thoughtfully designed collection that balances a beautiful wood interior with a strong fiberglass exterior.Learn More Get InspiredSee how windows and doors can transform a home and spark new design ideas.Visit the Gallery Find A DealerWhere to Buy Marvin Coastline Use the Marvin dealer locator to find a Coastline product line dealer near you.Find A Dealer Products Our Collections All Windows All Doors Skylights Spaces Solutions Coastal Contemporary Historic Design Replacement Well-Being Design & Inspiration Product Design Options Photo Gallery Project Gallery Blog Why Marvin Our Story Careers Energy Efficiency In The News International TruStile Marvin Replacement Support Support Center Care and Maintenance Glossary of Terms Owner's Manuals Parts Manuals Warranty Professionals AIA Courses Architectural Resources Drawing and 3D Models Energy Data Technical Specifications Tours and Training Find A Dealer Request Literature Email Sign Up Privacy Statement Terms of Use California Users/Privacy"
2,"Modern Windows and Doors | Marvin Skip to content Search Support Center Find a Dealer Technical Specifications Careers Products Windows By Collection Marvin Signature Coastline Modern Ultimate Marvin Elevate Marvin Essential By Type Awning Bay and Bow Casement Corner Double Hung Picture Picture Specialty Shapes Single Hung Sliding Storefront All Windows Doors By Collection Marvin Signature Coastline Modern Ultimate Marvin Elevate Marvin Essential By Type Bi-Fold Commercial Entry Garage Interior Lift and Slide Multi-Slide Pivot Sliding Swinging All Doors Skylights Awaken Marvin Skylight Spaces Solutions Coastal Contemporary Historic Replacement Well-Being Inspiration Product Design Options Photo Gallery Project Gallery Blog Why Marvin Our Story Energy Efficiency In The News For Pros Support Center Find a Dealer Technical Specifications Careers Search Photograph by SpacecraftingMarvin Signature® Collection Modern The spirit of modern design lives on. As part of the Marvin Signature® collection, Modern brings exceptional design, performance, and customer experience together—creating a product line that meets the exacting principles and standards of true modern architecture. An innovative high-density fiberglass material, leading thermal performance, consistent narrow sightlines, and a modular system all add up to the Modern product line—a seamless approach to modern design. Watch the video See how the Modern line is stunning in both its design and engineering, letting you take the best of modern design and create a purely modern aesthetic at an even larger scale. Download NowGet the Catalog Learn more about how the Modern product line honors the principle of modern architecture. Download Now Modern: Innovation inspired by you Innovation inspired by you Our High-Density Fiberglass material and proprietary frame design provide unparalleled thermal performance and durability. The Integrated Mull Channel, a structural cavity within the frame, allows you to add up to 1⁄2” of mull reinforcement without compromising sightlines. Frame recesses accept a drywall return, allowing for an easier wall integration and consistent frame reveal. A. Proprietary frame design helps keep interior temperatures comfortable B. The frame’s integrated mull channel preserves sightlines and supports structural performance C. Built-in drywall return for easy wall integration Modern aesthetics Every Modern product is designed to meet the exacting principles and standards of true modern architecture, with every critical detail considered. Low-gloss aluminum interiors—along with black spacer bars and black sealant—minimize visual distractions on the frame and enhance the flow of natural light. Internal covers completely disguise fasteners and concealing rubber gaskets to help products maintain clean, crisp edges. Clean lines and simplicity In a fast-paced world, the clean lines of modern architecture offer respite. With its emphasis on simplicity and large expanses of glass, modern design can foster deeper connections with the outdoors, bringing a greater sense of well-being to your everyday life. Modular System Our Modern products are designed to work together visually as a modular system. Consistent product profiles allow you to design with ease and confidence, and maintain narrow sightlines that are less than 3"" even on mulled units. A variety of mulling options are available to achieve large assemblies with certified performance. Leading Thermal Performance We believe modern windows and doors should perform at scale. So we developed a new frame that’s strong, durable and thermally efficient. From exterior to interior, the frame is formed from a solid piece of High-Density Fiberglass and requires no additional material to aid in its thermal performance. Delivery and Installation Ease Modern was designed with intention, from product to process. Optimal packaging mitigates delivery damage, and product weight information is communicated from order to install to help plan for safe handling. Contained inside every shipment is our new Job Box, which includes all hardware, necessary items for installation and documentation in one convenient place. All products are designed with prefabricated and pre-configured components to enable an intuitive installation. Windows in the Modern Collection Modern AwningModern Awning Push OutModern CasementModern Casement Push OutModern Direct Glaze Doors in the Modern Collection Modern Multi-Slide DoorModern Swinging Door Get InspiredSee how windows and doors can transform a home and spark new design ideas.Visit the Gallery Also In The Marvin Signature Collection Learn More Marvin Ultimate Ultimate doors feature wood interiors with the option of either wood or aluminum-clad exteriors.Learn More Learn MoreMarvin Coastline Coastline window frames and sashes are made with durable and low-maintenance extruded aluminum.Learn More Explore Other Collections Learn MoreMarvin Elevate® Collection Elevate products strike a perfect balance between enduring style and unmatched performance. The warm wood interiors can be factory finished in clear coat, painted white or designer black or choose bare pine to finish as you desire to match your interiors. The fiberglass exterior provides strength, durability, and high-performing thermal properties that excel in harsh climates.Learn More Learn More Marvin Essential™ Collection The Marvin Essential collection has clean lines, powerful performance, and streamlined options, making it easier to achieve design and quality. Its strong, durable fiberglass exteriors and interiors are striking and virtually maintenance free.Learn More Where to Buy Marvin ModernUse the Marvin dealer locator to find a Modern product line dealer near you.Find A Dealer Products Our Collections All Windows All Doors Skylights Spaces Solutions Coastal Contemporary Historic Design Replacement Well-Being Design & Inspiration Product Design Options Photo Gallery Project Gallery Blog Why Marvin Our Story Careers Energy Efficiency In The News International TruStile Marvin Replacement Support Support Center Care and Maintenance Glossary of Terms Owner's Manuals Parts Manuals Warranty Professionals AIA Courses Architectural Resources Drawing and 3D Models Energy Data Technical Specifications Tours and Training Find A Dealer Request Literature Email Sign Up Privacy Statement Terms of Use California Users/Privacy"
3,"Custom Windows and Doors | Signature Ultimate Windows and Doors | Marvin Skip to content Search Support Center Find a Dealer Technical Specifications Careers Products Windows By Collection Marvin Signature Coastline Modern Ultimate Marvin Elevate Marvin Essential By Type Awning Bay and Bow Casement Corner Double Hung Picture Picture Specialty Shapes Single Hung Sliding Storefront All Windows Doors By Collection Marvin Signature Coastline Modern Ultimate Marvin Elevate Marvin Essential By Type Bi-Fold Commercial Entry Garage Interior Lift and Slide Multi-Slide Pivot Sliding Swinging All Doors Skylights Awaken Marvin Skylight Spaces Solutions Coastal Contemporary Historic Replacement Well-Being Inspiration Product Design Options Photo Gallery Project Gallery Blog Why Marvin Our Story Energy Efficiency In The News For Pros Support Center Find a Dealer Technical Specifications Careers Search Marvin Signature® Collection Ultimate Create more of what you can imagine. Made for those who care about every detail and simply won’t compromise on their vision, the Ultimate product line offers beautiful design, craftsman-quality construction, and a vast selection of shapes, styles, sizes, and options. With extensive customization opportunities and versatility across architectural styles, Ultimate windows and doors can be used in a wide range of projects, including traditional, contemporary, transitional, historic, craftsman, or whatever style inspires you. Download NowGet the Ultimate catalog Get detailed information on the Ultimate product line including types of windows and doors, color and finish options, sizing, hardware, and other key details.Download Now Signature Ultimate: Redefining The Standard Design possibilities The beauty of Signature Ultimate is found in every thoughtful detail that, when combined, can completely transform how a room feels. Its extensive selection of shapes, styles, sizes and options means more flexibility to meet any design challenge. And if you can’t find what you’re looking for, we can help you make nearly anything you can imagine. Extraordinary innovations You’ll feel Signature Ultimate quality in every touch. It’s in simple and smart breakthroughs like Lift Lock hardware, which allows for easy access to open and lock a window. It’s in our Lock Status Sensor: a home automation solution that gives you peace of mind because it indicates if a window or door is closed and locked, or if it’s unlocked. These are just a few examples of our many industry-leading innovations. Unmatched craftsmanship Signature Ultimate windows and doors are available in a range of wood species and a variety of stains and paint options. We sand, condition, stain and oven-cure each individual piece of wood, providing a rich interior finish. Windows in the Signature Ultimate Collection Ultimate AwningUltimate Awning Narrow FrameUltimate Awning Push OutUltimate Awning Push Out Narrow FrameUltimate BayUltimate Bow WindowsUltimate CasementUltimate Casement InswingUltimate Casement Narrow FrameUltimate Casement Push OutUltimate Casement Push Out Narrow FrameUltimate CornerUltimate Corner Narrow FrameUltimate Double Hung G2Ultimate Double Hung Insert G2Ultimate French CasementUltimate French Casement Push OutUltimate GliderUltimate PictureUltimate Picture Narrow FrameUltimate Single Hung G2Ultimate Specialty ShapesUltimate Venting PictureUltimate Wood Double HungUltimate Wood Double Hung MagnumUltimate Wood Single Hung Doors in the Signature Ultimate Collection Ultimate Bi-Fold DoorUltimate Commercial DoorUltimate Lift and Slide DoorUltimate Multi-Slide DoorUltimate Sliding French DoorUltimate Sliding Patio DoorUltimate Swinging Arch Top French DoorUltimate Swinging Narrow Profile DoorUltimate Wood Swinging French DoorUltimate Swinging French Door G2 Get InspiredSee how windows and doors can transform a home and spark new design ideas.Visit the Gallery Also In The Marvin Signature® Collection Learn MoreMarvin Modern Modern windows are built with a fiberglass exterior and a low-gloss aluminum interior.Learn More Learn MoreMarvin Coastline Coastline window frames and sashes are made with durable and low-maintenance extruded aluminum.Learn More Explore other Collections Learn MoreMarvin Elevate® Collection Elevate products strike a perfect balance between enduring style and unmatched performance. The warm wood interiors can be factory finished in clear coat, painted white or designer black or choose bare pine to finish as you desire to match your interiors. The fiberglass exterior provides strength, durability and high-performing thermal properties that excel in harsh climates.Learn More Learn MoreMarvin Essential™ Collection The Marvin Essential collection has clean lines, powerful performance, and streamlined options, making it easier to achieve design and quality. Its strong, durable fiberglass exteriors and interiors are striking and virtually maintenance free.Learn More Marvin experts are experienced in working with architects, builders and homeowners to ensure your vision becomes a reality.Find A Dealer Products Our Collections All Windows All Doors Skylights Spaces Solutions Coastal Contemporary Historic Design Replacement Well-Being Design & Inspiration Product Design Options Photo Gallery Project Gallery Blog Why Marvin Our Story Careers Energy Efficiency In The News International TruStile Marvin Replacement Support Support Center Care and Maintenance Glossary of Terms Owner's Manuals Parts Manuals Warranty Professionals AIA Courses Architectural Resources Drawing and 3D Models Energy Data Technical Specifications Tours and Training Find A Dealer Request Literature Email Sign Up Privacy Statement Terms of Use California Users/Privacy"
