,Data
20,"Essential Collection Window and Doors | Marvin Skip to content Search Support Center Find a Dealer Technical Specifications Careers Products Windows By Collection Marvin Signature Coastline Modern Ultimate Marvin Elevate Marvin Essential By Type Awning Bay and Bow Casement Corner Double Hung Picture Picture Specialty Shapes Single Hung Sliding Storefront All Windows Doors By Collection Marvin Signature Coastline Modern Ultimate Marvin Elevate Marvin Essential By Type Bi-Fold Commercial Entry Garage Interior Lift and Slide Multi-Slide Pivot Sliding Swinging All Doors Skylights Awaken Marvin Skylight Spaces Solutions Coastal Contemporary Historic Replacement Well-Being Inspiration Product Design Options Photo Gallery Project Gallery Blog Why Marvin Our Story Energy Efficiency In The News For Pros Support Center Find a Dealer Technical Specifications Careers Search Photograph by HYGGE Custom Homes, Chad Gould, and Ashley AvilaMarvin Essential™ Collection Design and performance, made easier. The Marvin Essential™ collection brings together design, quality, and performance in one streamlined offering. Strong, durable fiberglass exteriors and interiors are both striking and virtually maintenance-free. Simplified options make the order process straightforward, while clean lines and versatile styles make it easy to meet project demands. Learn MoreDesigned To Mix, Made To Match Bold, timeless, alluring, Gunmetal by Marvin is an exclusive hue designed to transcend styles and fit perfectly into your world. Now available in Elevate and Essential Collections.Learn More Improved Lead Times for Marvin Elevate® and Essential™ Collections Elevate® and Essential™ collections now have lead times as low as 5 weeks and are shipping complete and delivered as promised. Download NowGet the Essential catalog Get detailed information on the Essential collection including types of windows and doors, color and finish options, sizing, hardware, and other key details.Download Now Essential: Straightforward and Tough Proven strength The facts speak for themselves. Our proprietary fiberglass is eight-times stronger than vinyl and three times stronger than vinyl/wood composites. It resists fading, chalking, peeling and cracking. Powerful durability Marvin is the leader in fiberglass, which outlasts vinyl windows by 38%. Our pultruded fiberglass remains stable in extreme temperatures and expands at nearly the same rate as glass, so Essential windows stay strong and true, even in harsh conditions. Streamlined details With narrow profiles, clean lines and simpler features and options, Essential makes it easier to choose and order. Windows in the Essential Collection Essential AwningEssential CasementEssential Double HungEssential GliderEssential PictureEssential Round TopEssential Single HungEssential Specialty Shapes Doors in the Essential Collection Essential Sliding Patio Door Get InspiredSee how windows and doors can transform a home and spark new design ideas.Visit the Gallery Explore Other Collections Learn More Marvin Signature® Collection The Marvin Signature collection features the Ultimate, Modern, and Coastline product lines and is characterized by thoughtful detail, the highest level of architectural precision, and beautiful aesthetics. Our Signature collection is inspired by the way you want to live and designed to inspire you to live well.Learn More Learn MoreMarvin Elevate® Collection Elevate products strike a perfect balance between enduring style and unmatched performance. The warm wood interiors can be factory finished in clear coat, painted white or designer black or choose bare pine to finish as you desire to match your interiors. The fiberglass exterior provides strength, durability and high-performing thermal properties that excel in harsh climates.Learn More Marvin experts are experienced in working with architects, builders and homeowners to ensure your vision becomes a reality.Find A Dealer Products Our Collections All Windows All Doors Skylights Spaces Solutions Coastal Contemporary Historic Design Replacement Well-Being Design & Inspiration Product Design Options Photo Gallery Project Gallery Blog Why Marvin Our Story Careers Energy Efficiency In The News International TruStile Marvin Replacement Support Support Center Care and Maintenance Glossary of Terms Owner's Manuals Parts Manuals Warranty Professionals AIA Courses Architectural Resources Drawing and 3D Models Energy Data Technical Specifications Tours and Training Find A Dealer Request Literature Email Sign Up Privacy Statement Terms of Use California Users/Privacy"
21,"Awning Windows | Marvin Skip to content Search Support Center Find a Dealer Technical Specifications Careers Products Windows By Collection Marvin Signature Coastline Modern Ultimate Marvin Elevate Marvin Essential By Type Awning Bay and Bow Casement Corner Double Hung Picture Picture Specialty Shapes Single Hung Sliding Storefront All Windows Doors By Collection Marvin Signature Coastline Modern Ultimate Marvin Elevate Marvin Essential By Type Bi-Fold Commercial Entry Garage Interior Lift and Slide Multi-Slide Pivot Sliding Swinging All Doors Skylights Awaken Marvin Skylight Spaces Solutions Coastal Contemporary Historic Replacement Well-Being Inspiration Product Design Options Photo Gallery Project Gallery Blog Why Marvin Our Story Energy Efficiency In The News For Pros Support Center Find a Dealer Technical Specifications Careers Search Marvin Products Window Types Awning Awning WindowsAwning windows open outward from a top frame hinge. This style of window is energy efficient, great for ventilation, and able to stay open in wet weather. SIGNATURECoastline AwningSIGNATUREModern AwningSIGNATUREModern Awning Push OutSIGNATUREUltimate AwningSIGNATUREUltimate Awning Narrow FrameSIGNATUREUltimate Awning Push OutSIGNATUREUltimate Awning Push Out Narrow FrameELEVATEElevate AwningELEVATEElevate Awning Narrow FrameESSENTIALEssential Awning What are Awning Windows? Awning windows have a single sash hinged at the top of the frame. Their sash swings outward from the bottom using either a folding hand crack or manual handle. Awning windows are often installed higher up on a wall for privacy or space concerns. They may be placed above doors or larger windows to provide discrete natural lighting and ventilation, as well as an expanded view. Awning windows are also energy efficient, as breezes and high winds blowing against them serve to tighten their seal. When open, awning windows are perfect for inviting in a cool breeze and ushering out stagnant hot air. Their top-hinge design allows water to shed out and away from the opening. Awning windows can keep your spaces comfortable and dry, sometimes even when open in wet weather. Explore Awning Window Photo Galleries View DetailsContemporary Micro HomeView Details View All WindowsView All Windows Find a DealerFind a Dealer Products Our Collections All Windows All Doors Skylights Spaces Solutions Coastal Contemporary Historic Design Replacement Well-Being Design & Inspiration Product Design Options Photo Gallery Project Gallery Blog Why Marvin Our Story Careers Energy Efficiency In The News International TruStile Marvin Replacement Support Support Center Care and Maintenance Glossary of Terms Owner's Manuals Parts Manuals Warranty Professionals AIA Courses Architectural Resources Drawing and 3D Models Energy Data Technical Specifications Tours and Training Find A Dealer Request Literature Email Sign Up Privacy Statement Terms of Use California Users/Privacy"
22,"Picture Windows | Venting Windows | Marvin Skip to content Search Support Center Find a Dealer Technical Specifications Careers Products Windows By Collection Marvin Signature Coastline Modern Ultimate Marvin Elevate Marvin Essential By Type Awning Bay and Bow Casement Corner Double Hung Picture Picture Specialty Shapes Single Hung Sliding Storefront All Windows Doors By Collection Marvin Signature Coastline Modern Ultimate Marvin Elevate Marvin Essential By Type Bi-Fold Commercial Entry Garage Interior Lift and Slide Multi-Slide Pivot Sliding Swinging All Doors Skylights Awaken Marvin Skylight Spaces Solutions Coastal Contemporary Historic Replacement Well-Being Inspiration Product Design Options Photo Gallery Project Gallery Blog Why Marvin Our Story Energy Efficiency In The News For Pros Support Center Find a Dealer Technical Specifications Careers Search Marvin Products Window Types Picture Picture WindowsPicture windows are large, fixed windows that frame their scenic outdoor view like a painting. This type of window can be assembled with or without a sash. SIGNATURECoastline PictureSIGNATURECoastline Picture Narrow FrameSIGNATURECoastline StorefrontSIGNATUREModern Direct GlazeSIGNATUREUltimate PictureSIGNATUREUltimate Picture Narrow FrameSIGNATUREUltimate Venting PictureELEVATEElevate PictureESSENTIALEssential Picture What are Picture Windows? Picture windows provide expansive views of the outdoors and are non-operable, meaning they cannot be opened. They are often strategically placed in living rooms, dining rooms, and other areas where a large window is desired for its aesthetic appeal and to increase the amount of natural daylight. When to use picture windows? Picture windows are best used in conjunction with other operable windows and doors to create a larger window system. They are designed to match profiles and sight lines of operable windows creating a cohesive look and a larger expanse of glass to maximize views and natural light. What are Direct Glaze (Fixed) Windows? Direct glaze windows, also known as fixed windows, are a popular choice for modern homes. The glass is set directly into the frame without a sash and held in place with an adhesive creating a simple, clean profile with more glass area for an expanded view. Direct glaze windows are non-operable and they are often used in areas where an unobstructed view is desired. When to use Fixed (Direct Glaze) Windows? Direct glaze windows are a good option for a standalone window or direct glaze only assembly. The profile is unique and thoughtful consideration needs to be taken when mixing with other product types from the collection. Direct glaze windows come in a variety of shapes, which can be utilized to make assemblies that follow a roof’s pitch or to create unique statement pieces. Picture Specialty Shape Windows Picture Specialty Shape windows are available in hundreds of different geometric shapes, customized for your project for a perfect fit every time. Learn More Explore Picture Window Photo Galleries View Details Modern HomesView Details View DetailsWarm Wood Living SpaceView Details View All WindowsView All Windows Find a DealerFind a Dealer Products Our Collections All Windows All Doors Skylights Spaces Solutions Coastal Contemporary Historic Design Replacement Well-Being Design & Inspiration Product Design Options Photo Gallery Project Gallery Blog Why Marvin Our Story Careers Energy Efficiency In The News International TruStile Marvin Replacement Support Support Center Care and Maintenance Glossary of Terms Owner's Manuals Parts Manuals Warranty Professionals AIA Courses Architectural Resources Drawing and 3D Models Energy Data Technical Specifications Tours and Training Find A Dealer Request Literature Email Sign Up Privacy Statement Terms of Use California Users/Privacy"
23,"Bay Windows and Bow Windows | Box Bay Windows | Marvin Skip to content Search Support Center Find a Dealer Technical Specifications Careers Products Windows By Collection Marvin Signature Coastline Modern Ultimate Marvin Elevate Marvin Essential By Type Awning Bay and Bow Casement Corner Double Hung Picture Picture Specialty Shapes Single Hung Sliding Storefront All Windows Doors By Collection Marvin Signature Coastline Modern Ultimate Marvin Elevate Marvin Essential By Type Bi-Fold Commercial Entry Garage Interior Lift and Slide Multi-Slide Pivot Sliding Swinging All Doors Skylights Awaken Marvin Skylight Spaces Solutions Coastal Contemporary Historic Replacement Well-Being Inspiration Product Design Options Photo Gallery Project Gallery Blog Why Marvin Our Story Energy Efficiency In The News For Pros Support Center Find a Dealer Technical Specifications Careers Search Marvin Products Window Types Bay and Bow Bay Windows and Bow WindowsBay and bow windows have three or more windows that angle out beyond the exterior wall of the house. They are perfect for a reading nook or extra room space. SIGNATUREUltimate BaySIGNATUREUltimate Bow WindowsELEVATEElevate BayELEVATEElevate Bow Learn MoreMarvin Skycove® Marvin Skycove is a projected glass structure that creates an intimate nook to enjoy natural light and expansive views of the outdoors.Learn More What are Bay Windows and Bow Windows? Bay windows are most often one large center window with two narrow windows installed on either side. The narrow windows angle to project beyond the exterior wall of the house, creating a three-dimensional view. Bow windows also project beyond the outside of the building but are usually composed of four or more near-identical windows. As a result, bow windows have a curved effect rather than an angular one, and may need more space than a bay window. Both bay and bow windows can be installed in individual rough openings in the wall, or the factory can mull (connect) them together and then ship and install them as one large unit. Bay and bow windows are popular for their ability to open a room, maximize natural light, and provide a unique view. They also make for cozy reading nooks with discrete storage built under the seat. Explore Marvin Skycove View DetailsMaking the Marvin SkycoveView Details View DetailsThe Minne Stuga by The Faux MarthaView Details View DetailsMaking the Most of History, Light, and a Really Tall TreeView Details View All WindowsView All Windows Find a DealerFind a Dealer Products Our Collections All Windows All Doors Skylights Spaces Solutions Coastal Contemporary Historic Design Replacement Well-Being Design & Inspiration Product Design Options Photo Gallery Project Gallery Blog Why Marvin Our Story Careers Energy Efficiency In The News International TruStile Marvin Replacement Support Support Center Care and Maintenance Glossary of Terms Owner's Manuals Parts Manuals Warranty Professionals AIA Courses Architectural Resources Drawing and 3D Models Energy Data Technical Specifications Tours and Training Find A Dealer Request Literature Email Sign Up Privacy Statement Terms of Use California Users/Privacy"
24,"Single Hung Windows | Marvin Skip to content Search Support Center Find a Dealer Technical Specifications Careers Products Windows By Collection Marvin Signature Coastline Modern Ultimate Marvin Elevate Marvin Essential By Type Awning Bay and Bow Casement Corner Double Hung Picture Picture Specialty Shapes Single Hung Sliding Storefront All Windows Doors By Collection Marvin Signature Coastline Modern Ultimate Marvin Elevate Marvin Essential By Type Bi-Fold Commercial Entry Garage Interior Lift and Slide Multi-Slide Pivot Sliding Swinging All Doors Skylights Awaken Marvin Skylight Spaces Solutions Coastal Contemporary Historic Replacement Well-Being Inspiration Product Design Options Photo Gallery Project Gallery Blog Why Marvin Our Story Energy Efficiency In The News For Pros Support Center Find a Dealer Technical Specifications Careers Search Marvin Products Window Types Single Hung Single Hung WindowsSingle hung windows have one fixed upper sash and one movable lower sash. This traditional design is energy efficient and cost effective. SIGNATURECoastline Single HungSIGNATUREUltimate Single Hung G2SIGNATUREUltimate Wood Single HungESSENTIALEssential Single Hung What are Single Hung Windows? Single hung windows look almost identical to double hung windows. Both have an upper and lower sash, traditional aesthetics, and are easy to operate and clean. The key difference between these styles is that both the top and bottom sashes of a double hung window are movable. Only the bottom sash operates on single hung windows. Single hung windows are ideal for areas where the top sash might be difficult to reach. Because of their fixed top sash, single hung windows prevent more air infiltration than similar double hung windows and are more energy efficient. Additionally, single hung windows may be less expensive. Explore Single Hung Window Photo Galleries View DetailsContemporary Black Frame Kitchen WindowView Details View All WindowsView All Windows Find a DealerFind a Dealer Products Our Collections All Windows All Doors Skylights Spaces Solutions Coastal Contemporary Historic Design Replacement Well-Being Design & Inspiration Product Design Options Photo Gallery Project Gallery Blog Why Marvin Our Story Careers Energy Efficiency In The News International TruStile Marvin Replacement Support Support Center Care and Maintenance Glossary of Terms Owner's Manuals Parts Manuals Warranty Professionals AIA Courses Architectural Resources Drawing and 3D Models Energy Data Technical Specifications Tours and Training Find A Dealer Request Literature Email Sign Up Privacy Statement Terms of Use California Users/Privacy"
25,"Casement Windows | Crank and Push Out Casement Windows | Marvin Skip to content Search Support Center Find a Dealer Technical Specifications Careers Products Windows By Collection Marvin Signature Coastline Modern Ultimate Marvin Elevate Marvin Essential By Type Awning Bay and Bow Casement Corner Double Hung Picture Picture Specialty Shapes Single Hung Sliding Storefront All Windows Doors By Collection Marvin Signature Coastline Modern Ultimate Marvin Elevate Marvin Essential By Type Bi-Fold Commercial Entry Garage Interior Lift and Slide Multi-Slide Pivot Sliding Swinging All Doors Skylights Awaken Marvin Skylight Spaces Solutions Coastal Contemporary Historic Replacement Well-Being Inspiration Product Design Options Photo Gallery Project Gallery Blog Why Marvin Our Story Energy Efficiency In The News For Pros Support Center Find a Dealer Technical Specifications Careers Search Marvin Products Window Types Casement Casement WindowsCasement windows open from a side frame hinge. Their large single sash lends them a modern feel with tons of natural light. SIGNATURECoastline CasementSIGNATUREModern CasementSIGNATUREModern Casement Push OutSIGNATUREUltimate CasementSIGNATUREUltimate Casement InswingSIGNATUREUltimate Casement Narrow FrameSIGNATUREUltimate Casement Push OutSIGNATUREUltimate Casement Push Out Narrow FrameSIGNATUREUltimate French CasementSIGNATUREUltimate French Casement Push OutELEVATEElevate CasementELEVATEElevate Casement Narrow FrameESSENTIALEssential Casement What are Casement Windows? A casement window has a single sash hinged on either the left or the right of the frame. Most casement windows are operated with a folding hand crank on the bottom of the frame. This easy operation makes casement windows a top choice for spaces like kitchens or bathrooms, where cabinets or large bathtubs may block access to upper portions of a window. Casement windows typically give off a modern aesthetic, but you can add window grids or divided lite bars for a more traditional feel. Thanks to their single sash design, these windows can offer a wide uninterrupted view, top-notch ventilation, and painless cleaning. Casement windows are also a great choice for safety and security concerns. In case of emergency, the sash can open 90-degrees out to serve as a secondary exit for residents. Explore Casement Window Galleries View DetailsModern Farmhouse Black and White Exterior HomeView Details View DetailsSunny Laundry RoomView Details View DetailsA Singular Take On Scandinavian StyleView Details View All WindowsView All Windows Find a DealerFind a Dealer Products Our Collections All Windows All Doors Skylights Spaces Solutions Coastal Contemporary Historic Design Replacement Well-Being Design & Inspiration Product Design Options Photo Gallery Project Gallery Blog Why Marvin Our Story Careers Energy Efficiency In The News International TruStile Marvin Replacement Support Support Center Care and Maintenance Glossary of Terms Owner's Manuals Parts Manuals Warranty Professionals AIA Courses Architectural Resources Drawing and 3D Models Energy Data Technical Specifications Tours and Training Find A Dealer Request Literature Email Sign Up Privacy Statement Terms of Use California Users/Privacy"
26,"Sliding Windows | Glider Windows | Marvin Skip to content Search Support Center Find a Dealer Technical Specifications Careers Products Windows By Collection Marvin Signature Coastline Modern Ultimate Marvin Elevate Marvin Essential By Type Awning Bay and Bow Casement Corner Double Hung Picture Picture Specialty Shapes Single Hung Sliding Storefront All Windows Doors By Collection Marvin Signature Coastline Modern Ultimate Marvin Elevate Marvin Essential By Type Bi-Fold Commercial Entry Garage Interior Lift and Slide Multi-Slide Pivot Sliding Swinging All Doors Skylights Awaken Marvin Skylight Spaces Solutions Coastal Contemporary Historic Replacement Well-Being Inspiration Product Design Options Photo Gallery Project Gallery Blog Why Marvin Our Story Energy Efficiency In The News For Pros Support Center Find a Dealer Technical Specifications Careers Search Marvin Products Window Types Sliding Sliding WindowsAlso called gliders, sliding windows feature one or more operating sashes that move left to right. This style of sash is ideal for high-traffic areas. SIGNATURECoastline GliderSIGNATUREUltimate GliderELEVATEElevate GliderESSENTIALEssential Glider What are Sliding Windows? Sliding windows, or “gliders,” are windows with one or more operating sashes. They slide left or right rather than up or down like a double hung window. The moveable sashes on sliding windows can swing in, tilt in, or pull out altogether for easy interior and exterior cleaning. Sliding windows give a room full, uninterrupted outdoor views and excellent ventilation. These windows are perfect for large horizontal spaces near high-traffic areas like decks or walkways. Because their sashes don’t open past the plane of the wall, sliding windows save space and won’t damage landscaping that may be close to the house. Explore Sliding Window Photo Galleries View DetailsA Kitchen Remodel Centered on Well-BeingView Details View DetailsEmily Henderson Mountain Home TransformationView Details View All WindowsView All Windows Find a DealerFind a Dealer Products Our Collections All Windows All Doors Skylights Spaces Solutions Coastal Contemporary Historic Design Replacement Well-Being Design & Inspiration Product Design Options Photo Gallery Project Gallery Blog Why Marvin Our Story Careers Energy Efficiency In The News International TruStile Marvin Replacement Support Support Center Care and Maintenance Glossary of Terms Owner's Manuals Parts Manuals Warranty Professionals AIA Courses Architectural Resources Drawing and 3D Models Energy Data Technical Specifications Tours and Training Find A Dealer Request Literature Email Sign Up Privacy Statement Terms of Use California Users/Privacy"
27,Corner Windows | Panoramic Windows | Marvin Skip to content Search Support Center Find a Dealer Technical Specifications Careers Products Windows By Collection Marvin Signature Coastline Modern Ultimate Marvin Elevate Marvin Essential By Type Awning Bay and Bow Casement Corner Double Hung Picture Picture Specialty Shapes Single Hung Sliding Storefront All Windows Doors By Collection Marvin Signature Coastline Modern Ultimate Marvin Elevate Marvin Essential By Type Bi-Fold Commercial Entry Garage Interior Lift and Slide Multi-Slide Pivot Sliding Swinging All Doors Skylights Awaken Marvin Skylight Spaces Solutions Coastal Contemporary Historic Replacement Well-Being Inspiration Product Design Options Photo Gallery Project Gallery Blog Why Marvin Our Story Energy Efficiency In The News For Pros Support Center Find a Dealer Technical Specifications Careers Search Marvin Products Window Types Corner Corner WindowsCorner windows are single units made of two or more sashes meeting at a corner. They need special framing but offer an unbeatable panoramic view. SIGNATUREUltimate CornerSIGNATUREUltimate Corner Narrow Frame What are Corner Windows? A corner unit consists of two or more stationary sashes that span both sides of a building and meet at a corner. This style of window requires a special structural frame that can accommodate a large rough opening with no corner support. Corner windows have a clean and modern aesthetic with minimal visible frame. These windows can give your space a dramatic wall-to-wall panoramic view. Explore Corner Window Photo Galleries View DetailsUrban Multi-family with Corner WindowsView Details View All WindowsView All Windows Find a DealerFind a Dealer Products Our Collections All Windows All Doors Skylights Spaces Solutions Coastal Contemporary Historic Design Replacement Well-Being Design & Inspiration Product Design Options Photo Gallery Project Gallery Blog Why Marvin Our Story Careers Energy Efficiency In The News International TruStile Marvin Replacement Support Support Center Care and Maintenance Glossary of Terms Owner's Manuals Parts Manuals Warranty Professionals AIA Courses Architectural Resources Drawing and 3D Models Energy Data Technical Specifications Tours and Training Find A Dealer Request Literature Email Sign Up Privacy Statement Terms of Use California Users/Privacy
