,Data
6,"Mule-Hide Roofs | Mule-Hide Roof Systems | Topeka, KS Hi. Do you need any help? Close Share On: Close Request Service Serving Northeast Kansas and the Kansas City Area This is a placeholder for the Yext Knolwedge Tags. This message will not appear on the live site, but only within the editor. The Yext Knowledge Tags are successfully installed and will be added to the website. 3830 NW 16th St.Topeka, KS 66618 Home Roofing Services Roof Replacement Service and Repair New Construction Products Duro-Last Roofing Johns Manville Mule-Hide ER Systems GAF Request Service Gallery Reviews About Our Team Employment Contact Mule-Hide Mule-Hide Products Free Evaluations & Estimates Warranties AvailableFree EstimatesCertified by Vendors Request Service Website Request Form Name* Phone* Address* Service* Roof Replacement Service and Repair New Construction Other Thank you, your information has been submitted and we will contact you shortly. Midwest Coating Inc. Oops, there was an error sending your message.Please try again later. Excellent Roofs From Mule-Hide With Mule-Hide Products, you get to choose from multiple types of single-ply roofs (PVC, TPO, and EPDM). They are a cost-friendly solution to commercial roofing problems. Mule-Hide has been in low slope roofing since 1985. They offer a variety of warranties for any of their roofing systems, and Midwest Coating is a Mule-Hide Legacy Contractor. Call us today for your free estimate! Learn More About Mule-Hide Roofing Products Call for a Free Estimate Warranties Available (785) 262-5147 (785) 262-5147 Learn More About Midwest Coating Inc. VISIT US , This is a placeholder for the Yext Knolwedge Tags. This message will not appear on the live site, but only within the editor. The Yext Knowledge Tags are successfully installed and will be added to the website. Get Directions This is a placeholder for the Yext Knolwedge Tags. This message will not appear on the live site, but only within the editor. The Yext Knowledge Tags are successfully installed and will be added to the website. HOURS This is a placeholder for the Yext Knolwedge Tags. This message will not appear on the live site, but only within the editor. The Yext Knowledge Tags are successfully installed and will be added to the website. HOURS This is a placeholder for the Yext Knolwedge Tags. This message will not appear on the live site, but only within the editor. The Yext Knowledge Tags are successfully installed and will be added to the website. Monday Tuesday Wednesday Thursday Friday Saturday Sunday This is a placeholder for the Yext Knolwedge Tags. This message will not appear on the live site, but only within the editor. The Yext Knowledge Tags are successfully installed and will be added to the website. Monday Tuesday Wednesday Thursday Friday Saturday Sunday This is a placeholder for the Yext Knolwedge Tags. This message will not appear on the live site, but only within the editor. The Yext Knowledge Tags are successfully installed and will be added to the website. CONTACT US This is a placeholder for the Yext Knolwedge Tags. This message will not appear on the live site, but only within the editor. The Yext Knowledge Tags are successfully installed and will be added to the website. This is a placeholder for the Yext Knolwedge Tags. This message will not appear on the live site, but only within the editor. The Yext Knowledge Tags are successfully installed and will be added to the website. Hi. Do you need any help? Close Share On: Close Privacy Policy | Do Not Share My Information | Conditions of Use | Notice and Take Down Policy | Website Accessibility Policy © 2023 The content on this website is owned by us and our licensors. Do not copy any content (including images) without our consent. Share by: {{placeholder_retargeting_pixel}} {{placeholder_footer_reserve3}} {{placeholder_footer_reserve4}} {{placeholder_footer_reserve5}} {{placeholder_footer_reserve6}} {{placeholder_footer_reserve7}}"
7,"ER Systems Roofs | ER Systems Roof Systems | Topeka, KS Hi. Do you need any help? Close Share On: Close Request Service Serving Northeast Kansas and the Kansas City Area This is a placeholder for the Yext Knolwedge Tags. This message will not appear on the live site, but only within the editor. The Yext Knowledge Tags are successfully installed and will be added to the website. 3830 NW 16th St.Topeka, KS 66618 Home Roofing Services Roof Replacement Service and Repair New Construction Products Duro-Last Roofing Johns Manville Mule-Hide ER Systems GAF Request Service Gallery Reviews About Our Team Employment Contact ER Systems ER Systems Products Free Evaluations & Estimates Warranties AvailableFree EstimatesCertified by Vendors Request Service Website Request Form Name* Phone* Address* Service* Roof Replacement Service and Repair New Construction Other Thank you, your information has been submitted and we will contact you shortly. Midwest Coating Inc. Oops, there was an error sending your message.Please try again later. Exceptional Roofs From ER Systems At Midwest Coating Inc., you can get premium roof restoration and repair products from ER Systems. No fabric is involved in repairs or restorations. Count on Midwest Coating to provide you with a cost-effective ER Roofing solution. ER Systems offers a 5-10 year warranty for your roof restoration. Call us for a free estimate today! Learn More About ER Systems Products Call for a Free Estimate Warranties Available (785) 262-5147 (785) 262-5147 Learn More About Midwest Coating Inc. VISIT US , This is a placeholder for the Yext Knolwedge Tags. This message will not appear on the live site, but only within the editor. The Yext Knowledge Tags are successfully installed and will be added to the website. Get Directions This is a placeholder for the Yext Knolwedge Tags. This message will not appear on the live site, but only within the editor. The Yext Knowledge Tags are successfully installed and will be added to the website. HOURS This is a placeholder for the Yext Knolwedge Tags. This message will not appear on the live site, but only within the editor. The Yext Knowledge Tags are successfully installed and will be added to the website. HOURS This is a placeholder for the Yext Knolwedge Tags. This message will not appear on the live site, but only within the editor. The Yext Knowledge Tags are successfully installed and will be added to the website. Monday Tuesday Wednesday Thursday Friday Saturday Sunday This is a placeholder for the Yext Knolwedge Tags. This message will not appear on the live site, but only within the editor. The Yext Knowledge Tags are successfully installed and will be added to the website. Monday Tuesday Wednesday Thursday Friday Saturday Sunday This is a placeholder for the Yext Knolwedge Tags. This message will not appear on the live site, but only within the editor. The Yext Knowledge Tags are successfully installed and will be added to the website. CONTACT US This is a placeholder for the Yext Knolwedge Tags. This message will not appear on the live site, but only within the editor. The Yext Knowledge Tags are successfully installed and will be added to the website. This is a placeholder for the Yext Knolwedge Tags. This message will not appear on the live site, but only within the editor. The Yext Knowledge Tags are successfully installed and will be added to the website. Hi. Do you need any help? Close Share On: Close Privacy Policy | Do Not Share My Information | Conditions of Use | Notice and Take Down Policy | Website Accessibility Policy © 2023 The content on this website is owned by us and our licensors. Do not copy any content (including images) without our consent. Share by: {{placeholder_retargeting_pixel}} {{placeholder_footer_reserve3}} {{placeholder_footer_reserve4}} {{placeholder_footer_reserve5}} {{placeholder_footer_reserve6}} {{placeholder_footer_reserve7}}"
8,"GAF Roofs | GAF Roof Systems | Topeka, KS Hi. Do you need any help? Close Share On: Close Request Service Serving Northeast Kansas and the Kansas City Area This is a placeholder for the Yext Knolwedge Tags. This message will not appear on the live site, but only within the editor. The Yext Knowledge Tags are successfully installed and will be added to the website. 3830 NW 16th St.Topeka, KS 66618 Home Roofing Services Roof Replacement Service and Repair New Construction Products Duro-Last Roofing Johns Manville Mule-Hide ER Systems GAF Request Service Gallery Reviews About Our Team Employment Contact GAF GAF Products Free Evaluations & Estimates Warranties AvailableFree EstimatesCertified by Vendors Request Service Website Request Form Name* Phone* Address* Service* Roof Replacement Service and Repair New Construction Other Thank you, your information has been submitted and we will contact you shortly. Midwest Coating Inc. Oops, there was an error sending your message.Please try again later. Versatile Roofing Solutions from GAF No matter if you're looking for a new TPO or PVC roofing system for your commercial property, GAF has a system for you. Let the professionals at Midwest Coating Inc. install your new GAF roofing system. GAF's innovative roofing products are known for their durability, dependability, and ease of installation. Call us for a free estimate today! Learn More About GAF Products Call for a Free Estimate Warranties Available (785) 262-5147 (785) 262-5147 Learn More About Midwest Coating Inc. VISIT US , This is a placeholder for the Yext Knolwedge Tags. This message will not appear on the live site, but only within the editor. The Yext Knowledge Tags are successfully installed and will be added to the website. Get Directions This is a placeholder for the Yext Knolwedge Tags. This message will not appear on the live site, but only within the editor. The Yext Knowledge Tags are successfully installed and will be added to the website. HOURS This is a placeholder for the Yext Knolwedge Tags. This message will not appear on the live site, but only within the editor. The Yext Knowledge Tags are successfully installed and will be added to the website. HOURS This is a placeholder for the Yext Knolwedge Tags. This message will not appear on the live site, but only within the editor. The Yext Knowledge Tags are successfully installed and will be added to the website. Monday Tuesday Wednesday Thursday Friday Saturday Sunday This is a placeholder for the Yext Knolwedge Tags. This message will not appear on the live site, but only within the editor. The Yext Knowledge Tags are successfully installed and will be added to the website. Monday Tuesday Wednesday Thursday Friday Saturday Sunday This is a placeholder for the Yext Knolwedge Tags. This message will not appear on the live site, but only within the editor. The Yext Knowledge Tags are successfully installed and will be added to the website. CONTACT US This is a placeholder for the Yext Knolwedge Tags. This message will not appear on the live site, but only within the editor. The Yext Knowledge Tags are successfully installed and will be added to the website. This is a placeholder for the Yext Knolwedge Tags. This message will not appear on the live site, but only within the editor. The Yext Knowledge Tags are successfully installed and will be added to the website. Hi. Do you need any help? Close Share On: Close Privacy Policy | Do Not Share My Information | Conditions of Use | Notice and Take Down Policy | Website Accessibility Policy © 2023 The content on this website is owned by us and our licensors. Do not copy any content (including images) without our consent. Share by: {{placeholder_retargeting_pixel}} {{placeholder_footer_reserve3}} {{placeholder_footer_reserve4}} {{placeholder_footer_reserve5}} {{placeholder_footer_reserve6}} {{placeholder_footer_reserve7}}"
9,"Request Service from Midwest Coating Inc. | Topeka, KS Hi. Do you need any help? Close Share On: Close Request Service Serving Northeast Kansas and the Kansas City Area This is a placeholder for the Yext Knolwedge Tags. This message will not appear on the live site, but only within the editor. The Yext Knowledge Tags are successfully installed and will be added to the website. 3830 NW 16th St.Topeka, KS 66618 Home Roofing Services Roof Replacement Service and Repair New Construction Products Duro-Last Roofing Johns Manville Mule-Hide ER Systems GAF Request Service Gallery Reviews About Our Team Employment Contact Request Service Request Service Website Request Form Free Text Fill out this short form and a Midwest Coating Inc. representative will contact you shortly. Name* Phone* Email* Service Roof Replacement Service and Repair New Construction Other Message Thank you, your information has been submitted and we will contact you shortly. Midwest Coating Inc. Oops, there was an error sending your message.Please try again later. VISIT US , This is a placeholder for the Yext Knolwedge Tags. This message will not appear on the live site, but only within the editor. The Yext Knowledge Tags are successfully installed and will be added to the website. Get Directions This is a placeholder for the Yext Knolwedge Tags. This message will not appear on the live site, but only within the editor. The Yext Knowledge Tags are successfully installed and will be added to the website. HOURS This is a placeholder for the Yext Knolwedge Tags. This message will not appear on the live site, but only within the editor. The Yext Knowledge Tags are successfully installed and will be added to the website. HOURS This is a placeholder for the Yext Knolwedge Tags. This message will not appear on the live site, but only within the editor. The Yext Knowledge Tags are successfully installed and will be added to the website. Monday Tuesday Wednesday Thursday Friday Saturday Sunday This is a placeholder for the Yext Knolwedge Tags. This message will not appear on the live site, but only within the editor. The Yext Knowledge Tags are successfully installed and will be added to the website. Monday Tuesday Wednesday Thursday Friday Saturday Sunday This is a placeholder for the Yext Knolwedge Tags. This message will not appear on the live site, but only within the editor. The Yext Knowledge Tags are successfully installed and will be added to the website. CONTACT US This is a placeholder for the Yext Knolwedge Tags. This message will not appear on the live site, but only within the editor. The Yext Knowledge Tags are successfully installed and will be added to the website. This is a placeholder for the Yext Knolwedge Tags. This message will not appear on the live site, but only within the editor. The Yext Knowledge Tags are successfully installed and will be added to the website. Hi. Do you need any help? Close Share On: Close Privacy Policy | Do Not Share My Information | Conditions of Use | Notice and Take Down Policy | Website Accessibility Policy © 2023 The content on this website is owned by us and our licensors. Do not copy any content (including images) without our consent. Share by: {{placeholder_retargeting_pixel}} {{placeholder_footer_reserve3}} {{placeholder_footer_reserve4}} {{placeholder_footer_reserve5}} {{placeholder_footer_reserve6}} {{placeholder_footer_reserve7}}"
10,"Midwest Coating Inc. Photo Gallery | Topeka, KS Hi. Do you need any help? Close Share On: Close Request Service Serving Northeast Kansas and the Kansas City Area This is a placeholder for the Yext Knolwedge Tags. This message will not appear on the live site, but only within the editor. The Yext Knowledge Tags are successfully installed and will be added to the website. 3830 NW 16th St.Topeka, KS 66618 Home Roofing Services Roof Replacement Service and Repair New Construction Products Duro-Last Roofing Johns Manville Mule-Hide ER Systems GAF Request Service Gallery Reviews About Our Team Employment Contact Gallery Midwest Coating Inc. Photo Gallery Free Evaluations & Estimates Warranties AvailableFree EstimatesCertified by Vendors Request Service Website Request Form Name* Phone* Address* Service* Roof Replacement Service and Repair New Construction Other Thank you, your information has been submitted and we will contact you shortly. Midwest Coating Inc. Oops, there was an error sending your message.Please try again later. Check Out Our Recent Roofing Projects See our recent roof installation and replacement projects at Midwest Coating Inc. We have been your trusted name in commercial roofing services since 1979. We are a Duro-Last Roofing Platinum Contractor and a Mule-Hide Legacy Contractor, providing outstanding service with the latest roofing technologies. Call us today for your free estimate at (785) 262-5147. Adams Street Button Button Button Fontainbleau Apartments Button Button Button JCCC Button Button Button Kansas Ave Lofts Button Button Button Landoll Button Button Button Pine Tree Plaza Button Button Button School Button Button Button VISIT US , This is a placeholder for the Yext Knolwedge Tags. This message will not appear on the live site, but only within the editor. The Yext Knowledge Tags are successfully installed and will be added to the website. Get Directions This is a placeholder for the Yext Knolwedge Tags. This message will not appear on the live site, but only within the editor. The Yext Knowledge Tags are successfully installed and will be added to the website. HOURS This is a placeholder for the Yext Knolwedge Tags. This message will not appear on the live site, but only within the editor. The Yext Knowledge Tags are successfully installed and will be added to the website. HOURS This is a placeholder for the Yext Knolwedge Tags. This message will not appear on the live site, but only within the editor. The Yext Knowledge Tags are successfully installed and will be added to the website. Monday Tuesday Wednesday Thursday Friday Saturday Sunday This is a placeholder for the Yext Knolwedge Tags. This message will not appear on the live site, but only within the editor. The Yext Knowledge Tags are successfully installed and will be added to the website. Monday Tuesday Wednesday Thursday Friday Saturday Sunday This is a placeholder for the Yext Knolwedge Tags. This message will not appear on the live site, but only within the editor. The Yext Knowledge Tags are successfully installed and will be added to the website. CONTACT US This is a placeholder for the Yext Knolwedge Tags. This message will not appear on the live site, but only within the editor. The Yext Knowledge Tags are successfully installed and will be added to the website. This is a placeholder for the Yext Knolwedge Tags. This message will not appear on the live site, but only within the editor. The Yext Knowledge Tags are successfully installed and will be added to the website. Hi. Do you need any help? Close Share On: Close Privacy Policy | Do Not Share My Information | Conditions of Use | Notice and Take Down Policy | Website Accessibility Policy © 2023 The content on this website is owned by us and our licensors. Do not copy any content (including images) without our consent. Share by: {{placeholder_retargeting_pixel}} {{placeholder_footer_reserve3}} {{placeholder_footer_reserve4}} {{placeholder_footer_reserve5}} {{placeholder_footer_reserve6}} {{placeholder_footer_reserve7}}"
11,"Reviews | Midwest Coating Inc. Hi. Do you need any help? Close Share On: Close Request Service Serving Northeast Kansas and the Kansas City Area This is a placeholder for the Yext Knolwedge Tags. This message will not appear on the live site, but only within the editor. The Yext Knowledge Tags are successfully installed and will be added to the website. 3830 NW 16th St.Topeka, KS 66618 Home Roofing Services Roof Replacement Service and Repair New Construction Products Duro-Last Roofing Johns Manville Mule-Hide ER Systems GAF Request Service Gallery Reviews About Our Team Employment Contact Reviews Midwest Coating Inc. Customer Reviews Free Evaluations & Estimates Warranties AvailableFree EstimatesCertified by Vendors Request Service Website Request Form Name* Phone* Address* Service* Roof Replacement Service and Repair New Construction Other Thank you, your information has been submitted and we will contact you shortly. Midwest Coating Inc. Oops, there was an error sending your message.Please try again later. VISIT US , This is a placeholder for the Yext Knolwedge Tags. This message will not appear on the live site, but only within the editor. The Yext Knowledge Tags are successfully installed and will be added to the website. Get Directions This is a placeholder for the Yext Knolwedge Tags. This message will not appear on the live site, but only within the editor. The Yext Knowledge Tags are successfully installed and will be added to the website. HOURS This is a placeholder for the Yext Knolwedge Tags. This message will not appear on the live site, but only within the editor. The Yext Knowledge Tags are successfully installed and will be added to the website. HOURS This is a placeholder for the Yext Knolwedge Tags. This message will not appear on the live site, but only within the editor. The Yext Knowledge Tags are successfully installed and will be added to the website. Monday Tuesday Wednesday Thursday Friday Saturday Sunday This is a placeholder for the Yext Knolwedge Tags. This message will not appear on the live site, but only within the editor. The Yext Knowledge Tags are successfully installed and will be added to the website. Monday Tuesday Wednesday Thursday Friday Saturday Sunday This is a placeholder for the Yext Knolwedge Tags. This message will not appear on the live site, but only within the editor. The Yext Knowledge Tags are successfully installed and will be added to the website. CONTACT US This is a placeholder for the Yext Knolwedge Tags. This message will not appear on the live site, but only within the editor. The Yext Knowledge Tags are successfully installed and will be added to the website. This is a placeholder for the Yext Knolwedge Tags. This message will not appear on the live site, but only within the editor. The Yext Knowledge Tags are successfully installed and will be added to the website. Hi. Do you need any help? Close Share On: Close Privacy Policy | Do Not Share My Information | Conditions of Use | Notice and Take Down Policy | Website Accessibility Policy © 2023 The content on this website is owned by us and our licensors. Do not copy any content (including images) without our consent. Share by: {{placeholder_retargeting_pixel}} {{placeholder_footer_reserve3}} {{placeholder_footer_reserve4}} {{placeholder_footer_reserve5}} {{placeholder_footer_reserve6}} {{placeholder_footer_reserve7}}"
