,Data
0,"Commercial Roofing Contractors Lawrence, KS | Topeka, KS Hi. Do you need any help? Close Share On: Close Request Service Serving Northeast Kansas and the Kansas City Area This is a placeholder for the Yext Knolwedge Tags. This message will not appear on the live site, but only within the editor. The Yext Knowledge Tags are successfully installed and will be added to the website. 3830 NW 16th St.Topeka, KS 66618 Home Roofing Services Roof Replacement Service and Repair New Construction Products Duro-Last Roofing Johns Manville Mule-Hide ER Systems GAF Request Service Gallery Reviews About Our Team Employment Contact Your Experienced Commercial Roofing Contractors Free Evaluations & Estimates Warranties AvailableFree EstimatesCertified by Vendors Request Service Website Request Form Name* Phone* Address* Service* Roof Replacement Service and Repair New Construction Other Thank you, your information has been submitted and we will contact you shortly. Midwest Coating Inc. Oops, there was an error sending your message.Please try again later. Comprehensive Commercial Roofing Services When it comes to your commercial roofing needs, no one has more experience and know-how than the commercial roofing contractors in Topeka, KS here at Midwest Coating, Inc. We have been serving businesses throughout Topeka and NE Kansas area since 1979. We value the relationships we've developed with our customers throughout our company's history, and are committed to quality roofing solutions at a fair price. Let us be your first call for your commercial roofing needs. We offer free estimates, free roof inspections, and have multiple roofing methods at our disposal for any commercial roofing need. Midwest Coating is a family owned and locally operated business. We own our equipment and are up to date on the latest roofing methods. We take safety and customer satisfaction very seriously and treat each roof like it is our own. We are premier commercial roofing contractors in Lawrence, KS and nearby areas and have an A+ rating from the Better Business Bureau. Don't hesitate to call us today! Roof Replacement For big or small projects, Midwest Coating Inc can handle all your roof replacement projects. We do full tear-offs, metal retrofits, and more for your commercial property. Learn More Service and Repair With our full-service roofing repair department, we can handle your roof emergencies promptly. We repair all types of commercial roofs, from shingles to complex systems. Learn More New Construction Our trained and experienced professionals have handled many new commercial construction projects. We make sure your new roof is done right the first time. Learn More Here's what our satisfied customers are saying... Free Estimates Available Call us at (785) 262-5147 Request Service VISIT US , This is a placeholder for the Yext Knolwedge Tags. This message will not appear on the live site, but only within the editor. The Yext Knowledge Tags are successfully installed and will be added to the website. Get Directions This is a placeholder for the Yext Knolwedge Tags. This message will not appear on the live site, but only within the editor. The Yext Knowledge Tags are successfully installed and will be added to the website. HOURS This is a placeholder for the Yext Knolwedge Tags. This message will not appear on the live site, but only within the editor. The Yext Knowledge Tags are successfully installed and will be added to the website. HOURS This is a placeholder for the Yext Knolwedge Tags. This message will not appear on the live site, but only within the editor. The Yext Knowledge Tags are successfully installed and will be added to the website. Monday Tuesday Wednesday Thursday Friday Saturday Sunday This is a placeholder for the Yext Knolwedge Tags. This message will not appear on the live site, but only within the editor. The Yext Knowledge Tags are successfully installed and will be added to the website. Monday Tuesday Wednesday Thursday Friday Saturday Sunday This is a placeholder for the Yext Knolwedge Tags. This message will not appear on the live site, but only within the editor. The Yext Knowledge Tags are successfully installed and will be added to the website. CONTACT US This is a placeholder for the Yext Knolwedge Tags. This message will not appear on the live site, but only within the editor. The Yext Knowledge Tags are successfully installed and will be added to the website. This is a placeholder for the Yext Knolwedge Tags. This message will not appear on the live site, but only within the editor. The Yext Knowledge Tags are successfully installed and will be added to the website. Hi. Do you need any help? Close Share On: Close Privacy Policy | Do Not Share My Information | Conditions of Use | Notice and Take Down Policy | Website Accessibility Policy © 2023 The content on this website is owned by us and our licensors. Do not copy any content (including images) without our consent. Share by: {{placeholder_retargeting_pixel}} {{placeholder_footer_reserve3}} {{placeholder_footer_reserve4}} {{placeholder_footer_reserve5}} {{placeholder_footer_reserve6}} {{placeholder_footer_reserve7}}"
1,"Roof Replacement Services Lawrence, KS | Topeka, KS Hi. Do you need any help? Close Share On: Close Request Service Serving Northeast Kansas and the Kansas City Area This is a placeholder for the Yext Knolwedge Tags. This message will not appear on the live site, but only within the editor. The Yext Knowledge Tags are successfully installed and will be added to the website. 3830 NW 16th St.Topeka, KS 66618 Home Roofing Services Roof Replacement Service and Repair New Construction Products Duro-Last Roofing Johns Manville Mule-Hide ER Systems GAF Request Service Gallery Reviews About Our Team Employment Contact Roof Replacement Quality Roof Replacement Services Free Evaluations & Estimates Warranties AvailableFree EstimatesCertified by Vendors Request Service Website Request Form Name* Phone* Address* Service* Roof Replacement Service and Repair New Construction Other Thank you, your information has been submitted and we will contact you shortly. Midwest Coating Inc. Oops, there was an error sending your message.Please try again later. Get Reliable Roofing Replacement Services Count on the experts at Midwest Coating to handle all your projects big or small with the best roof replacement services in Topeka, KS and surrounding areas. We can install single-ply re-roofs, which will go over your current roofing system. We also provide full roof tear-offs down to the deck, along with deck replacements. We specialize in metal roof retrofits with single-ply membrane. When you need reliable roof replacement services in Topeka, KS or nearby areas, we're the team to call. We can provide you with the roof repair service Topeka, KS residents rely on, so don't hesitate to get started with our services. Should you be looking for a quality roof repair service in Lawrence, KS or nearby areas, don't wait to get in touch with us. Rely on our team to handle your roof replacement services in Lawrence, KS. Call us today for a free estimate! Call for a Free Estimate Warranties Available (785) 262-5147 (785) 262-5147 Learn More About Midwest Coating Inc. VISIT US , This is a placeholder for the Yext Knolwedge Tags. This message will not appear on the live site, but only within the editor. The Yext Knowledge Tags are successfully installed and will be added to the website. Get Directions This is a placeholder for the Yext Knolwedge Tags. This message will not appear on the live site, but only within the editor. The Yext Knowledge Tags are successfully installed and will be added to the website. HOURS This is a placeholder for the Yext Knolwedge Tags. This message will not appear on the live site, but only within the editor. The Yext Knowledge Tags are successfully installed and will be added to the website. HOURS This is a placeholder for the Yext Knolwedge Tags. This message will not appear on the live site, but only within the editor. The Yext Knowledge Tags are successfully installed and will be added to the website. Monday Tuesday Wednesday Thursday Friday Saturday Sunday This is a placeholder for the Yext Knolwedge Tags. This message will not appear on the live site, but only within the editor. The Yext Knowledge Tags are successfully installed and will be added to the website. Monday Tuesday Wednesday Thursday Friday Saturday Sunday This is a placeholder for the Yext Knolwedge Tags. This message will not appear on the live site, but only within the editor. The Yext Knowledge Tags are successfully installed and will be added to the website. CONTACT US This is a placeholder for the Yext Knolwedge Tags. This message will not appear on the live site, but only within the editor. The Yext Knowledge Tags are successfully installed and will be added to the website. This is a placeholder for the Yext Knolwedge Tags. This message will not appear on the live site, but only within the editor. The Yext Knowledge Tags are successfully installed and will be added to the website. Hi. Do you need any help? Close Share On: Close Privacy Policy | Do Not Share My Information | Conditions of Use | Notice and Take Down Policy | Website Accessibility Policy © 2023 The content on this website is owned by us and our licensors. Do not copy any content (including images) without our consent. Share by: {{placeholder_retargeting_pixel}} {{placeholder_footer_reserve3}} {{placeholder_footer_reserve4}} {{placeholder_footer_reserve5}} {{placeholder_footer_reserve6}} {{placeholder_footer_reserve7}}"
2,"Roof Repair Service Lawrence, KS | Topeka, KS Hi. Do you need any help? Close Share On: Close Request Service Serving Northeast Kansas and the Kansas City Area This is a placeholder for the Yext Knolwedge Tags. This message will not appear on the live site, but only within the editor. The Yext Knowledge Tags are successfully installed and will be added to the website. 3830 NW 16th St.Topeka, KS 66618 Home Roofing Services Roof Replacement Service and Repair New Construction Products Duro-Last Roofing Johns Manville Mule-Hide ER Systems GAF Request Service Gallery Reviews About Our Team Employment Contact Service and Repair Quality Roof Repair Service in Topeka & Northeast Kansas Free Evaluations & Estimates Warranties AvailableFree EstimatesCertified by Vendors Request Service Website Request Form Name* Phone* Address* Service* Roof Replacement Service and Repair New Construction Other Thank you, your information has been submitted and we will contact you shortly. Midwest Coating Inc. Oops, there was an error sending your message.Please try again later. Providing You With Quality Roofing Services Midwest Coating Inc. has an on-call roof leak service/repair department. Trust our service team to repair any type of roofing system. From shingles to single-ply, modified, metal and coated commercial roofing systems, we've got solutions for all types of roof repair needs. If you prefer not to spend money on a brand-new roof, we can assess the roof and repair only what is needed to get your roof watertight. Count on our experts to flash in new roof penetrations and work with HVAC contractors on your building for any type of roof systems. Call us today for a free estimate on our roof repair services! Call for a Free Estimate Warranties Available (785) 262-5147 (785) 262-5147 Learn More About Midwest Coating Inc. VISIT US , This is a placeholder for the Yext Knolwedge Tags. This message will not appear on the live site, but only within the editor. The Yext Knowledge Tags are successfully installed and will be added to the website. Get Directions This is a placeholder for the Yext Knolwedge Tags. This message will not appear on the live site, but only within the editor. The Yext Knowledge Tags are successfully installed and will be added to the website. HOURS This is a placeholder for the Yext Knolwedge Tags. This message will not appear on the live site, but only within the editor. The Yext Knowledge Tags are successfully installed and will be added to the website. HOURS This is a placeholder for the Yext Knolwedge Tags. This message will not appear on the live site, but only within the editor. The Yext Knowledge Tags are successfully installed and will be added to the website. Monday Tuesday Wednesday Thursday Friday Saturday Sunday This is a placeholder for the Yext Knolwedge Tags. This message will not appear on the live site, but only within the editor. The Yext Knowledge Tags are successfully installed and will be added to the website. Monday Tuesday Wednesday Thursday Friday Saturday Sunday This is a placeholder for the Yext Knolwedge Tags. This message will not appear on the live site, but only within the editor. The Yext Knowledge Tags are successfully installed and will be added to the website. CONTACT US This is a placeholder for the Yext Knolwedge Tags. This message will not appear on the live site, but only within the editor. The Yext Knowledge Tags are successfully installed and will be added to the website. This is a placeholder for the Yext Knolwedge Tags. This message will not appear on the live site, but only within the editor. The Yext Knowledge Tags are successfully installed and will be added to the website. Hi. Do you need any help? Close Share On: Close Privacy Policy | Do Not Share My Information | Conditions of Use | Notice and Take Down Policy | Website Accessibility Policy © 2023 The content on this website is owned by us and our licensors. Do not copy any content (including images) without our consent. Share by: {{placeholder_retargeting_pixel}} {{placeholder_footer_reserve3}} {{placeholder_footer_reserve4}} {{placeholder_footer_reserve5}} {{placeholder_footer_reserve6}} {{placeholder_footer_reserve7}}"
3,"New Commercial Roofs | Commercial Roof Construction | Topeka Hi. Do you need any help? Close Share On: Close Request Service Serving Northeast Kansas and the Kansas City Area This is a placeholder for the Yext Knolwedge Tags. This message will not appear on the live site, but only within the editor. The Yext Knowledge Tags are successfully installed and will be added to the website. 3830 NW 16th St.Topeka, KS 66618 Home Roofing Services Roof Replacement Service and Repair New Construction Products Duro-Last Roofing Johns Manville Mule-Hide ER Systems GAF Request Service Gallery Reviews About Our Team Employment Contact New Construction New Construction Services Free Evaluations & Estimates Warranties AvailableFree EstimatesCertified by Vendors Request Service Website Request Form Name* Phone* Address* Service* Roof Replacement Service and Repair New Construction Other Thank you, your information has been submitted and we will contact you shortly. Midwest Coating Inc. Oops, there was an error sending your message.Please try again later. Excellent New Construction Roofing Services Midwest Coating has a full-service estimating and project management team. We have completed many new construction roofing projects in our over 40 years in business, while developing many key relationships with building owners, architects, and general contractors. You can trust our team to get your new construction or architect re-roof porjects done right the first time. Call us for a free estimate today! Call for a Free Estimate Warranties Available (785) 262-5147 (785) 262-5147 Learn More About Midwest Coating Inc. VISIT US , This is a placeholder for the Yext Knolwedge Tags. This message will not appear on the live site, but only within the editor. The Yext Knowledge Tags are successfully installed and will be added to the website. Get Directions This is a placeholder for the Yext Knolwedge Tags. This message will not appear on the live site, but only within the editor. The Yext Knowledge Tags are successfully installed and will be added to the website. HOURS This is a placeholder for the Yext Knolwedge Tags. This message will not appear on the live site, but only within the editor. The Yext Knowledge Tags are successfully installed and will be added to the website. HOURS This is a placeholder for the Yext Knolwedge Tags. This message will not appear on the live site, but only within the editor. The Yext Knowledge Tags are successfully installed and will be added to the website. Monday Tuesday Wednesday Thursday Friday Saturday Sunday This is a placeholder for the Yext Knolwedge Tags. This message will not appear on the live site, but only within the editor. The Yext Knowledge Tags are successfully installed and will be added to the website. Monday Tuesday Wednesday Thursday Friday Saturday Sunday This is a placeholder for the Yext Knolwedge Tags. This message will not appear on the live site, but only within the editor. The Yext Knowledge Tags are successfully installed and will be added to the website. CONTACT US This is a placeholder for the Yext Knolwedge Tags. This message will not appear on the live site, but only within the editor. The Yext Knowledge Tags are successfully installed and will be added to the website. This is a placeholder for the Yext Knolwedge Tags. This message will not appear on the live site, but only within the editor. The Yext Knowledge Tags are successfully installed and will be added to the website. Hi. Do you need any help? Close Share On: Close Privacy Policy | Do Not Share My Information | Conditions of Use | Notice and Take Down Policy | Website Accessibility Policy © 2023 The content on this website is owned by us and our licensors. Do not copy any content (including images) without our consent. Share by: {{placeholder_retargeting_pixel}} {{placeholder_footer_reserve3}} {{placeholder_footer_reserve4}} {{placeholder_footer_reserve5}} {{placeholder_footer_reserve6}} {{placeholder_footer_reserve7}}"
4,"Duro-Last Roofs | Duro-Last Roof Systems | Topeka, KS Hi. Do you need any help? Close Share On: Close Request Service Serving Northeast Kansas and the Kansas City Area This is a placeholder for the Yext Knolwedge Tags. This message will not appear on the live site, but only within the editor. The Yext Knowledge Tags are successfully installed and will be added to the website. 3830 NW 16th St.Topeka, KS 66618 Home Roofing Services Roof Replacement Service and Repair New Construction Products Duro-Last Roofing Johns Manville Mule-Hide ER Systems GAF Request Service Gallery Reviews About Our Team Employment Contact Duro-Last Roofing Duro-Last Roofing Products Free Evaluations & Estimates Warranties AvailableFree EstimatesCertified by Vendors Request Service Website Request Form Name* Phone* Address* Service* Roof Replacement Service and Repair New Construction Other Thank you, your information has been submitted and we will contact you shortly. Midwest Coating Inc. Oops, there was an error sending your message.Please try again later. Long-Lasting Duro-Last Roofing Systems Duro-Last is a high-quality PVC product with prefabricated deck sheets, parapet walls, and roof penetration details. This makes it installer-friendly with fewer seams on your roof. It can work in any type of commercial roofing situation. Call us for a free estimate today — ask about our warranties! Duro-Last offers 15-30 year warranties and also offers consequential damages with selected warranties. Midwest Coating Inc. has been installing this product since 1982 and is a Duro-Last Roofing Platinum Contractor. Learn More About Duro Last Products Call for a Free Estimate Warranties Available (785) 262-5147 (785) 262-5147 Learn More About Midwest Coating Inc. VISIT US , This is a placeholder for the Yext Knolwedge Tags. This message will not appear on the live site, but only within the editor. The Yext Knowledge Tags are successfully installed and will be added to the website. Get Directions This is a placeholder for the Yext Knolwedge Tags. This message will not appear on the live site, but only within the editor. The Yext Knowledge Tags are successfully installed and will be added to the website. HOURS This is a placeholder for the Yext Knolwedge Tags. This message will not appear on the live site, but only within the editor. The Yext Knowledge Tags are successfully installed and will be added to the website. HOURS This is a placeholder for the Yext Knolwedge Tags. This message will not appear on the live site, but only within the editor. The Yext Knowledge Tags are successfully installed and will be added to the website. Monday Tuesday Wednesday Thursday Friday Saturday Sunday This is a placeholder for the Yext Knolwedge Tags. This message will not appear on the live site, but only within the editor. The Yext Knowledge Tags are successfully installed and will be added to the website. Monday Tuesday Wednesday Thursday Friday Saturday Sunday This is a placeholder for the Yext Knolwedge Tags. This message will not appear on the live site, but only within the editor. The Yext Knowledge Tags are successfully installed and will be added to the website. CONTACT US This is a placeholder for the Yext Knolwedge Tags. This message will not appear on the live site, but only within the editor. The Yext Knowledge Tags are successfully installed and will be added to the website. This is a placeholder for the Yext Knolwedge Tags. This message will not appear on the live site, but only within the editor. The Yext Knowledge Tags are successfully installed and will be added to the website. Hi. Do you need any help? Close Share On: Close Privacy Policy | Do Not Share My Information | Conditions of Use | Notice and Take Down Policy | Website Accessibility Policy © 2023 The content on this website is owned by us and our licensors. Do not copy any content (including images) without our consent. Share by: {{placeholder_retargeting_pixel}} {{placeholder_footer_reserve3}} {{placeholder_footer_reserve4}} {{placeholder_footer_reserve5}} {{placeholder_footer_reserve6}} {{placeholder_footer_reserve7}}"
5,"Johns Manville Roofs | Johns Manville Roof Systems Topeka Hi. Do you need any help? Close Share On: Close Request Service Serving Northeast Kansas and the Kansas City Area This is a placeholder for the Yext Knolwedge Tags. This message will not appear on the live site, but only within the editor. The Yext Knowledge Tags are successfully installed and will be added to the website. 3830 NW 16th St.Topeka, KS 66618 Home Roofing Services Roof Replacement Service and Repair New Construction Products Duro-Last Roofing Johns Manville Mule-Hide ER Systems GAF Request Service Gallery Reviews About Our Team Employment Contact Johns Manville Johns Manville Products Free Evaluations & Estimates Warranties AvailableFree EstimatesCertified by Vendors Request Service Website Request Form Name* Phone* Address* Service* Roof Replacement Service and Repair New Construction Other Thank you, your information has been submitted and we will contact you shortly. Midwest Coating Inc. Oops, there was an error sending your message.Please try again later. Durable Roofs From Johns Manville Midwest Coating Inc. installs all types of commercial roofs from Johns Manville (EPDM, PVC, TPO, APP, and SBS modified systems). Johns Manville is one of the most recognized roofing manufacturers in the industry. It has been around for over 150 years. When you choose a roof from Johns Manville, you can be sure to get a variety of warranties for any roofing system. Call us today for your free estimate! Learn More About Johns Manville Roofing Products Call for a Free Estimate Warranties Available (785) 262-5147 (785) 262-5147 Learn More About Midwest Coating Inc. VISIT US , This is a placeholder for the Yext Knolwedge Tags. This message will not appear on the live site, but only within the editor. The Yext Knowledge Tags are successfully installed and will be added to the website. Get Directions This is a placeholder for the Yext Knolwedge Tags. This message will not appear on the live site, but only within the editor. The Yext Knowledge Tags are successfully installed and will be added to the website. HOURS This is a placeholder for the Yext Knolwedge Tags. This message will not appear on the live site, but only within the editor. The Yext Knowledge Tags are successfully installed and will be added to the website. HOURS This is a placeholder for the Yext Knolwedge Tags. This message will not appear on the live site, but only within the editor. The Yext Knowledge Tags are successfully installed and will be added to the website. Monday Tuesday Wednesday Thursday Friday Saturday Sunday This is a placeholder for the Yext Knolwedge Tags. This message will not appear on the live site, but only within the editor. The Yext Knowledge Tags are successfully installed and will be added to the website. Monday Tuesday Wednesday Thursday Friday Saturday Sunday This is a placeholder for the Yext Knolwedge Tags. This message will not appear on the live site, but only within the editor. The Yext Knowledge Tags are successfully installed and will be added to the website. CONTACT US This is a placeholder for the Yext Knolwedge Tags. This message will not appear on the live site, but only within the editor. The Yext Knowledge Tags are successfully installed and will be added to the website. This is a placeholder for the Yext Knolwedge Tags. This message will not appear on the live site, but only within the editor. The Yext Knowledge Tags are successfully installed and will be added to the website. Hi. Do you need any help? Close Share On: Close Privacy Policy | Do Not Share My Information | Conditions of Use | Notice and Take Down Policy | Website Accessibility Policy © 2023 The content on this website is owned by us and our licensors. Do not copy any content (including images) without our consent. Share by: {{placeholder_retargeting_pixel}} {{placeholder_footer_reserve3}} {{placeholder_footer_reserve4}} {{placeholder_footer_reserve5}} {{placeholder_footer_reserve6}} {{placeholder_footer_reserve7}}"
