,Data
18,"Dedicated | Magnum Companies [banner id=""226125""] TRACK YOUR SHIPMENT CUSTOMERS EMPLOYEES Careers DRIVER JOBS OPEN DRIVER JOBS OTR JOB INFO TRAINEE JOB INFO NON DRIVER JOBS BENEFITS DOT VERIFICATION DIVISIONS TRUCKLOAD LTL LTL Locations LTL Resources LTL Rate Request Weather Delays Unite By Magnum DEDICATED LOGISTICS EXPEDITED WAREHOUSE ABOUT US RISK MANAGEMENT BLOG BIG BLUE NEWS GALLERY CONTACT Select Page We are currently experiencing WEATHER DELAYSDETAILS DEDICATED Dedicated is designed to serve large customers who require dedicated trucks and trailers solely for their needs. CONTACT US TODAY Dedicated Magnum Dedicated was incorporated in 2008. The division is designed to serve large customers who want Magnum to provide dedicated trucks and trailers solely to their needs. We also have a regional fleet, available for short haul (500 miles or less) shipping. REQUEST A RATE CONTACT US WHY CHOOSE MAGNUM Dedicated CapacityRegional CapacityTechnology Our fleet contracts to our business partners under multi-year contracts. Magnum secures trusted, experienced local professionals in the driving industry. We seek long term partnerships not only with customers, but also driving professionals, which provides a higher level of service than many other fleets. We are able to analyze your transportation patterns and determine if a dedicated contract is a good fit for your needs. Magnum can dedicate anywhere from 1 to 50 truck and drivers, per business partner. Our regional dry fleet runs within Minnesota, Iowa, Wisconsin, northern Illinois, eastern North Dakota, and eastern Nebraska. Magnum’s business partners utilize this resource for both spot load activity, and regular, non-dedicated contract activity. It serves as a standard regional truckload division. We focus on activity within 500 miles or less in length of haul, primary dry load freight. Our goal is to provide a high level of service and cost value, utilizing our business partner’s networks to find mutual efficiencies, and passing along that value in return. Magnum is fully compliant with ELD requirements, 100% of our drivers use Electronic Logs. We provide both tractor and trailer tracking. Magnum is fully EDI capable. We use a state of the art, customizable software system that can adapt to the various needs of our business partners and improves our level of accuracy. Magnum Dedicated was incorporated in 2008. The division is designed to serve large customers who want Magnum to provide dedicated trucks and trailers solely to their needs. We also have a regional fleet, available for short haul (500 miles or less) shipping. REQUEST A RATE CONTACT US WHY CHOOSE MAGNUM Dedicated CapacityRegional CapacityTechnology Our fleet contracts to our business partners under multi-year contracts. Magnum secures trusted, experienced local professionals in the driving industry. We seek long term partnerships not only with customers, but also driving professionals, which provides a higher level of service than many other fleets. We are able to analyze your transportation patterns and determine if a dedicated contract is a good fit for your needs. Magnum can dedicate anywhere from 1 to 50 truck and drivers, per business partner. Our regional dry fleet runs within Minnesota, Iowa, Wisconsin, northern Illinois, eastern North Dakota, and eastern Nebraska. Magnum’s business partners utilize this resource for both spot load activity, and regular, non-dedicated contract activity. It serves as a standard regional truckload division. We focus on activity within 500 miles or less in length of haul, primary dry load freight. Our goal is to provide a high level of service and cost value, utilizing our business partner’s networks to find mutual efficiencies, and passing along that value in return. Magnum is fully compliant with ELD requirements, 100% of our drivers use Electronic Logs. We provide both tractor and trailer tracking. Magnum is fully EDI capable. We use a state of the art, customizable software system that can adapt to the various needs of our business partners and improves our level of accuracy. Dedicated Services Map Dedicated Contacts  Sales Send Email  Operations Send Email Get In Touch Corporate Office 3000 7th Ave. N.Fargo, ND 58102(701) 293-8082 (800) 726-7510 info@magnumlog.com FollowFollowFollowFollowFollow © 2023 by Magnum All Rights Reserved | Site Created by OpGo Marketing Get In Touch Corporate Office 3000 7th Ave. N.Fargo, ND 58102 (800) 726-7510 info@magnumlog.com FollowFollowFollowFollowFollow © 2023 by Magnum All Rights Reserved | Site Created by OpGo Marketing"
19,"Logistics | Magnum Companies [banner id=""226125""] TRACK YOUR SHIPMENT CUSTOMERS EMPLOYEES Careers DRIVER JOBS OPEN DRIVER JOBS OTR JOB INFO TRAINEE JOB INFO NON DRIVER JOBS BENEFITS DOT VERIFICATION DIVISIONS TRUCKLOAD LTL LTL Locations LTL Resources LTL Rate Request Weather Delays Unite By Magnum DEDICATED LOGISTICS EXPEDITED WAREHOUSE ABOUT US RISK MANAGEMENT BLOG BIG BLUE NEWS GALLERY CONTACT Select Page LOGISTICS Magnum is a technology-based, multi-tiered company that provides innovative solutions to customers. CONTACT US TODAY Logistics Magnum Logistics focuses on supply chain excellence. We bring value to our business partners at all levels of the supply chain, by first taking the time to understand their needs, then providing a focused strategy to meet those needs. We are uniquely equipped to partner with fellow asset carriers as well as utilize our own asset capacity. EXPEDITED SERVICES Request a Rate CONTACT US Our team focuses on supply chain excellence. We add value to our business partners at all levels of the supply chain, by first taking the time to understand their needs, then providing a focused strategy to meet those needs. We understand the need to prove ourselves and grow relationships based on trust and ethics. REQUEST A RATE CONTACT US Office Locations 3000 7th Ave N Fargo, ND 58102 800-726-1759 8835 Evergreen Blvd Coon Rapids, MN 55433800-726-1759 LOGISTICS CONTACTS  Sales Send Email  Operations Send Email Get In Touch Corporate Office 3000 7th Ave. N.Fargo, ND 58102(701) 293-8082 (800) 726-7510 info@magnumlog.com FollowFollowFollowFollowFollow © 2023 by Magnum All Rights Reserved | Site Created by OpGo Marketing Get In Touch Corporate Office 3000 7th Ave. N.Fargo, ND 58102 (800) 726-7510 info@magnumlog.com FollowFollowFollowFollowFollow © 2023 by Magnum All Rights Reserved | Site Created by OpGo Marketing"
20,"Expedited Services | Magnum Companies [banner id=""226125""] TRACK YOUR SHIPMENT CUSTOMERS EMPLOYEES Careers DRIVER JOBS OPEN DRIVER JOBS OTR JOB INFO TRAINEE JOB INFO NON DRIVER JOBS BENEFITS DOT VERIFICATION DIVISIONS TRUCKLOAD LTL LTL Locations LTL Resources LTL Rate Request Weather Delays Unite By Magnum DEDICATED LOGISTICS EXPEDITED WAREHOUSE ABOUT US RISK MANAGEMENT BLOG BIG BLUE NEWS GALLERY CONTACT Select Page EXPEDITED SERVICES From emergency to expedited services, Magnum knows what it takes to get the job done safely. REQUEST A RATE Expedited Services Do you have an emergency or a load that needs to be expedited? Magnum can take care of that for you, whenever and wherever you need it! Do you need to expedite a load with a tractor-trailer? Magnum will provide you with the most timely updates along the way. As an industry leader in safety and reliability, you can expect expedited transportation services 24 hours a day, 365 days a year. Our team focuses on supply chain excellence; from expedited to general services, we understand your needs as a company. We bring value to our business partners at all levels of the supply chain, by first taking the time to understand your needs, then providing the best-focused strategy to meet those needs. Fill out our request a rate form or call us at 1-800-726-7510 to let us take care of your expedited needs. Request a Rate CONTACT US WHY CHOOSE MAGNUM SolutionsAdministrationBrokerageValue Magnum Logistics analyzes internal asset usage among two of our truckload divisions, and excess capacity from our LTL division, combined with partner carrier collaboration to provide transportation solutions that give our business partners both spend value and service. Our team serves as full transportation administration for some of our customers. We can coordinate inbound and outbound shipments to ensure proper replenishment levels while maintaining a safe, contracted, high-performing carrier base, and consolidate all activity into one weekly bill for customers giving a full line of sight to cost. Magnum hauls hazardous material although we do not haul hazardous waste. We offer flatbed (available in MN, ND, and SD) and dedicated services, and have the capability to haul temperature-controlled hazardous materials, Through working with our five divisions, we provide complete logistics solutions or any portion thereof and customize them to your specific needs. Magnum adds value when there are short lead times on your shipments. We understand the urgency around short lead times and the need for extra communication and diligence from a Logistics company. Superior communication and a trusted partner carrier with strong service, backed by internal assets are what makes Magnum a valuable long-term business partner. Do you have an emergency or a load that needs to be expedited? Magnum can handle that for you, whenever and wherever you need it! Do you need to expedite a load with a tractor-trailer? Magnum will provide you with the most timely updates along the way. As an industry leader in safety and reliability, you can expect expedited transportation services 24 hours a day, 365 days a year. At Magnum, we get the job done. Our team focuses on supply chain excellence; from expedited to general services, we understand your needs as a company. We bring value to our business partners at all levels of the supply chain, by first taking the time to understand their needs, then providing the best-focused strategy to meet those needs. Fill out our Request a rate form or call us at 1-800-726-7510 EXT 1 to let us take care of your expedited services. REQUEST A RATE CONTACT US SolutionsAdministrationBrokerageValue Magnum Logistics analyzes internal asset usage among two of our truckload divisions, and excess capacity from our LTL division, combined with partner carrier collaboration to provide transportation solutions that give our business partners both spend value and service. Our team serves as full transportation administration for some of our customers. We can coordinate inbound and outbound shipments to ensure proper replenishment levels while maintaining a safe, contracted, high-performing carrier base, and consolidate all activity into one weekly bill for customers giving a full line of sight to cost. Magnum hauls hazardous material although we do not haul hazardous waste. We offer flatbed (available in MN, ND, and SD) and dedicated services, and have the capability to haul temperature-controlled hazardous materials, Through working with our five divisions, we provide complete logistics solutions or any portion thereof and customize them to your specific needs. Magnum adds value when there are short lead times on your shipments. We understand the urgency around short lead times and the need for extra communication and diligence from a Logistics company. Superior communication and a trusted partner carrier with strong service, backed by internal assets are what makes Magnum a valuable long-term business partner. EXPEDITE CONTACTS  Expedited Sales (800) 726-7510 Send Email Get In Touch Corporate Office 3000 7th Ave. N.Fargo, ND 58102(701) 293-8082 (800) 726-7510 info@magnumlog.com FollowFollowFollowFollowFollow © 2023 by Magnum All Rights Reserved | Site Created by OpGo Marketing Get In Touch Corporate Office 3000 7th Ave. N.Fargo, ND 58102 (800) 726-7510 info@magnumlog.com FollowFollowFollowFollowFollow © 2023 by Magnum All Rights Reserved | Site Created by OpGo Marketing"
21,"About | Magnum Companies [banner id=""226125""] TRACK YOUR SHIPMENT CUSTOMERS EMPLOYEES Careers DRIVER JOBS OPEN DRIVER JOBS OTR JOB INFO TRAINEE JOB INFO NON DRIVER JOBS BENEFITS DOT VERIFICATION DIVISIONS TRUCKLOAD LTL LTL Locations LTL Resources LTL Rate Request Weather Delays Unite By Magnum DEDICATED LOGISTICS EXPEDITED WAREHOUSE ABOUT US RISK MANAGEMENT BLOG BIG BLUE NEWS GALLERY CONTACT Select Page We are currently experiencing WEATHER DELAYSDETAILS About Us Our history gives us the experience. Our size makes us a family. Our equipment gets the job done, and our employees are here for YOU! ABOUT MAGNUM Incorporated in the state of North Dakota, Magnum maintains headquarters in the city of Fargo. We have a centralized operational support center that handles Accounting, Safety and Compliance, Information Technology, Maintenance, Marketing and Human Resources. We also manage a network of terminals throughout ten states. Each terminal is managed by a team of sales and operations staff that is sensitive to local market needs and responsive to specific customer requirements. Magnum was established in 1978, to provide supply chain network solutions. Magnum is comprised of five separately incorporated divisions geared towards meeting the specific needs of its customers; Magnum LTD, Magnum LTL, Magnum Dedicated, Magnum Warehousing, and Magnum Logistics. With Corporate headquarters located in Fargo, North Dakota, Magnum services a variety of industries throughout the United States. We are a frontline warehousing and logistics service provider, with continued goals to grow and remain competitive in the National economy. OUR MISSION “Good jobs for good people, making the impossible, possible.” CORPORATE CITIZENSHIP Magnum understands that our day-to-day actions have an impact on the world around us. That is why we strive to adhere to eco-friendly policies and regularly volunteer our time, energy, and financial resources to serve the communities in which we live. We are focused on sustainability and reducing our overall impact on the environment. LEARN MORE OUR HISTORY 1978 The first Magnum truckload company is founded under the name of Gadberry, Inc. 1981 Magnum, Ltd. was incorporated in 1981 by Wayne Gadberry and two other local farmers. 1990 Wayne Gadberry, Dick Roswick, and Paul Meyer started Magnum LTL, Inc. to serve less than load (LTL) customers. 1998 Magnum Warehousing, Inc. begins and now maintains over 300,000 square feet of warehouse space in Fargo, ND. 2008 While many companies began to cut back, Magnum decided to move forward, starting Magnum Dedicated, Inc. 2023 Today, Magnum has more than 1,600 employees and operates over 32 terminals/offices in 10 states. MAGNUM AWARDS Magnum has received many awards throughout its 45 years of business. We strive to keep our customers satisfied with our service and are honored by the recognition. Carrier of the Year, Vantix Carrier of the Year, Pella Carrier of the Year, Pella THE BIG BLUE BLOG Hazmat: Everything you need to know before getting an endorsement Faces of Magnum: Amy Bakken Faces of Magnum: Jenn Jones READ MORE BLOGS Get In Touch Corporate Office 3000 7th Ave. N.Fargo, ND 58102(701) 293-8082 (800) 726-7510 info@magnumlog.com FollowFollowFollowFollowFollow © 2023 by Magnum All Rights Reserved | Site Created by OpGo Marketing Get In Touch Corporate Office 3000 7th Ave. N.Fargo, ND 58102 (800) 726-7510 info@magnumlog.com FollowFollowFollowFollowFollow © 2023 by Magnum All Rights Reserved | Site Created by OpGo Marketing"
22,"Safety | Magnum Companies [banner id=""226125""] TRACK YOUR SHIPMENT CUSTOMERS EMPLOYEES Careers DRIVER JOBS OPEN DRIVER JOBS OTR JOB INFO TRAINEE JOB INFO NON DRIVER JOBS BENEFITS DOT VERIFICATION DIVISIONS TRUCKLOAD LTL LTL Locations LTL Resources LTL Rate Request Weather Delays Unite By Magnum DEDICATED LOGISTICS EXPEDITED WAREHOUSE ABOUT US RISK MANAGEMENT BLOG BIG BLUE NEWS GALLERY CONTACT Select Page RISK MANAGEMENT At Magnum, Safety is our goal for all our employees. RISK MANAGEMENT SAFETY AWARDS Magnum has received many safety awards throughout the years. We strive to keep our employees safe with industry standards. NDMCA Safety Award for Outstanding Achievement in Highway Safety Smartway High Performer NDMCA Fleet Safety Award ELD EQUIPPED ELD is used to electronically record a driver’s Record of Duty Status (RODS), which replaces the paper logbook some drivers currently use to record their compliance with Hours of Service (HOS) requirement. A few benefits of ELD technology such as saving drivers time, reducing paperwork, keeping dispatchers up-to-date on a driver’s status, and allowing them to better plan for loads. MONTHLY SAFETY CALENDAR OCT 2023 SEPT 2023 AUG 2023 JULY 2023 OUR PRIORITIES At Magnum, safety is our goal. This is what sets us apart from others in the industry. We have monthly safety expectations, supply safety vests for all employees and have a full team dedicated to the safety of our employees. OUR PARTICIPATION National Safety Council Member of the Transportation Safety Division Member of the Young Professionals Division North Dakota Motor Carrier Association North Dakota Safety Council Truckload Carriers Association (TCA) American Trucking Associations (ATA) On ATA’s Safety Management Council THE BIG BLUE BLOG Hazmat: Everything you need to know before getting an endorsement Faces of Magnum: Amy Bakken Faces of Magnum: Jenn Jones READ MORE BLOGS Get In Touch Corporate Office 3000 7th Ave. N.Fargo, ND 58102(701) 293-8082 (800) 726-7510 info@magnumlog.com FollowFollowFollowFollowFollow © 2023 by Magnum All Rights Reserved | Site Created by OpGo Marketing Get In Touch Corporate Office 3000 7th Ave. N.Fargo, ND 58102 (800) 726-7510 info@magnumlog.com FollowFollowFollowFollowFollow © 2023 by Magnum All Rights Reserved | Site Created by OpGo Marketing"
23,"Blog | Magnum Companies [banner id=""226125""] TRACK YOUR SHIPMENT CUSTOMERS EMPLOYEES Careers DRIVER JOBS OPEN DRIVER JOBS OTR JOB INFO TRAINEE JOB INFO NON DRIVER JOBS BENEFITS DOT VERIFICATION DIVISIONS TRUCKLOAD LTL LTL Locations LTL Resources LTL Rate Request Weather Delays Unite By Magnum DEDICATED LOGISTICS EXPEDITED WAREHOUSE ABOUT US RISK MANAGEMENT BLOG BIG BLUE NEWS GALLERY CONTACT Select Page We are currently experiencing WEATHER DELAYSDETAILS MAGNUM BLOG CATEGORIES FACES OF MAGNUM CDL TIPS RECRUITMENT SAFETY DEDICATED LESS-THAN-TRUCKLOAD (LTL) LOGISTICS OVER THE ROAD (OTR) WAREHOUSE PRESS RELEASES Navigating the Road to Mental Wellness BLOG, DEDICATED, OVER THE ROAD (OTR), TipsThe trucking industry is notorious for its long hours, isolation, and the stress of constantly being on the go. Managing your mental health is crucial for your overall well-being and safety on the road. Here are 5 tips to help you maintain good mental health while navigating the highways. read more Faces of Magnum: Tanner Schmit BLOG, FACES OF MAGNUMFrom the office to the golf course, Price Analyst Tanner Schmit brings an enthusiastic, hard-working and competitive approach to everything he does. read more Faces of Magnum: Caleb Lehse BLOG, FACES OF MAGNUM, LESS-THAN-TRUCKLOAD (LTL)Advancing from a part-time helper to the terminal leader, Fargo Terminal Manager Caleb Lehse has worked at Magnum for half of his life. read more Staying Healthy as a Truck Driver: Five Tips BLOGMaintaining a healthy lifestyle as a truck driver can be challenging, but not impossible. Here are some tips to help you stay physically and mentally healthy while you are on the road! read more Faces of Magnum: Michael Groesser BLOG, FACES OF MAGNUM, LESS-THAN-TRUCKLOAD (LTL)Magnum LTL Driver Michael Groesser is the true definition of a family man. When he isn’t working, he is spending time with both his own family and his Magnum family. read more International Road Check: All about ABS and Cargo Securement BLOG, LESS-THAN-TRUCKLOAD (LTL), OVER THE ROAD (OTR), SAFETYInternational Roadcheck is May 16-18, and this year the inspectors will be focusing heavily on Auto Braking Systems (ABS) and Cargo Securement. You might be wondering what the importance of these features are, and we are here to tell you! read more Faces of Magnum: Bethany Arnold BLOG, FACES OF MAGNUM, LESS-THAN-TRUCKLOAD (LTL), WOMEN OF MAGNUMBethany Arnold, a Magnum OTR Truck Driver, switched career fields from healthcare to transportation two years ago and hasn’t looked back. read more Faces of Magnum: Jill Zietz BLOG, FACES OF MAGNUM, WOMEN OF MAGNUMComing up on a month of being at Magnum, new VP of Finance Jill is liking her new job at Magnum and fitting right in! In her free time, she enjoys spending time with her family, sewing, and working on home improvements. read more Happy International Women’s Week! BLOG, WOMEN OF MAGNUMThis year International Women’s Week (IWW) is celebrated March 4-7 leading up to International Women’s Day on March 8. This year International Women’s Week (IWW) is celebrated March 4-7 leading up to International Women’s Day on March 8. IWW has a rich history, dating... read more Press Release: Magnum LTL adds a terminal in Waite Park LESS-THAN-TRUCKLOAD (LTL), PRESS RELEASESMagnum is adding a Less-Than-Truckload 19-door terminal at 801 Julep Rd. in Waite Park, MN. read more Faces of Magnum: Amy Bakken FACES OF MAGNUM, WOMEN OF MAGNUMWith her quick-wit and a smile that lights up the office, Digital Marketing Specialist Amy Bakken contributes to the high morale and work ethic of Magnum’s marketing department. read more 5 Steering Wheel Safety Tips CDL TIPS, SAFETYSteering a vehicle is pretty much common sense right? But we bet you didn’t know these common mistakes could put you in a sticky situation. Let’s talk safety and how to avoid these common steering habits. read more Faces Of Magnum: Nick Dahlen FACES OF MAGNUM, LOGISTICSFor almost 15 years, Director of Logistics Nick Dahlen has been growing leaders and building customer relationships within Magnum’s Logistics division. read more Faces of Magnum: Zack Dahl FACES OF MAGNUMAs a firm believer in challenging yourself, Zach Dahl, Lead Account Manager, likes to challenge himself by snowboarding, golfing, and traveling as much as he can. When he’s not challenging himself on the slopes or the green, Zach believes personal drive and hard work are keys to being successful here at Magnum, and when he’s in office he does just that! read more Faces of Magnum: Rebekah Walvatne FACES OF MAGNUM, WOMEN OF MAGNUMVirginia-born and raised, account manager Rebekah enjoys going to the beach, cozying up by the fire, and taking care of six furry and scaly pets. Rebekah also spends her time doing puzzles- not just any puzzles but 3,000-piece puzzles. read more Trucking Definitions CDL TIPSIt seems as though every industry has their own language. And the trucking industry is no different! From Tandem Axles to Sleeper Berth we’ve got you covered with all you’ll want to know! read more The More You Know: Heat Kings CDL TIPS, DEDICATED, OVER THE ROAD (OTR)It gets awfully cold during the winter months here in the Midwest. So how exactly do we keep shipments from freezing? Magnum utilizes ThermoKing Heat Kings. Heat Kings are diesel-powered heaters for insulated trailers or dry vans for freeze protection for temperature-sensitive cargo. read more Faces of Magnum: Trey Suarez FACES OF MAGNUM, LESS-THAN-TRUCKLOAD (LTL)Magnum P&D Driver Trey Suarez enjoys the day-to-day efforts and close-knit feel of Magnum. When he’s not making deliveries around Fargo, Trey likes spending time with his four-year-old Niece, or riding ATV trails as much as possible. read more Faces of Magnum: Mindy Brummer FACES OF MAGNUM, WOMEN OF MAGNUMCelebrating her 15th year at Magnum as a title claims analyst, Mindy was part of the Brown Transfer/BC Freightways acquisition. When she’s not at work Mindy likes to spend her time unplugged at the lake with her family, reading or baking. read more Faces of Magnum: Luke Litterio FACES OF MAGNUM, RECRUITMENTBlown in from the windy city, Sr. Recruiter Luke Litterio loves the life of adventure. From scuba diving the bottom of the ocean to snowmobiling the frozen wintry tundra of Wisconsin, Luke has done it all. read more What is Truck Driver Appreciation Week? DEDICATED, LESS-THAN-TRUCKLOAD (LTL), OVER THE ROAD (OTR)NTDAW- National Truck Driver Appreciation Week, was founded by the American Trucking Associations (ATA) in 1998. It’s a designated week in September to honor the 3.6 million truck drivers in America. read more « Older Entries Get In Touch Corporate Office 3000 7th Ave. N.Fargo, ND 58102 (800) 726-7510 info@magnumlog.com FollowFollowFollowFollowFollow © 2023 by Magnum All Rights Reserved | Site Created by OpGo Marketing"
24,"Big Blue News | Magnum Companies [banner id=""226125""] TRACK YOUR SHIPMENT CUSTOMERS EMPLOYEES Careers DRIVER JOBS OPEN DRIVER JOBS OTR JOB INFO TRAINEE JOB INFO NON DRIVER JOBS BENEFITS DOT VERIFICATION DIVISIONS TRUCKLOAD LTL LTL Locations LTL Resources LTL Rate Request Weather Delays Unite By Magnum DEDICATED LOGISTICS EXPEDITED WAREHOUSE ABOUT US RISK MANAGEMENT BLOG BIG BLUE NEWS GALLERY CONTACT Select Page We are currently experiencing WEATHER DELAYSDETAILS Big Blue News Stay up to date with all things Magnum by checking out ourmonthly newsletter. NOV 2023 OCT 2023 SEPT 2023 AUG 2023 JULY 2023 MAY/JUNE 2023 APRIL 2023 FEB/MAR 2023 JAN 2023 DEC 2022 NOV 2022 OCT 2022 Get In Touch Corporate Office 3000 7th Ave. N.Fargo, ND 58102(701) 293-8082 (800) 726-7510 info@magnumlog.com FollowFollowFollowFollowFollow © 2023 by Magnum All Rights Reserved | Site Created by OpGo Marketing Get In Touch Corporate Office 3000 7th Ave. N.Fargo, ND 58102 (800) 726-7510 info@magnumlog.com FollowFollowFollowFollowFollow © 2023 by Magnum All Rights Reserved | Site Created by OpGo Marketing"
