,Data
0,"PharmaMed | Pharma-grade automation and engineering Custom Automation Overview Our Process Retrofitting Compliance Service & Support Services Products Company About Our Facility Case Studies Careers Contact Us Talk to an Engineer Custom Automation Services Engineering Services Technical Documentation Risk Assessments Setup, Startup & Training Maintenance Services Upgrades & Machine Services Products Blister Sleever Blister Accumulator Brush Washer-Dryer Vial Tray Loader Wallet Sealer Compact Case Packer Robotic Syringe De-Nester Vektor Designs Company About Our Facility Case Studies Careers Contact Us Talk to an Engineer Solve your complex productionproblems, guaranteed. Pharma-grade automation and engineering to help you tackle old problems with new ideas. Talk to an Engineer Our Process Minimize Labor Constraints OptimizeYour Line Increase Profitability IncreaseOutput Are production problemslimiting your growth? When you want to increase output, boost efficiency, or bring a new product to market, keyproduction problems can stand in your way: Labor constraints Poor line optimization Rising material costs Quality control &compliance issues Solving them requires new ideas. We’re here to help. At PharmaMed, we’ll workalongside to design and build solutions that help you overcome old problems in newways—so you can grow your business. Talk to an Engineer Our proven process. We understand your concerns about investing in custom automation, as well as the need to maintain production. We’ve built a robust, proven process to give you peace of mind that we’ll find the right solution. Step 01: Discovery Step 02: Design & Engineering Step 03: Build & Testing Step 04: Delivery & Setup Step 05: Ongoing Support Discovery No matter what problem you’re facing, the first step in our process is to thoroughly understandyou, your current production environment, and potential areas for improvement. Design & Engineering With your unique challenges and needs in mind, our engineers get to work developing a custom-built system designed to exceed your expectations. Build & Testing We believe in providing worry-free, robust tools, so we put our machines through rigoroustesting to ensure that they will perform in the most challenging of production environments. Delivery & Setup Once the machine has been reviewed and signed off by you, we get to work integrating the new system into your existing production line. Ongoing Support We understand that factory uptime is a key priority. Once we’ve completed integration of your new system, we provide training, ongoing support, parts, and scheduled and emergency maintenance to give you peace of mind that your new machine will perform—and increase your productivity. More about our process Custom Automation Maximize production efficiency to grow your business by tackling old problems with new ideas. Our expert team of engineers solves complex production problems with pharma-grade custom automation built for your needs. Learn More Engineering, Maintenance& Support Services Meet design, documentation, and implementation challenges with our technical expertise and superior service. Learn More PharmaMed Standard Products Improve efficiency, boost productivity, and increase margin in your production environment with products from our standard line. Learn More Meet PharmaMed. We’re a team of passionate engineers and project managers with extensive experience in industrial automation and production environments. We love tackling the unsolvable problems—the ones that others are afraid to touch. Whether we’re designing a new custom solution or delivering one of our standard products, we’re committed to your success above all else. Learn More Let’s Talk. Discover what’s possible with automation. Talk to an Engineer Custom Automation Our Process Retrofitting Compliance Service & Support Services Engineering Services Technical Documents Risk Assessments Setup, Startup, Training Preventative & ContinuousMaintenance Upgrades Products Blister Sleever Accumulator Brush Washer Vial Tray Loader Wallet Sealer Compact Case Packer Company About Careers Automation Insider Contact © Copyright 2022 PharmaMed, inc. | Site designed and developed by Blister Sleever Blister Accumulator Brush Washer/Dryer Vial Tray Loader Wallet Sealer Compact Case Packer Robotic Syringe De-Nester Vektor Designs Engineering Services Technical Documents Risk Assessments Setup, Startup, Training Maintenance Services Machine Upgrades"
1,"PharmaMed | Pharma-grade automation and engineering Custom Automation Overview Our Process Retrofitting Compliance Service & Support Services Products Company About Our Facility Case Studies Careers Contact Us Talk to an Engineer Custom Automation Services Engineering Services Technical Documentation Risk Assessments Setup, Startup & Training Maintenance Services Upgrades & Machine Services Products Blister Sleever Blister Accumulator Brush Washer-Dryer Vial Tray Loader Wallet Sealer Compact Case Packer Robotic Syringe De-Nester Vektor Designs Company About Our Facility Case Studies Careers Contact Us Talk to an Engineer Solve your complex productionproblems, guaranteed. Pharma-grade automation and engineering to help you tackle old problems with new ideas. Talk to an Engineer Our Process Minimize Labor Constraints OptimizeYour Line Increase Profitability IncreaseOutput Are production problemslimiting your growth? When you want to increase output, boost efficiency, or bring a new product to market, keyproduction problems can stand in your way: Labor constraints Poor line optimization Rising material costs Quality control &compliance issues Solving them requires new ideas. We’re here to help. At PharmaMed, we’ll workalongside to design and build solutions that help you overcome old problems in newways—so you can grow your business. Talk to an Engineer Our proven process. We understand your concerns about investing in custom automation, as well as the need to maintain production. We’ve built a robust, proven process to give you peace of mind that we’ll find the right solution. Step 01: Discovery Step 02: Design & Engineering Step 03: Build & Testing Step 04: Delivery & Setup Step 05: Ongoing Support Discovery No matter what problem you’re facing, the first step in our process is to thoroughly understandyou, your current production environment, and potential areas for improvement. Design & Engineering With your unique challenges and needs in mind, our engineers get to work developing a custom-built system designed to exceed your expectations. Build & Testing We believe in providing worry-free, robust tools, so we put our machines through rigoroustesting to ensure that they will perform in the most challenging of production environments. Delivery & Setup Once the machine has been reviewed and signed off by you, we get to work integrating the new system into your existing production line. Ongoing Support We understand that factory uptime is a key priority. Once we’ve completed integration of your new system, we provide training, ongoing support, parts, and scheduled and emergency maintenance to give you peace of mind that your new machine will perform—and increase your productivity. More about our process Custom Automation Maximize production efficiency to grow your business by tackling old problems with new ideas. Our expert team of engineers solves complex production problems with pharma-grade custom automation built for your needs. Learn More Engineering, Maintenance& Support Services Meet design, documentation, and implementation challenges with our technical expertise and superior service. Learn More PharmaMed Standard Products Improve efficiency, boost productivity, and increase margin in your production environment with products from our standard line. Learn More Meet PharmaMed. We’re a team of passionate engineers and project managers with extensive experience in industrial automation and production environments. We love tackling the unsolvable problems—the ones that others are afraid to touch. Whether we’re designing a new custom solution or delivering one of our standard products, we’re committed to your success above all else. Learn More Let’s Talk. Discover what’s possible with automation. Talk to an Engineer Custom Automation Our Process Retrofitting Compliance Service & Support Services Engineering Services Technical Documents Risk Assessments Setup, Startup, Training Preventative & ContinuousMaintenance Upgrades Products Blister Sleever Accumulator Brush Washer Vial Tray Loader Wallet Sealer Compact Case Packer Company About Careers Automation Insider Contact © Copyright 2022 PharmaMed, inc. | Site designed and developed by Blister Sleever Blister Accumulator Brush Washer/Dryer Vial Tray Loader Wallet Sealer Compact Case Packer Robotic Syringe De-Nester Vektor Designs Engineering Services Technical Documents Risk Assessments Setup, Startup, Training Maintenance Services Machine Upgrades"
2,"Custom Automation | PharmaMed Custom Automation Overview Our Process Retrofitting Compliance Service & Support Services Products Company About Our Facility Case Studies Careers Contact Us Talk to an Engineer Custom Automation Services Engineering Services Technical Documentation Risk Assessments Setup, Startup & Training Maintenance Services Upgrades & Machine Services Products Blister Sleever Blister Accumulator Brush Washer-Dryer Vial Tray Loader Wallet Sealer Compact Case Packer Robotic Syringe De-Nester Vektor Designs Company About Our Facility Case Studies Careers Contact Us Talk to an Engineer CustomAutomation. Pharma-grade automation built for you WATCH VIDEO JUMP TO: Our Process Retrofitting Compliance Service & Support Maximize production efficiency to grow your business. Our expert team of engineers and project managers understand the complex production problems that pharmaceutical and medical manufacturers like you face. We conquer the problems others can’t with pharma-grade custom automation developed through our proven design process and backed by outstanding service and support. 0+ machines builtsince 2012 0 years combined experience Proven results forour customers Thorough industryknowledge Let’s Talk. Discover what’s possible with automation. Talk to an Engineer Our proven process. We understand your concerns about investing in custom automation, as well as the need to maintain production. We’ve built a robust, proven process to give you peace of mind that we’ll find the right solution. Step 01: Discovery \ Step 01: Discovery Project Setup No matter what problem you’re facing, the first step in our process is to thoroughly understand you, your current production environment, and potential areas for improvement. To ensure a smooth process, our project team meets with you to confirm all details. Step 02: Design & Engineering \ Step 02: Design & Engineering Scheduling We create a project schedule for your review, including procurement, build, and test phases. \ Engineering With your unique challenges and needs in mind, our engineers get to work developing a custom-built system designed to exceed your expectations. Our lead mechanical engineer begins the build phase, later collaborating with electrical engineers. This includes part selection, purchasing, testing, and extensive internal review. Step 02: Design & Engineering \ Step 02: Design & Engineering Presentation After extensive internal collaboration, our team presents the final design to your team as a 3D model with screenshot renderings that depict where the machine will fit and how it will function in the line. Step 02: Design & Engineering \ Step 02: Design & Engineering Revision We revise the design based on areas of concern from the presentation and then schedule a second review with your team. This may include more than one round of revision and review. Step 02: Design & Engineering \ Step 02: Design & Engineering Procurement Following design approval, we purchase all parts, prepare documentation, and create assembly prints. Step 03: Build & Testing \ Step 03: Build & Testing Assembly & Debug We believe in providing worry-free, robust equipment, so we put our machines through rigorous testing to ensure that they will perform in the most challenging of production environments. We build your machine and put it through an extensive phase of debugging to ensure outstanding performance. Step 04: Delivery & Setup \ Step 04: Delivery & Setup Testing & Delivery Once the machine has been reviewed and signed off by you, we get to work integrating the new system into your existing production line. This final phase includes factory acceptance testing (FAT), documentation, delivery, and our Setup, Startup and Training (SST) process at your facility. Step 05: Ongoing Support \ Step 05: Ongoing Support Support & Training We understand that factory uptime is a key priority. Following delivery, we provide training, ongoing support, parts, and scheduled and emergency maintenance to give you peace of mind that your new machine will perform—and increase your productivity. Retrofitting. Boost efficiency or add new capabilities by upgrading an existing machine with new technology. Our engineering services team can retool, rebuild, or retrofit your machine—whether we built it or not. Compliance. Ensure compliance with stringent and evolving regulatory oversight. We provide all required documentation including Functional Design Specification (FDS), Hardware Design Specification (HDS), Software Design Specification (SDS), Risk Assessment (RA), SISTEMA Report (SR), Factory Acceptance Test Protocol (FAT), and Site Acceptance Test Protocol (SAT). Service& Support. Keep operations running smoothly with our comprehensive support. We serve a national and international service area with: Preventative maintenance scheduled to maximize machine uptime Continuous maintenance with on-site service to optimize performance Emergency service during and after hours and on weekends, including Ewon technical support and on-site support Call 218-486-5850 or email support@pharmamedinc.com to reach our service department. Let’s Talk. Discover what’s possible with automation. Talk to an Engineer Custom Automation Our Process Retrofitting Compliance Service & Support Services Engineering Services Technical Documents Risk Assessments Setup, Startup, Training Preventative & ContinuousMaintenance Upgrades Products Blister Sleever Accumulator Brush Washer Vial Tray Loader Wallet Sealer Compact Case Packer Company About Careers Automation Insider Contact © Copyright 2022 PharmaMed, inc. | Site designed and developed by Blister Sleever Blister Accumulator Brush Washer/Dryer Vial Tray Loader Wallet Sealer Compact Case Packer Robotic Syringe De-Nester Vektor Designs Engineering Services Technical Documents Risk Assessments Setup, Startup, Training Maintenance Services Machine Upgrades"
3,"Custom Automation | PharmaMed Custom Automation Overview Our Process Retrofitting Compliance Service & Support Services Products Company About Our Facility Case Studies Careers Contact Us Talk to an Engineer Custom Automation Services Engineering Services Technical Documentation Risk Assessments Setup, Startup & Training Maintenance Services Upgrades & Machine Services Products Blister Sleever Blister Accumulator Brush Washer-Dryer Vial Tray Loader Wallet Sealer Compact Case Packer Robotic Syringe De-Nester Vektor Designs Company About Our Facility Case Studies Careers Contact Us Talk to an Engineer CustomAutomation. Pharma-grade automation built for you WATCH VIDEO JUMP TO: Our Process Retrofitting Compliance Service & Support Maximize production efficiency to grow your business. Our expert team of engineers and project managers understand the complex production problems that pharmaceutical and medical manufacturers like you face. We conquer the problems others can’t with pharma-grade custom automation developed through our proven design process and backed by outstanding service and support. 0+ machines builtsince 2012 0 years combined experience Proven results forour customers Thorough industryknowledge Let’s Talk. Discover what’s possible with automation. Talk to an Engineer Our proven process. We understand your concerns about investing in custom automation, as well as the need to maintain production. We’ve built a robust, proven process to give you peace of mind that we’ll find the right solution. Step 01: Discovery \ Step 01: Discovery Project Setup No matter what problem you’re facing, the first step in our process is to thoroughly understand you, your current production environment, and potential areas for improvement. To ensure a smooth process, our project team meets with you to confirm all details. Step 02: Design & Engineering \ Step 02: Design & Engineering Scheduling We create a project schedule for your review, including procurement, build, and test phases. \ Engineering With your unique challenges and needs in mind, our engineers get to work developing a custom-built system designed to exceed your expectations. Our lead mechanical engineer begins the build phase, later collaborating with electrical engineers. This includes part selection, purchasing, testing, and extensive internal review. Step 02: Design & Engineering \ Step 02: Design & Engineering Presentation After extensive internal collaboration, our team presents the final design to your team as a 3D model with screenshot renderings that depict where the machine will fit and how it will function in the line. Step 02: Design & Engineering \ Step 02: Design & Engineering Revision We revise the design based on areas of concern from the presentation and then schedule a second review with your team. This may include more than one round of revision and review. Step 02: Design & Engineering \ Step 02: Design & Engineering Procurement Following design approval, we purchase all parts, prepare documentation, and create assembly prints. Step 03: Build & Testing \ Step 03: Build & Testing Assembly & Debug We believe in providing worry-free, robust equipment, so we put our machines through rigorous testing to ensure that they will perform in the most challenging of production environments. We build your machine and put it through an extensive phase of debugging to ensure outstanding performance. Step 04: Delivery & Setup \ Step 04: Delivery & Setup Testing & Delivery Once the machine has been reviewed and signed off by you, we get to work integrating the new system into your existing production line. This final phase includes factory acceptance testing (FAT), documentation, delivery, and our Setup, Startup and Training (SST) process at your facility. Step 05: Ongoing Support \ Step 05: Ongoing Support Support & Training We understand that factory uptime is a key priority. Following delivery, we provide training, ongoing support, parts, and scheduled and emergency maintenance to give you peace of mind that your new machine will perform—and increase your productivity. Retrofitting. Boost efficiency or add new capabilities by upgrading an existing machine with new technology. Our engineering services team can retool, rebuild, or retrofit your machine—whether we built it or not. Compliance. Ensure compliance with stringent and evolving regulatory oversight. We provide all required documentation including Functional Design Specification (FDS), Hardware Design Specification (HDS), Software Design Specification (SDS), Risk Assessment (RA), SISTEMA Report (SR), Factory Acceptance Test Protocol (FAT), and Site Acceptance Test Protocol (SAT). Service& Support. Keep operations running smoothly with our comprehensive support. We serve a national and international service area with: Preventative maintenance scheduled to maximize machine uptime Continuous maintenance with on-site service to optimize performance Emergency service during and after hours and on weekends, including Ewon technical support and on-site support Call 218-486-5850 or email support@pharmamedinc.com to reach our service department. Let’s Talk. Discover what’s possible with automation. Talk to an Engineer Custom Automation Our Process Retrofitting Compliance Service & Support Services Engineering Services Technical Documents Risk Assessments Setup, Startup, Training Preventative & ContinuousMaintenance Upgrades Products Blister Sleever Accumulator Brush Washer Vial Tray Loader Wallet Sealer Compact Case Packer Company About Careers Automation Insider Contact © Copyright 2022 PharmaMed, inc. | Site designed and developed by Blister Sleever Blister Accumulator Brush Washer/Dryer Vial Tray Loader Wallet Sealer Compact Case Packer Robotic Syringe De-Nester Vektor Designs Engineering Services Technical Documents Risk Assessments Setup, Startup, Training Maintenance Services Machine Upgrades"
