,Data
0,branick home page automotive tools and tire equipment news manuals archive products outlet store online tools nitrogen resources find a nitrogen provider about us contact search 0 items $000 menu 0 items $000 american made since 1917 automotive tools & tire equipment for over 100 years we have manufactured automotive tools & equipment that increases the efficiency and safety of shops around the world 100 years of quality…built for generations search our products view our products find a nitrogen tire machine locate store use our online tools learn more new btt-5700 electronic tire tester the btt-5700 is the newest and best tire tester on the market ergonomically designed with adjustable height and operator panel to decrease operator strain low noise electronic tire rotation is reversible and has variable speed when a flaw is detected rotation auto-stops and there is a visible and audible spark in retreader tests it detected 995% of flaws a must have if you inspect tires learn more featured products quality service innovation and value these are the core concepts behind all our products and the goal of our entire branick team 2230 tire cage $50025 add to wishlist add to cart 2240 tire cage $57270 add to wishlist add to cart digital airhead bk4 21″ hose $18975 add to wishlist add to cart memberships get in touch with us contact us reach out to us with any questions that you might have about our products and nitrogen inflation contact us partner company about us branick industries began in 1917 since then we’ve grown to be a leader in the automotive equipment industry we strive to be the most reliable choice for distributors and dealers across the globe terms and conditions contact us 4245 main ave fargo nd 58103 phone: 800 437-4394 fax: 701 281-5900 email: copyright branick industries inc search menu categories brake bleeders curing rings electronic tire tester inflation cages nitrogen inflation systems strut spring compressor tire inflation tools tire service tire spreaders products outlet store online tools nitrogen resources find a nitrogen provider about us contact wishlist login / register shopping cart close search start typing to see products you are looking for
1,branick news section news uncategorized inside edition visits branick facilities to show the potential dangers of passenger tire inflation october 24 2023 posted by carterbladholm 24 oct
2,discontinued product manual section manuals archive discontinued products 7400 strut spring compressor 7200 strut spring compressor tc tire cart 3000 tire balancer 6a-ar-s ah-ri/r tire spreader b-inv tire spreader pts tire spreader ps-1 tire spreader 5660 tire spreader s-fll-er-ef tire spreader s-fll tire spreader 5030 tire spreader 5040 tire spreader rolling jacks 5500 tire spreader 5120 tire spreader 5035 tire spreader 135 portable airstation current products 7600 strut spring compressor 761 bench mount 764 spring compressor cart tc400 tire cart g300 / g300a brake bleeder 2400 tire tool station btt-5700 electronic tire tester 5025 tire spreader 5045 tire spreader 5130 tire spreader 5200 tire spreader 5300 tire spreader 130 nitrogen cart 350 nitrogen generator 450 / 650 nitrogen generator 465 nitrogen generator 475 / 485 / 675 / 685 nitrogen generator 500 / 1000 / 1500 nitrogen generator 5550 tire spreader 5700 tire spreader ef tire spreader ef/hd tire spreader 145 blockhead airstation 155 blockhead airstation hd-btc tire cutter get in touch with us contact us reach out to us with any questions that you might have about our products and nitrogen inflation contact us search menu categories brake bleeders curing rings electronic tire tester inflation cages nitrogen inflation systems strut spring compressor tire inflation tools tire service tire spreaders products outlet store online tools nitrogen resources find a nitrogen provider about us contact wishlist login / register shopping cart close search start typing to see products you are looking for
3,cart - branick shopping cart checkout order complete if you would like to have our products shipped to hawaii or alaska please contact us for pricing your cart is currently empty before proceed to checkout you must add some products to your shopping cart return to shop search menu categories brake bleeders curing rings electronic tire tester inflation cages nitrogen inflation systems strut spring compressor tire inflation tools tire service tire spreaders products outlet store online tools nitrogen resources find a nitrogen provider about us contact wishlist login / register shopping cart close search start typing to see products you are looking for
4,btt-5700 electronic tire tester - branick home electronic tire tester btt-5700 electronic tire tester btt-5700 electronic tire tester the branick btt-5700 was created to be the most efficient durable and reliable electronic tire tester available by locating flaws that might be missed using conventional methods a visible spark occurs at the site of a flaw and the rotation stops to allow the flaw to be marked the adjustable height platform reduces physical strain that can often lead to workers compensation claims the btt-5700 also features a quiet bi-directional variable speed electric rotation motor the auto-extend/retract ramp makes tire loading easy hand controls are located on a locking swing arm that can be adjusted in seconds four air tool ports and two electric outlets are also provided so any needed tools can be kept close for improved efficiency a high-power led light and medium truck probe are also included all probe heads are changeable by button and are available to fit all common tire sizes view spec sheet view manual view testimonial add to wishlist categories: all products electronic tire tester share: related products 650 wall mount nitrogen inflation system $1108485 add to wishlist add to cart ef-hd tire spreader $1616785 add to wishlist add to cart 7600 strut spring compressor $141910 add to wishlist add to cart 5130 tire spreader $288650 add to wishlist add to cart search menu categories brake bleeders curing rings electronic tire tester inflation cages nitrogen inflation systems strut spring compressor tire inflation tools tire service tire spreaders products outlet store online tools nitrogen resources find a nitrogen provider about us contact wishlist login / register shopping cart close search start typing to see products you are looking for
5,btt-5700 electronic tire tester - branick home electronic tire tester btt-5700 electronic tire tester btt-5700 electronic tire tester the branick btt-5700 was created to be the most efficient durable and reliable electronic tire tester available by locating flaws that might be missed using conventional methods a visible spark occurs at the site of a flaw and the rotation stops to allow the flaw to be marked the adjustable height platform reduces physical strain that can often lead to workers compensation claims the btt-5700 also features a quiet bi-directional variable speed electric rotation motor the auto-extend/retract ramp makes tire loading easy hand controls are located on a locking swing arm that can be adjusted in seconds four air tool ports and two electric outlets are also provided so any needed tools can be kept close for improved efficiency a high-power led light and medium truck probe are also included all probe heads are changeable by button and are available to fit all common tire sizes view spec sheet view manual view testimonial add to wishlist categories: all products electronic tire tester share: related products 650 wall mount nitrogen inflation system $1108485 add to wishlist add to cart ef-hd tire spreader $1616785 add to wishlist add to cart 7600 strut spring compressor $141910 add to wishlist add to cart 5130 tire spreader $288650 add to wishlist add to cart search menu categories brake bleeders curing rings electronic tire tester inflation cages nitrogen inflation systems strut spring compressor tire inflation tools tire service tire spreaders products outlet store online tools nitrogen resources find a nitrogen provider about us contact wishlist login / register shopping cart close search start typing to see products you are looking for
6,model 2230 passenger/fleet 3 bar tire cage - branick home inflation cages 2230 tire cage 2230 tire cage $50025 2230 tire cage quantity add to cart click for shipping terms our 2230 tire safety cage stands 60″ tall and comes with three bars it can handle tires with a maximum width of 215″ cross section and a maximum diameter of 54″ if you work on commercial truck tires and super singles you’ll need the added height of the 2200 series view spec sheet add to wishlist categories: all products inflation cages tag: featured share: additional information tire cage safety additional information weight 140 lbs dimensions 28 × 20 × 60 in tire cage safety inflation cages save lives and prevent injuries that’s why osha requires the use of a restraining device when inflating tires at branick we construct all our cages with the highest quality two and a quarter inch diameter high yield steel tubing to ensure strenh and durability and every cage we make meets osha requirements combine the no-mar cage with our blockhead auto inflator both of which can handle run-flat and high pressure tires to create a more efficient and safer environment for your workers all branick inflation cages meet or exceed the requirements of the osha standard no 29 cfr part 1910177 29 cfr 191-177 related products 1000 tower nitrogen inflation system $1773760 add to wishlist add to cart 761 bench mount $8395 add to wishlist add to cart 2220 tire cage $44620 add to wishlist add to cart 210 cage rollers $16675 add to wishlist add to cart search menu categories brake bleeders curing rings electronic tire tester inflation cages nitrogen inflation systems strut spring compressor tire inflation tools tire service tire spreaders products outlet store online tools nitrogen resources find a nitrogen provider about us contact wishlist login / register shopping cart close search start typing to see products you are looking for
7,model 2240 passenger/fleet 4 bar tire cage - branick home inflation cages 2240 tire cage 2240 tire cage $57270 2240 tire cage quantity add to cart click for shipping terms our 2240 tire safety cage is 60″ tall and comes with four bars it can handle tires with a maximum width of 215″ cross section and a maximum diameter of 54″ if you work on commercial truck tires and super singles you’ll need the added height of the 2200 series combine the no-mar cage with our blockhead auto inflator both of which can handle run-flat and high-pressure tires to create a more efficient and safer environment for your workers view spec sheet add to wishlist categories: all products inflation cages tag: featured share: additional information tire cage safety additional information weight 170 lbs dimensions 28 × 28 × 60 in tire cage safety inflation cages save lives and prevent injuries that’s why osha requires the use of a restraining device when inflating tires at branick we construct all our cages with the highest quality two and a quarter inch diameter high yield steel tubing to ensure strenh and durability and every cage we make meets osha requirements combine the no-mar cage with our blockhead auto inflator both of which can handle run-flat and high pressure tires to create a more efficient and safer environment for your workers all branick inflation cages meet or exceed the requirements of the osha standard no 29 cfr part 1910177 29 cfr 191-177 related products 2040 tire cage $62675 add to wishlist add to cart 2220 tire cage $44620 add to wishlist add to cart 1000 tower nitrogen inflation system $1773760 add to wishlist add to cart 2010 tire cage $55775 add to wishlist add to cart search menu categories brake bleeders curing rings electronic tire tester inflation cages nitrogen inflation systems strut spring compressor tire inflation tools tire service tire spreaders products outlet store online tools nitrogen resources find a nitrogen provider about us contact wishlist login / register shopping cart close search start typing to see products you are looking for
8,digital airhead inflation gauge with 21 inch hose - branick home tire inflation tools digital airhead bk4 21″ hose digital airhead bk4 21″ hose $18975 digital airhead bk4 21 hose quantity add to cart click for shipping terms our digital airhead bk4 is the ultimate in hand-held inflators inflate and deflate without ever leaving the valve stem the compact size makes it easy to handle and store it has a large backlit display that is easily visible in both bright and dim light the aluminum body has a rubber protector making it suitable for rough shop environments the bk4 digital airhead is certified and calibrated to +/- 2 psi comes with a 21″ hose and twin-angled chuck view spec sheet add to wishlist categories: all products tire inflation tools tag: featured share: additional information additional information weight 5 lbs dimensions 13 × 3 × 4 in related products 350 wall mount nitrogen inflation system $684710 add to wishlist add to cart 485 mobile nitrogen inflation system $1232800 add to wishlist add to cart 1500 tower nitrogen inflation system $2534485 add to wishlist add to cart 465 mobile nitrogen inflation system $823400 add to wishlist add to cart search menu categories brake bleeders curing rings electronic tire tester inflation cages nitrogen inflation systems strut spring compressor tire inflation tools tire service tire spreaders products outlet store online tools nitrogen resources find a nitrogen provider about us contact wishlist login / register shopping cart close search start typing to see products you are looking for
9,contact - branick send us an email name email phone number company zip code countryafghanistanangolaalbaniaandorraunited arab emiratesargentinaarmeniaantigua and barbudaaustraliaaustriaazerbaijanburundibelgiumbeninburkina fasobangladeshbulgariabahrainbahamasbosnia and herzegovinabelarusbelizebolivia plurinational state ofbrazilbarbadosbrunei darussalambhutanbotswanacentral african republiccanadaswitzerlandchilechinacôte divoirecamerooncongo the democratic republic of thecongocolombiacomoroscape verdecosta ricacubacyprusczech republicgermanydjiboutidominicadenmarkdominican republicalgeriaecuadoregypteritreaspainestoniaethiopiafinlandfijifrancemicronesia federated states ofgabonunited kingdomgeorgiaghanaguineagambiaguinea-bissauequatorial guineagreecegrenadaguatemalaguyanahondurascroatiahaitihungaryindonesiaindiairelandiran islamic republic ofiraqicelandisraelitalyjamaicajordanjapankazakhstankenyakyrgyzstancambodiakiribatisaint kitts and neviskorea republic ofkuwaitlao peoples democratic republiclebanonliberialibyasaint lucialiechtensteinsri lankalesotholithuanialuxembourglatviamoroccomonacomoldova republic ofmadagascarmaldivesmexicomarshall islandsmacedonia the former yugoslav republic ofmalimaltamyanmarmontenegromongoliamozambiquemauritaniamauritiusmalawimalaysianamibianigernigerianicaraguanetherlandsnorwaynepalnaurunew zealandomanpakistanpanamaperuphilippinespalaupapua new guineapolandkorea democratic peoples republic ofportugalparaguayqatarromaniarussian federationrwandasaudi arabiasudansenegalsingaporesolomon islandssierra leoneel salvadorsan marinosomaliaserbiasouth sudansao tome and principesurinameslovakiasloveniaswedenswazilandseychellessyrian arab republicchadtogothailandtajikistanturkmenistantimor-lestetongatrinidad and tobagotunisiaturkeytuvalutanzania united republic ofugandaukraineuruguayunited statesuzbekistansaint vincent and the grenadinesvenezuela bolivarian republic ofviet namvanuatusamoayemensouth africazambiazimbabwe please leave this field empty question or comment δ contact us 4245 main ave fargo nd 58103 toll free 800 437-4394 stay connected facebook twitter linkedin youtube let us know if you have any questions or comments we will return your message as soon as we can search menu categories brake bleeders curing rings electronic tire tester inflation cages nitrogen inflation systems strut spring compressor tire inflation tools tire service tire spreaders products outlet store online tools nitrogen resources find a nitrogen provider about us contact wishlist login / register shopping cart close search start typing to see products you are looking for
10,branick terms and conditions branick industries inc terms and conditions 06/17/2019 use agreement please read these terms and conditions carefully by using this website wwwbranickcom or by purchasing products from this website you agree in full to the terms and conditions as described on this page branick industries reserves the right to modify both this website wwwbranickcom and these terms and conditions at any time and without prior notice branick industries will not be held liable for the information presented in this website or the misuse of the same all pages of this website and everything contained within are copyright branick industries unless otherwise stated within the site use of any of the information on this site requires prior written consent from branick industries shipping method we use several shipping companies to reduce shipping costs branick industries will determine the shipper that will be used and will select the best option for your specific address free shipping includes standard delivery to a commercial or business address in the lower 48 states only if you do not have a dock and require unloading by the transportation company a lift gate to remove the product from the transport vehicle or the address provided is a residential address additional charges may be incurred if additional charges are required we will call you to determine payment method for those charges if these are not paid the order will be canceled and the products returned to branick industries please contact us prior to ordering if the delivery is residential or requires additional services such as those described above phone: 800-437-4394 or email: check order status we will make every effort to get your product out to you as quickly as possible an estimated shipment date will be emailed to you when we receive the order a tracking number for the shipment will be emailed to you at the time the order is shipped this tracking number can be used to check the status of the shipment if at any time you would like an update on the status of your order please feel free to contact us please include your order number when inquiring phone: 800-437-4394 or email: taxation on purchases branick industries will charge taxes on sales as required by the laws of the country state county and city the application of taxes will be modified and determined by the current laws of each country state county and city your responsibility you will provide accurate information at the time of purchase to ensure prompt delivery and valid communication methods if the information you provide leads to a delivery delay or reroute you will be responsible for any additional shipping costs by making a purchase at our site you acknowledge that you have full legal capacity and permission to make the purchase and use the chosen payment method upon receiving your order inspect the entire order carefully if the order is incomplete or damaged contact branick industries by phone: 800-437-4394 or email: immediately our responsibility we will fulfill your order as accurately quickly and cost effectively as possible but under no circumstances will we assume responsibility for any damages growing out of or owing to any delays whatever no order will be processed nor even begin to be processed until payment for that order has been processed and cleared if an error on our part causes additional shipping costs we will pay those additional costs we make every attempt to ensure that all information and images on our website is accurate and correct however should an error occur in the information and images on this website we will not be held liable for those errors we will ensure that credit card information provided during a purchase is encrypted though ssl protocol secure sockets layer the credit card information is visible only by the processing company and no one else including us are able to view this information product warranty the warranty for each product will be outlined in the owner’s manual and can vary depending on the product please see the manual for the product of interest for details on the warranty for that product the manuals are available in the manual archive section of this website if you need to make a warranty claim you must contact us to obtain an rma prior to any service repairs or returns contact us phone: 800-437-4394 or email: return policy returns will be accepted for a period of 10 days from receipt of your purchase products proving defective on account of labor or material will be either replaced or credit allowed at our option and no claim for damage or expense involved in using our products will be allowed all returns must be approved by branick and have a returned merchandise authorization rma number provided by branick before the return will be accepted return shipment will be at your expense and a 15% restock fee will be applied damage incurred on return shipment will be at your expense and may incur additional charges if branick determines the product has experienced unusual wear and tear so please ensure the item is repackaged carefully before returning if you have questions regarding a return or our return policy please contact us phone: 800-437-4394 or email: privacy policy branick holds your information in the strictest confidence and will not distribute your information for any reason unless authorized in advance by you or required to do so by law branick does reserve the right to contact you occasionally for special offers or new products that may be of interest to you your information will be stored behind a secure network and both the server and website are regularly scanned for security holes or vulnerabilities your credit card information is processed through a secure gateway provider and we do not store nor even see any specific credit card information search menu categories brake bleeders curing rings electronic tire tester inflation cages nitrogen inflation systems strut spring compressor tire inflation tools tire service tire spreaders products outlet store online tools nitrogen resources find a nitrogen provider about us contact wishlist login / register shopping cart close search start typing to see products you are looking for
11,brake bleeders archives - branick brake bleeders close categoriesall products brake bleeders curing rings electronic tire tester inflation cages nitrogen inflation systems mobile systems nitrogen accessories tower systems wall mount systems outlet store strut spring compressor tire inflation tools tire service tire spreaders uncategorized filter by price min price max price filter price: — home brake bleeders showing the single result show sidebar default sorting sort by popularity sort by latest sort by price: low to high sort by price: high to low g300 pressure brake bleeder $63020 add to wishlist add to cart search menu categories brake bleeders curing rings electronic tire tester inflation cages nitrogen inflation systems strut spring compressor tire inflation tools tire service tire spreaders products outlet store online tools nitrogen resources find a nitrogen provider about us contact wishlist login / register shopping cart close search start typing to see products you are looking for
12,curing rings archives - branick curing rings close categoriesall products brake bleeders curing rings electronic tire tester inflation cages nitrogen inflation systems mobile systems nitrogen accessories tower systems wall mount systems outlet store strut spring compressor tire inflation tools tire service tire spreaders uncategorized home curing rings showing the single result show sidebar default sorting sort by popularity sort by latest sort by price: low to high sort by price: high to low curing rings add to wishlist read more search menu categories brake bleeders curing rings electronic tire tester inflation cages nitrogen inflation systems strut spring compressor tire inflation tools tire service tire spreaders products outlet store online tools nitrogen resources find a nitrogen provider about us contact wishlist login / register shopping cart close search start typing to see products you are looking for
13,electronic tire tester archives - branick electronic tire tester close categoriesall products brake bleeders curing rings electronic tire tester inflation cages nitrogen inflation systems mobile systems nitrogen accessories tower systems wall mount systems outlet store strut spring compressor tire inflation tools tire service tire spreaders uncategorized home electronic tire tester showing the single result show sidebar default sorting sort by popularity sort by latest sort by price: low to high sort by price: high to low btt-5700 electronic tire tester add to wishlist read more search menu categories brake bleeders curing rings electronic tire tester inflation cages nitrogen inflation systems strut spring compressor tire inflation tools tire service tire spreaders products outlet store online tools nitrogen resources find a nitrogen provider about us contact wishlist login / register shopping cart close search start typing to see products you are looking for
