,Data
21,"Outlet Store Archives - Branick Automotive Tools and Tire Equipment NEWS Manuals Archive Products Outlet Store Online Tools Nitrogen Resources Find a Nitrogen Provider About Us Contact Search 0 items $0.00 Menu 0 items $0.00 Outlet Store Close CategoriesAll Products Brake Bleeders Curing Rings Electronic Tire Tester Inflation Cages Nitrogen Inflation Systems Mobile Systems Nitrogen Accessories Tower Systems Wall Mount Systems Outlet Store Strut Spring Compressor Tire Inflation Tools Tire Service Tire Spreaders Uncategorized Home Outlet Store No products were found matching your selection. Search About Us Branick Industries began in 1917. Since then, we’ve grown to be a leader in the automotive equipment industry. We strive to be the most reliable choice for distributors and dealers across the globe. Terms and Conditions Contact Us 4245 Main Ave. Fargo, ND 58103 Phone: (800) 437-4394 Fax: (701) 281-5900 Email: sales@branick.com Copyright Branick Industries, Inc. Search Menu Categories Brake Bleeders Curing Rings Electronic Tire Tester Inflation Cages Nitrogen Inflation Systems Strut Spring Compressor Tire Inflation Tools Tire Service Tire Spreaders Products Outlet Store Online Tools Nitrogen Resources Find a Nitrogen Provider About Us Contact Wishlist Login / Register Shopping cart Close Search Start typing to see products you are looking for."
22,"Branick online tools section Automotive Tools and Tire Equipment NEWS Manuals Archive Products Outlet Store Online Tools Nitrogen Resources Find a Nitrogen Provider About Us Contact Search 0 items $0.00 Menu 0 items $0.00 Online Tools We make getting started easy. Use our online tools to register your 7600 strut compressor, register your Branick Nitrogen tire inflation machine, or calculate your nitrogen savings. 7600 Strut Compressor Registration Register Now Nitrogen Generator Registration Register Now Nitrogen Savings Calculator Learn More Catalog Download Download GET IN TOUCH WITH US Contact Us Reach out to us with any questions that you might have about our products and nitrogen inflation. CONTACT US About Us Branick Industries began in 1917. Since then, we’ve grown to be a leader in the automotive equipment industry. We strive to be the most reliable choice for distributors and dealers across the globe. Terms and Conditions Contact Us 4245 Main Ave. Fargo, ND 58103 Phone: (800) 437-4394 Fax: (701) 281-5900 Email: sales@branick.com Copyright Branick Industries, Inc. Search Menu Categories Brake Bleeders Curing Rings Electronic Tire Tester Inflation Cages Nitrogen Inflation Systems Strut Spring Compressor Tire Inflation Tools Tire Service Tire Spreaders Products Outlet Store Online Tools Nitrogen Resources Find a Nitrogen Provider About Us Contact Wishlist Login / Register Shopping cart Close Search Start typing to see products you are looking for."
23,"nitrogen inflation resources Automotive Tools and Tire Equipment NEWS Manuals Archive Products Outlet Store Online Tools Nitrogen Resources Find a Nitrogen Provider About Us Contact Search 0 items $0.00 Menu 0 items $0.00 Nitrogen Resources ScienceProfitabilityUnit SelectionMarketingTraining and RolloutFleet SpecificScience The Basics Of Nitrogen Nitrogen Systems And How They Work Optimal Purity Levels Nitrogen And TPMS Clemson Nitrogen Inflation Report University of Bologna Nitrogen Inflation Study Canadian Fleet Mech and Mech Nitrogen Inflation Study NHTSA 2008 Nitrogen Inflation Study Sperberg Nitrogen Inflation Study Bob Jane/T-Marts Nitrogen Test Larsen Trucking Nitrogen Information Aberdare Cables South Africa Data NHTSA 2009 Nitrogen Inflation Study Ford Motors Nitrogen Inflation Study Dr. John Daws Nitrogen Inflation Study Profitability Branick Standard ROI Branick Advanced ROI How to Charge Unit Selection PSA And Membrane Systems Air Audit Questionnaire Ideal System And Installation Marketing Making Money And Helping Customers How To Market Nitrogen The Best Valve Cap For Your Customer Raising Community Awareness About Nitrogen Training and Rollout Methods For Nitrogen Service Training For Increased Profitability Fleet Specific White Paper Past Present Future of Nitrogen Tire Inflation GET IN TOUCH WITH US Contact Us Reach out to us with any questions that you might have about our products and nitrogen inflation. CONTACT US About Us Branick Industries began in 1917. Since then, we’ve grown to be a leader in the automotive equipment industry. We strive to be the most reliable choice for distributors and dealers across the globe. Terms and Conditions Contact Us 4245 Main Ave. Fargo, ND 58103 Phone: (800) 437-4394 Fax: (701) 281-5900 Email: sales@branick.com Copyright Branick Industries, Inc. Search Menu Categories Brake Bleeders Curing Rings Electronic Tire Tester Inflation Cages Nitrogen Inflation Systems Strut Spring Compressor Tire Inflation Tools Tire Service Tire Spreaders Products Outlet Store Online Tools Nitrogen Resources Find a Nitrogen Provider About Us Contact Wishlist Login / Register Shopping cart Close Search Start typing to see products you are looking for."
24,"Nitrogen service provider locator Automotive Tools and Tire Equipment NEWS Manuals Archive Products Outlet Store Online Tools Nitrogen Resources Find a Nitrogen Provider About Us Contact Search 0 items $0.00 Menu 0 items $0.00 Find a Nitrogen Provider We have Branick Nitrogen tire inflation service locations across the United states and Canada. Find a location near you and start saving money every time you drive your vehicle. Search Options 5 miles 10 miles 25 miles 50 miles 100 miles 200 miles 500 miles Select Category Get Directions Reset Map Directions ← Back to search About Us Branick Industries began in 1917. Since then, we’ve grown to be a leader in the automotive equipment industry. We strive to be the most reliable choice for distributors and dealers across the globe. Terms and Conditions Contact Us 4245 Main Ave. Fargo, ND 58103 Phone: (800) 437-4394 Fax: (701) 281-5900 Email: sales@branick.com Copyright Branick Industries, Inc. Search Menu Categories Brake Bleeders Curing Rings Electronic Tire Tester Inflation Cages Nitrogen Inflation Systems Strut Spring Compressor Tire Inflation Tools Tire Service Tire Spreaders Products Outlet Store Online Tools Nitrogen Resources Find a Nitrogen Provider About Us Contact Wishlist Login / Register Shopping cart Close Search Start typing to see products you are looking for."
25,"Learn More About Branick Employees and History - Branick Automotive Tools and Tire Equipment NEWS Manuals Archive Products Outlet Store Online Tools Nitrogen Resources Find a Nitrogen Provider About Us Contact Search 0 items $0.00 Menu 0 items $0.00 About Us Our History In 1910, C.E. ""Earl"" Branick started a tire and vulcanizing shop in Dickinson, North Dakota. Finding it hard to do vulcanizing from a book and old molds, Earl decided to put things on hold. He set off to work for Firestone and B.F. Goodrich where he built new tires and repaired old ones. In 1917, after serving in the Army, Earl established the Branick Vulcanizing Company in Fargo, North Dakota.Earl was an entrepreneur and prolific innovator. He invented a tire spreader that became the foundation for over 35 spreaders that Branick manufactured and sold worldwide. Earl continued to introduce other products, including air jacks, tire changers, tire inflation cages, and other specialty tools. Over the years, Branick has been issued over 100 patents for various designs.Today, Branick has evolved to become an industry leader in tire service equipment, tire repair equipment, tire inflation systems, and nitrogen tire inflation systems. With over 750,000 customers worldwide, we proudly remain focused on the tradition of quality instilled by Mr. Branick, while a team of research and development (R&D) engineers continue his legacy of innovation. We are committed to maintaining the well-earned reputation for quality, service, innovation, and value. 1917 COMPANY STARTED 750000 CUSTOMERS 12 NITROGEN PRODUCTS 40 TIRE PRODUCTS Our Promise At Branick, our goal is to be the partner-of-choice for industry dealers and distributors worldwide. We serve our customers with pride by providing skillful customer service in a quick and efficient manner, delivering accurate information about our products, and supporting them through each step of the process. Above everything, we manufacture solid, high-quality automotive equipment. Thank you for allowing us to serve you.OUR PRODUCTSCONTACT USGET IN TOUCH WITH US Contact Us Reach out to us with any questions that you might have about our products and nitrogen inflation. CONTACT US About Us Branick Industries began in 1917. Since then, we’ve grown to be a leader in the automotive equipment industry. We strive to be the most reliable choice for distributors and dealers across the globe. Terms and Conditions Contact Us 4245 Main Ave. Fargo, ND 58103 Phone: (800) 437-4394 Fax: (701) 281-5900 Email: sales@branick.com Copyright Branick Industries, Inc. Search Menu Categories Brake Bleeders Curing Rings Electronic Tire Tester Inflation Cages Nitrogen Inflation Systems Strut Spring Compressor Tire Inflation Tools Tire Service Tire Spreaders Products Outlet Store Online Tools Nitrogen Resources Find a Nitrogen Provider About Us Contact Wishlist Login / Register Shopping cart Close Search Start typing to see products you are looking for."
26,"Contact - Branick Automotive Tools and Tire Equipment NEWS Manuals Archive Products Outlet Store Online Tools Nitrogen Resources Find a Nitrogen Provider About Us Contact Search 0 items $0.00 Menu 0 items $0.00 SEND US AN EMAIL Name Email Phone Number Company Zip Code CountryAfghanistanAngolaAlbaniaAndorraUnited Arab EmiratesArgentinaArmeniaAntigua and BarbudaAustraliaAustriaAzerbaijanBurundiBelgiumBeninBurkina FasoBangladeshBulgariaBahrainBahamasBosnia and HerzegovinaBelarusBelizeBolivia, Plurinational State ofBrazilBarbadosBrunei DarussalamBhutanBotswanaCentral African RepublicCanadaSwitzerlandChileChinaCôte d'IvoireCameroonCongo, the Democratic Republic of theCongoColombiaComorosCape VerdeCosta RicaCubaCyprusCzech RepublicGermanyDjiboutiDominicaDenmarkDominican RepublicAlgeriaEcuadorEgyptEritreaSpainEstoniaEthiopiaFinlandFijiFranceMicronesia, Federated States ofGabonUnited KingdomGeorgiaGhanaGuineaGambiaGuinea-BissauEquatorial GuineaGreeceGrenadaGuatemalaGuyanaHondurasCroatiaHaitiHungaryIndonesiaIndiaIrelandIran, Islamic Republic ofIraqIcelandIsraelItalyJamaicaJordanJapanKazakhstanKenyaKyrgyzstanCambodiaKiribatiSaint Kitts and NevisKorea, Republic ofKuwaitLao People's Democratic RepublicLebanonLiberiaLibyaSaint LuciaLiechtensteinSri LankaLesothoLithuaniaLuxembourgLatviaMoroccoMonacoMoldova, Republic ofMadagascarMaldivesMexicoMarshall IslandsMacedonia, the former Yugoslav Republic ofMaliMaltaMyanmarMontenegroMongoliaMozambiqueMauritaniaMauritiusMalawiMalaysiaNamibiaNigerNigeriaNicaraguaNetherlandsNorwayNepalNauruNew ZealandOmanPakistanPanamaPeruPhilippinesPalauPapua New GuineaPolandKorea, Democratic People's Republic ofPortugalParaguayQatarRomaniaRussian FederationRwandaSaudi ArabiaSudanSenegalSingaporeSolomon IslandsSierra LeoneEl SalvadorSan MarinoSomaliaSerbiaSouth SudanSao Tome and PrincipeSurinameSlovakiaSloveniaSwedenSwazilandSeychellesSyrian Arab RepublicChadTogoThailandTajikistanTurkmenistanTimor-LesteTongaTrinidad and TobagoTunisiaTurkeyTuvaluTanzania, United Republic ofUgandaUkraineUruguayUnited StatesUzbekistanSaint Vincent and the GrenadinesVenezuela, Bolivarian Republic ofViet NamVanuatuSamoaYemenSouth AfricaZambiaZimbabwe Please leave this field empty. Question or Comment Δ CONTACT US 4245 Main Ave. Fargo, ND 58103 Toll Free (800) 437-4394 STAY CONNECTED Facebook Twitter LinkedIn YouTube Let us know if you have any questions or comments. We will return your message as soon as we can. About Us Branick Industries began in 1917. Since then, we’ve grown to be a leader in the automotive equipment industry. We strive to be the most reliable choice for distributors and dealers across the globe. Terms and Conditions Contact Us 4245 Main Ave. Fargo, ND 58103 Phone: (800) 437-4394 Fax: (701) 281-5900 Email: sales@branick.com Copyright Branick Industries, Inc. Search Menu Categories Brake Bleeders Curing Rings Electronic Tire Tester Inflation Cages Nitrogen Inflation Systems Strut Spring Compressor Tire Inflation Tools Tire Service Tire Spreaders Products Outlet Store Online Tools Nitrogen Resources Find a Nitrogen Provider About Us Contact Wishlist Login / Register Shopping cart Close Search Start typing to see products you are looking for."
