,Data
14,inflation cages archives - branick inflation cages close categoriesall products brake bleeders curing rings electronic tire tester inflation cages nitrogen inflation systems mobile systems nitrogen accessories tower systems wall mount systems outlet store strut spring compressor tire inflation tools tire service tire spreaders uncategorized filter by price min price max price filter price: — home inflation cages showing all 11 results show sidebar default sorting sort by popularity sort by latest sort by price: low to high sort by price: high to low 2010 tire cage $55775 add to wishlist add to cart 210 cage rollers $16675 add to wishlist add to cart 215 cage rollers $19000 add to wishlist add to cart 2220 tire cage $44620 add to wishlist add to cart 2040 tire cage $62675 add to wishlist add to cart 2130 tire cage $48070 add to wishlist add to cart 2230 tire cage $50025 add to wishlist add to cart 2240 tire cage $57270 add to wishlist add to cart 2250 tire cage $75900 add to wishlist add to cart 2260 tire cage $204930 add to wishlist add to cart 2264 tire cage $202000 add to wishlist add to cart search menu categories brake bleeders curing rings electronic tire tester inflation cages nitrogen inflation systems strut spring compressor tire inflation tools tire service tire spreaders products outlet store online tools nitrogen resources find a nitrogen provider about us contact wishlist login / register shopping cart close search start typing to see products you are looking for
15,nitrogen inflation systems archives - branick nitrogen inflation systems close categoriesall products brake bleeders curing rings electronic tire tester inflation cages nitrogen inflation systems mobile systems nitrogen accessories tower systems wall mount systems outlet store strut spring compressor tire inflation tools tire service tire spreaders uncategorized filter by price min price max price filter price: — home nitrogen inflation systems showing all 17 results show sidebar default sorting sort by popularity sort by latest sort by price: low to high sort by price: high to low 130 auto-inflator combo cart $281060 add to wishlist add to cart 500 tower nitrogen inflation system $1007055 add to wishlist add to cart 1000 tower nitrogen inflation system $1773760 add to wishlist add to cart 1500 tower nitrogen inflation system $2534485 add to wishlist add to cart 350 wall mount nitrogen inflation system $684710 add to wishlist add to cart 450 wall mount nitrogen inflation system $854910 add to wishlist add to cart 650 wall mount nitrogen inflation system $1108485 add to wishlist add to cart 465 mobile nitrogen inflation system $823400 add to wishlist add to cart 475 mobile nitrogen inflation system $1172425 add to wishlist add to cart 485 mobile nitrogen inflation system $1232800 add to wishlist add to cart 675 mobile nitrogen inflation system $1445435 add to wishlist add to cart 685 mobile nitrogen inflation system $1505810 add to wishlist add to cart green plastic valve caps qty 1000 $4255 add to wishlist add to cart blue plastic valve caps qty 1000 $4255 add to wishlist add to cart green plastic gm tpms valve caps qty 100 $4255 add to wishlist add to cart chromed brass valve caps qty 100 $1725 add to wishlist add to cart double seal flow through valve caps qty 100 $23690 add to wishlist add to cart search menu categories brake bleeders curing rings electronic tire tester inflation cages nitrogen inflation systems strut spring compressor tire inflation tools tire service tire spreaders products outlet store online tools nitrogen resources find a nitrogen provider about us contact wishlist login / register shopping cart close search start typing to see products you are looking for
16,strut spring compressor archives - branick strut spring compressor close categoriesall products brake bleeders curing rings electronic tire tester inflation cages nitrogen inflation systems mobile systems nitrogen accessories tower systems wall mount systems outlet store strut spring compressor tire inflation tools tire service tire spreaders uncategorized filter by price min price max price filter price: — home strut spring compressor showing all 3 results show sidebar default sorting sort by popularity sort by latest sort by price: low to high sort by price: high to low 7600 strut spring compressor $141910 add to wishlist add to cart 764 mobile cart $60260 add to wishlist add to cart 761 bench mount $8395 add to wishlist add to cart search menu categories brake bleeders curing rings electronic tire tester inflation cages nitrogen inflation systems strut spring compressor tire inflation tools tire service tire spreaders products outlet store online tools nitrogen resources find a nitrogen provider about us contact wishlist login / register shopping cart close search start typing to see products you are looking for
17,tire inflation tools archives - branick tire inflation tools close categoriesall products brake bleeders curing rings electronic tire tester inflation cages nitrogen inflation systems mobile systems nitrogen accessories tower systems wall mount systems outlet store strut spring compressor tire inflation tools tire service tire spreaders uncategorized filter by price min price max price filter price: — home tire inflation tools showing all 8 results show sidebar default sorting sort by popularity sort by latest sort by price: low to high sort by price: high to low blockhead $58765 add to wishlist add to cart blockhead cage mount $3680 add to wishlist add to cart 145 stationary airstation $94875 add to wishlist add to cart 155 wall mount airstation $94875 add to wishlist add to cart digital airhead bk4 21″ hose $18975 add to wishlist add to cart digital airhead bk4 6′ hose $18975 add to wishlist add to cart airhead bk4 21″ hose $13455 add to wishlist add to cart airhead bk4 6′ hose $13455 add to wishlist add to cart search menu categories brake bleeders curing rings electronic tire tester inflation cages nitrogen inflation systems strut spring compressor tire inflation tools tire service tire spreaders products outlet store online tools nitrogen resources find a nitrogen provider about us contact wishlist login / register shopping cart close search start typing to see products you are looking for
18,tire service archives - branick tire service close categoriesall products brake bleeders curing rings electronic tire tester inflation cages nitrogen inflation systems mobile systems nitrogen accessories tower systems wall mount systems outlet store strut spring compressor tire inflation tools tire service tire spreaders uncategorized filter by price min price max price filter price: — home tire service showing all 3 results show sidebar default sorting sort by popularity sort by latest sort by price: low to high sort by price: high to low go no go gauge $4000 add to wishlist add to cart tc400 tire cart $83835 add to wishlist add to cart 2400 tire tool station $55660 add to wishlist add to cart search menu categories brake bleeders curing rings electronic tire tester inflation cages nitrogen inflation systems strut spring compressor tire inflation tools tire service tire spreaders products outlet store online tools nitrogen resources find a nitrogen provider about us contact wishlist login / register shopping cart close search start typing to see products you are looking for
19,tire spreaders archives - branick tire spreaders close categoriesall products brake bleeders curing rings electronic tire tester inflation cages nitrogen inflation systems mobile systems nitrogen accessories tower systems wall mount systems outlet store strut spring compressor tire inflation tools tire service tire spreaders uncategorized filter by price min price max price filter price: — home tire spreaders showing all 10 results show sidebar default sorting sort by popularity sort by latest sort by price: low to high sort by price: high to low 502 base kit for 5025 $4140 add to wishlist add to cart 5025 tire spreader $39675 add to wishlist add to cart 5045 tire spreader $81190 add to wishlist add to cart 5130 tire spreader $288650 add to wishlist add to cart 5200 tire spreader $288535 add to wishlist add to cart 5300 tire spreader $476905 add to wishlist add to cart 5550 tire spreader $832025 add to wishlist add to cart 5700 tire spreader $1375285 add to wishlist add to cart ef tire spreader $1073525 add to wishlist add to cart ef-hd tire spreader $1616785 add to wishlist add to cart search menu categories brake bleeders curing rings electronic tire tester inflation cages nitrogen inflation systems strut spring compressor tire inflation tools tire service tire spreaders products outlet store online tools nitrogen resources find a nitrogen provider about us contact wishlist login / register shopping cart close search start typing to see products you are looking for
20,tire repair inspection and service tools products close categoriesall products brake bleeders curing rings electronic tire tester inflation cages nitrogen inflation systems mobile systems nitrogen accessories tower systems wall mount systems outlet store strut spring compressor tire inflation tools tire service tire spreaders uncategorized filter by price min price max price filter price: — home products showing 1–24 of 55 results show sidebar default sorting sort by popularity sort by latest sort by price: low to high sort by price: high to low 7600 strut spring compressor $141910 add to wishlist add to cart 764 mobile cart $60260 add to wishlist add to cart 761 bench mount $8395 add to wishlist add to cart go no go gauge $4000 add to wishlist add to cart tc400 tire cart $83835 add to wishlist add to cart g300 pressure brake bleeder $63020 add to wishlist add to cart 2400 tire tool station $55660 add to wishlist add to cart 2010 tire cage $55775 add to wishlist add to cart 210 cage rollers $16675 add to wishlist add to cart 215 cage rollers $19000 add to wishlist add to cart 2220 tire cage $44620 add to wishlist add to cart 2040 tire cage $62675 add to wishlist add to cart 2130 tire cage $48070 add to wishlist add to cart 2230 tire cage $50025 add to wishlist add to cart 2240 tire cage $57270 add to wishlist add to cart 2250 tire cage $75900 add to wishlist add to cart 2260 tire cage $204930 add to wishlist add to cart 2264 tire cage $202000 add to wishlist add to cart btt-5700 electronic tire tester add to wishlist read more 502 base kit for 5025 $4140 add to wishlist add to cart 5025 tire spreader $39675 add to wishlist add to cart 5045 tire spreader $81190 add to wishlist add to cart 5130 tire spreader $288650 add to wishlist add to cart 5200 tire spreader $288535 add to wishlist add to cart load more products loading search menu categories brake bleeders curing rings electronic tire tester inflation cages nitrogen inflation systems strut spring compressor tire inflation tools tire service tire spreaders products outlet store online tools nitrogen resources find a nitrogen provider about us contact wishlist login / register shopping cart close search start typing to see products you are looking for
21,outlet store archives - branick outlet store close categoriesall products brake bleeders curing rings electronic tire tester inflation cages nitrogen inflation systems mobile systems nitrogen accessories tower systems wall mount systems outlet store strut spring compressor tire inflation tools tire service tire spreaders uncategorized home outlet store no products were found matching your selection search search menu categories brake bleeders curing rings electronic tire tester inflation cages nitrogen inflation systems strut spring compressor tire inflation tools tire service tire spreaders products outlet store online tools nitrogen resources find a nitrogen provider about us contact wishlist login / register shopping cart close search start typing to see products you are looking for
22,branick online tools section online tools we make getting started easy use our online tools to register your 7600 strut compressor register your branick nitrogen tire inflation machine or calculate your nitrogen savings 7600 strut compressor registration register now nitrogen generator registration register now nitrogen savings calculator learn more catalog download download get in touch with us contact us reach out to us with any questions that you might have about our products and nitrogen inflation contact us search menu categories brake bleeders curing rings electronic tire tester inflation cages nitrogen inflation systems strut spring compressor tire inflation tools tire service tire spreaders products outlet store online tools nitrogen resources find a nitrogen provider about us contact wishlist login / register shopping cart close search start typing to see products you are looking for
23,nitrogen inflation resources nitrogen resources scienceprofitabilityunit selectionmarketinraining and rolloutfleet specificscience the basics of nitrogen nitrogen systems and how they work optimal purity levels nitrogen and tpms clemson nitrogen inflation report university of bologna nitrogen inflation study canadian fleet mech and mech nitrogen inflation study nhtsa 2008 nitrogen inflation study sperberg nitrogen inflation study bob jane/t-marts nitrogen test larsen trucking nitrogen information aberdare cables south africa data nhtsa 2009 nitrogen inflation study ford motors nitrogen inflation study dr john daws nitrogen inflation study profitability branick standard roi branick advanced roi how to charge unit selection psa and membrane systems air audit questionnaire ideal system and installation marketing making money and helping customers how to market nitrogen the best valve cap for your customer raising community awareness about nitrogen training and rollout methods for nitrogen service training for increased profitability fleet specific white paper past present future of nitrogen tire inflation get in touch with us contact us reach out to us with any questions that you might have about our products and nitrogen inflation contact us search menu categories brake bleeders curing rings electronic tire tester inflation cages nitrogen inflation systems strut spring compressor tire inflation tools tire service tire spreaders products outlet store online tools nitrogen resources find a nitrogen provider about us contact wishlist login / register shopping cart close search start typing to see products you are looking for
24,nitrogen service provider locator find a nitrogen provider we have branick nitrogen tire inflation service locations across the united states and canada find a location near you and start saving money every time you drive your vehicle search options 5 miles 10 miles 25 miles 50 miles 100 miles 200 miles 500 miles select category get directions reset map directions ← back to search search menu categories brake bleeders curing rings electronic tire tester inflation cages nitrogen inflation systems strut spring compressor tire inflation tools tire service tire spreaders products outlet store online tools nitrogen resources find a nitrogen provider about us contact wishlist login / register shopping cart close search start typing to see products you are looking for
25,learn more about branick employees and history - branick about us our history in 1910 ce earl branick started a tire and vulcanizing shop in dickinson north dakota finding it hard to do vulcanizing from a book and old molds earl decided to put things on hold he set off to work for firestone and bf goodrich where he built new tires and repaired old ones in 1917 after serving in the army earl established the branick vulcanizing company in fargo north dakotaearl was an entrepreneur and prolific innovator he invented a tire spreader that became the foundation for over 35 spreaders that branick manufactured and sold worldwide earl continued to introduce other products including air jacks tire changers tire inflation cages and other specialty tools over the years branick has been issued over 100 patents for various designstoday branick has evolved to become an industry leader in tire service equipment tire repair equipment tire inflation systems and nitrogen tire inflation systems with over 750000 customers worldwide we proudly remain focused on the tradition of quality instilled by mr branick while a team of research and development r&d engineers continue his legacy of innovation we are committed to maintaining the well-earned reputation for quality service innovation and value 1917 company started 750000 customers 12 nitrogen products 40 tire products our promise at branick our goal is to be the partner-of-choice for industry dealers and distributors worldwide we serve our customers with pride by providing skillful customer service in a quick and efficient manner delivering accurate information about our products and supporting them through each step of the process above everything we manufacture solid high-quality automotive equipment thank you for allowing us to serve youour productscontact usget in touch with us contact us reach out to us with any questions that you might have about our products and nitrogen inflation contact us search menu categories brake bleeders curing rings electronic tire tester inflation cages nitrogen inflation systems strut spring compressor tire inflation tools tire service tire spreaders products outlet store online tools nitrogen resources find a nitrogen provider about us contact wishlist login / register shopping cart close search start typing to see products you are looking for
26,contact - branick send us an email name email phone number company zip code countryafghanistanangolaalbaniaandorraunited arab emiratesargentinaarmeniaantigua and barbudaaustraliaaustriaazerbaijanburundibelgiumbeninburkina fasobangladeshbulgariabahrainbahamasbosnia and herzegovinabelarusbelizebolivia plurinational state ofbrazilbarbadosbrunei darussalambhutanbotswanacentral african republiccanadaswitzerlandchilechinacôte divoirecamerooncongo the democratic republic of thecongocolombiacomoroscape verdecosta ricacubacyprusczech republicgermanydjiboutidominicadenmarkdominican republicalgeriaecuadoregypteritreaspainestoniaethiopiafinlandfijifrancemicronesia federated states ofgabonunited kingdomgeorgiaghanaguineagambiaguinea-bissauequatorial guineagreecegrenadaguatemalaguyanahondurascroatiahaitihungaryindonesiaindiairelandiran islamic republic ofiraqicelandisraelitalyjamaicajordanjapankazakhstankenyakyrgyzstancambodiakiribatisaint kitts and neviskorea republic ofkuwaitlao peoples democratic republiclebanonliberialibyasaint lucialiechtensteinsri lankalesotholithuanialuxembourglatviamoroccomonacomoldova republic ofmadagascarmaldivesmexicomarshall islandsmacedonia the former yugoslav republic ofmalimaltamyanmarmontenegromongoliamozambiquemauritaniamauritiusmalawimalaysianamibianigernigerianicaraguanetherlandsnorwaynepalnaurunew zealandomanpakistanpanamaperuphilippinespalaupapua new guineapolandkorea democratic peoples republic ofportugalparaguayqatarromaniarussian federationrwandasaudi arabiasudansenegalsingaporesolomon islandssierra leoneel salvadorsan marinosomaliaserbiasouth sudansao tome and principesurinameslovakiasloveniaswedenswazilandseychellessyrian arab republicchadtogothailandtajikistanturkmenistantimor-lestetongatrinidad and tobagotunisiaturkeytuvalutanzania united republic ofugandaukraineuruguayunited statesuzbekistansaint vincent and the grenadinesvenezuela bolivarian republic ofviet namvanuatusamoayemensouth africazambiazimbabwe please leave this field empty question or comment δ contact us 4245 main ave fargo nd 58103 toll free 800 437-4394 stay connected facebook twitter linkedin youtube let us know if you have any questions or comments we will return your message as soon as we can search menu categories brake bleeders curing rings electronic tire tester inflation cages nitrogen inflation systems strut spring compressor tire inflation tools tire service tire spreaders products outlet store online tools nitrogen resources find a nitrogen provider about us contact wishlist login / register shopping cart close search start typing to see products you are looking for
e. Fargo, ND 58103 Phone: (800) 437-4394 Fax: (701) 281-5900 Email: sales@branick.com Copyright Branick Industries, Inc. Search Menu Categories Brake Bleeders Curing Rings Electronic Tire Tester Inflation Cages Nitrogen Inflation Systems Strut Spring Compressor Tire Inflation Tools Tire Service Tire Spreaders Products Outlet Store Online Tools Nitrogen Resources Find a Nitrogen Provider About Us Contact Wishlist Login / Register Shopping cart Close Search Start typing to see products you are looking for."
19,"Tire Spreaders Archives - Branick Automotive Tools and Tire Equipment NEWS Manuals Archive Products Outlet Store Online Tools Nitrogen Resources Find a Nitrogen Provider About Us Contact Search 0 items $0.00 Menu 0 items $0.00 Tire Spreaders Close CategoriesAll Products Brake Bleeders Curing Rings Electronic Tire Tester Inflation Cages Nitrogen Inflation Systems Mobile Systems Nitrogen Accessories Tower Systems Wall Mount Systems Outlet Store Strut Spring Compressor Tire Inflation Tools Tire Service Tire Spreaders Uncategorized Filter by price Min price Max price Filter Price: — Home Tire Spreaders Showing all 10 results Show sidebar Default sorting Sort by popularity Sort by latest Sort by price: low to high Sort by price: high to low 502 Base Kit for 5025 $41.40 Add to wishlist Add to cart 5025 Tire Spreader $396.75 Add to wishlist Add to cart 5045 Tire Spreader $811.90 Add to wishlist Add to cart 5130 Tire Spreader $2,886.50 Add to wishlist Add to cart 5200 Tire Spreader $2,885.35 Add to wishlist Add to cart 5300 Tire Spreader $4,769.05 Add to wishlist Add to cart 5550 Tire Spreader $8,320.25 Add to wishlist Add to cart 5700 Tire Spreader $13,752.85 Add to wishlist Add to cart EF Tire Spreader $10,735.25 Add to wishlist Add to cart EF-HD Tire Spreader $16,167.85 Add to wishlist Add to cart About Us Branick Industries began in 1917. Since then, we’ve grown to be a leader in the automotive equipment industry. We strive to be the most reliable choice for distributors and dealers across the globe. Terms and Conditions Contact Us 4245 Main Ave. Fargo, ND 58103 Phone: (800) 437-4394 Fax: (701) 281-5900 Email: sales@branick.com Copyright Branick Industries, Inc. Search Menu Categories Brake Bleeders Curing Rings Electronic Tire Tester Inflation Cages Nitrogen Inflation Systems Strut Spring Compressor Tire Inflation Tools Tire Service Tire Spreaders Products Outlet Store Online Tools Nitrogen Resources Find a Nitrogen Provider About Us Contact Wishlist Login / Register Shopping cart Close Search Start typing to see products you are looking for."
20,"Tire repair, inspection and service tools Automotive Tools and Tire Equipment NEWS Manuals Archive Products Outlet Store Online Tools Nitrogen Resources Find a Nitrogen Provider About Us Contact Search 0 items $0.00 Menu 0 items $0.00 Products Close CategoriesAll Products Brake Bleeders Curing Rings Electronic Tire Tester Inflation Cages Nitrogen Inflation Systems Mobile Systems Nitrogen Accessories Tower Systems Wall Mount Systems Outlet Store Strut Spring Compressor Tire Inflation Tools Tire Service Tire Spreaders Uncategorized Filter by price Min price Max price Filter Price: — Home Products Showing 1–24 of 55 results Show sidebar Default sorting Sort by popularity Sort by latest Sort by price: low to high Sort by price: high to low 7600 Strut Spring Compressor $1,419.10 Add to wishlist Add to cart 764 Mobile Cart $602.60 Add to wishlist Add to cart 761 Bench Mount $83.95 Add to wishlist Add to cart Go No Go Gauge $40.00 Add to wishlist Add to cart TC400 Tire Cart $838.35 Add to wishlist Add to cart G300 Pressure Brake Bleeder $630.20 Add to wishlist Add to cart 2400 Tire Tool Station $556.60 Add to wishlist Add to cart 2010 Tire Cage $557.75 Add to wishlist Add to cart 210 Cage Rollers $166.75 Add to wishlist Add to cart 215 Cage Rollers $190.00 Add to wishlist Add to cart 2220 Tire Cage $446.20 Add to wishlist Add to cart 2040 Tire Cage $626.75 Add to wishlist Add to cart 2130 Tire Cage $480.70 Add to wishlist Add to cart 2230 Tire Cage $500.25 Add to wishlist Add to cart 2240 Tire Cage $572.70 Add to wishlist Add to cart 2250 Tire Cage $759.00 Add to wishlist Add to cart 2260 Tire Cage $2,049.30 Add to wishlist Add to cart 2264 Tire Cage $2,020.00 Add to wishlist Add to cart BTT-5700 Electronic Tire Tester Add to wishlist Read more 502 Base Kit for 5025 $41.40 Add to wishlist Add to cart 5025 Tire Spreader $396.75 Add to wishlist Add to cart 5045 Tire Spreader $811.90 Add to wishlist Add to cart 5130 Tire Spreader $2,886.50 Add to wishlist Add to cart 5200 Tire Spreader $2,885.35 Add to wishlist Add to cart Load more products Loading... About Us Branick Industries began in 1917. Since then, we’ve grown to be a leader in the automotive equipment industry. We strive to be the most reliable choice for distributors and dealers across the globe. Terms and Conditions Contact Us 4245 Main Ave. Fargo, ND 58103 Phone: (800) 437-4394 Fax: (701) 281-5900 Email: sales@branick.com Copyright Branick Industries, Inc. Search Menu Categories Brake Bleeders Curing Rings Electronic Tire Tester Inflation Cages Nitrogen Inflation Systems Strut Spring Compressor Tire Inflation Tools Tire Service Tire Spreaders Products Outlet Store Online Tools Nitrogen Resources Find a Nitrogen Provider About Us Contact Wishlist Login / Register Shopping cart Close Search Start typing to see products you are looking for."
