,Data
0,home abbiamo top of pagehomeour storyproductscareerscontactmoreuse tab to navigate through the menu itemsabbiamo pasta companyon task on time and on a mission contact usnorth dakota made abbiamo pasta company uses durum-derived semolina produced by the north dakota mill located in grand forks nd to produce high-quality short goods pasta that exceeds the industry standard abbiamo built the business with iqf suppliers who expect outstanding product performanceread moreshort goods pastaclick to see current product protfolio contact us1900 governors dr casselton nd 58012office hours ​mon - fri: 7:30 am - 4:00pm ​ facility open 24 hours ​shipping hours mon- fri: 7:00 am - 3:00pm ​ phone 701-347-2010send us a message todaysubmitthanks for submittingcontact© 2023 by abbiamo pasta companybottom of page
1,careers abbiamo top of pageindustrial maintenance technician $30 - $37/hrapply today job description assists in monitoring and maintaining plant operations including production and packaging equipment performs preventive and predictive maintenance tasks independently troubleshoots equipment that needs repair or that is operating at a substandard level makes repairs and adjustments in a timely fashion to ensure as little downtime as possible communicate and work with plant manager maintenance manager and other maintenance personnel performs other tasks as assigned by management ​​sanitation technician flexible hoursapply today job description and duties clean the inside and outside of the facility dusting sweeping vacuuming mopping cleaning ceiling fans restroom cleaning etc clean the machine/equipment mixer dryer shaker cooler during a shutdown ensure that any trash/waste in parking areas or grounds is picked up and put away properly emptying trash cans and transporting waste material to designated collection points using floor scrubber to scrub and polish floor after receiving proper instruction and training scheduling 40 hours/week - some evenings and weekends as needed bottom of page
2,our story abbiamo top of pageabbiamo pasta companyour storypasta runs in our familyfounded in 2013 by local farmers and experienced industry professionals with the core company values centered around outstanding customer service and finished products abbiamo pasta company has been producing short goods pasta since 2014 and expanded its production capacity in 2017 and 2021 to meet customer demands apc is continuing to grow and expand its pasta profile ​ our products are produced from semolina and hard red spring wheat flour the durum semolina is north dakota grown and milled in grand forks nd at the north dakota mill ndm is a state-run mill that has been producing quality flour and semolina since 1922 bottom of page
3,products abbiamo top of pageabbiamo pasta companybottom of page
lina is North Dakota grown and milled in Grand Forks, ND at the North Dakota Mill. NDM is a state-run mill that has been producing quality flour and semolina since 1922. © 2023 by Abbiamo Pasta Company.bottom of page"
3,PRODUCTS | Abbiamo top of pageHOMEOUR STORYPRODUCTSCAREERSCONTACTMoreUse tab to navigate through the menu items.Abbiamo Pasta Company© 2023 by Abbiamo Pasta Company.bottom of page
