,Data
0,engineering services plc and hmi programming jdp automation ph: 701-478-6520 home automation engineering plc and hmi programming panel design and build solution design 24/7 remote support technology robotics vision distributed architecture production monitoring illuminate data gathering and reporting our company about us contact us career opportunities partnering for continuous improvement contact us partnering for continuous improvement contact us partnering for continuous improvement contact us previous next providing quality automation services jdp automation is a leading systems integrator located in the midwest and serving customers across the united states we provide engineering services plc and hmi programming along with ul 508a panel builds our diverse customer base gives us a wide range of experience in process automation data capturing/reporting robotics implementation lean manufacturing principles as well as our core skills of programming and design with our design & build skillset we are able to utilize the newest products on the market to achieve our customers goals with a robust and dependable solution read more what we do automation engineering technology production monitoring the jdp automation inc mission is to enable businesses to leverage technologies in automation to improve strenhen and grow processes in operations maintenance and production contact us quick links technology production monitoring automation engineering our company about us contact us automation engineering plc and hmi programming panel design and build solution design 24/7 remote support reach us 824 page dr fargo nd usa phone: 701478-6520 email jdp automation inc copyright 2023 · all rights reservedpowered by: simple website creations llc
1,robotics manufacturing automation technology robotics robotics are playing an ever-growing role in manufacturing and automation jdp automation can provide turn-key solutions to your robotics needs including: end of arm tool design collaborative and industrial robots programming setup and testing pick and place repetitive motion quality check and more << view listing
2,vision systems jdp automation technology vision a camera-based vision system can be used for many different forms of part inspection jdp automation can set up vision systems for: presence/absence detection color detection barcode or qr code reads flaw detection measurement and more << view listing
3,distributed architecture faster processing jdp automation inc technology distributed architecture with the ever-growing presence of it networking automation has adopted and leveraged open standards and industrial ethernet this allows for more i/o on a network along with faster processing capability and faster response from the control system << view listing
4,illuminate data capture custom designed production monitoring illuminate illuminate is a proprietary application that is server-based and capable of capturing data from manual or automated production lines and is custom designed to fit the customers process it gathers loss data due to training part shortages and even mechanical issues loss reason codes can be customized for your process so the data has integrity part calls can be made directly from illuminate to warehouses to expedite logistic constraint << view listing
5,data gathering data reporting jdp automation inc production monitoring data gathering and reporting capturing data from your process or production line is key to understanding what metrics drive your throughput equally important is presenting that data to a user in a format that is understandable jdp automation can create custom reports defined by the user for all the data that is captured the reports can be sent out via email automatically on schedules or can be user initiated daily customized pdf reports via email custom dashboards for at-a-glance analysis charts and graphs and more << view listing
6,career opportunities jdp automation inc career opportunities career opportunities with jdp automation inc jdp automation inc has excellent career opportunities for qualified candidates we offer a great benefit package and an outstanding work environment as a leading provider of systems integration we provide an atmosphere of applied engineering principles where your input can have a great output we look forward to seeing your application for the following job opportunities below check-out our benefits 401k 401k matching dental insurance health insurance life insurance paid time off retirement plan vision insurance available positions automation technician job description: the automation technician will troubleshoot service and fix computerized systems plcs and pacs these systems are often found within industrial and manufacturing plants such as food processing facilities manufacturing facilities as well as coal mines the automation technician will also perform routine diagnostic checks on automated systems monitor automated systems isolate problems and perform repairs view & print full job description jdp automation employment application controls engineer job description: jdp automation inc is seeking to hire a full-time controls engineer this position is primarily an office position with some onsite work and travel this is an existing position with an expected work schedule of 40 hours a week with over-time being put in as needed view & print full job description jdp automation employment application
7,advanced engineering technology jdp automation inc technology jdp automation’s advanced engineering skills enable us to utilize innovative technologies to solve your automation needs collaborative robots vision and data acquisition are some of the current technologies that jdp automation is implementing across a wide range of industries robotics turn-key solutions to your robotic needs read more vision camera-based vision systems for parts inspection and more read more distributed architecture faster processing capability and response from the control systems read more
8,production monitoring jdp automation inc production monitoring eliminating constraints and bottlenecks in your process can add tremendous value changing your maintenance posture from reactive to predicative can prevent costly downtime in order to achieve these concepts you need to understand the data within your control system or process the production monitoring solutions jdp automation can offer will achieve both illuminate capable of capturing data from manual or automated production lines read more data gathering and reporting helping you gain insight into your systems read more
9,automation engineering jdp automation automation engineering jdp automation provides solution design panel construction programing commissioning and support these services can be expanded upon in more detail its important to note that not every part of automation engineering is required for a project and pieces can be executed independent of the others please enjoy viewing some automation engineering solutions we offer below plc and hmi programming jdp automation inc services plcs and hmi let us help you out read more panel design and build with a full ul panel shop we can take care of your panel needs read more solution design helping you to achieve your automation goals read more 24/7 remote support enjoy our amazing 24/7 remote support hotline read more
10,jdp automation about systems integration about us jdp automation is an industry leader in systems integration we strive to utilize the most current technologies to solve our customers issues our engineering staff have over 40 years of experience in process and production automation the team at jdp automation is beyond passionate about partnering with our customers to provide continuous improvement to their automation needs jdp automation 824 page dr fargo nd usa phone: 701478-6520 email jdp automation inc
11,contact us jdp automation inc contact us
12,plc programming hmi programming jdp automation inc automation engineering plc and hmi programming plc programming jdp automation provides solution design panel construction programming commissioning and support these services can be expanded upon in more detail its important to note that not every part of automation engineering is required for a project and pieces can be executed independent of the others plc’s we service: allen-bradley siemens horner yaskawa automation direct and more hmi programming hmi development is the process of creating the interface that operators and supervisors use to control and interact with the process this development often follows the ansi/isa-10101-2015 standard for human machine interface for process the standards to which plc and hmi development are completed are often driven by customer requirements hmi’s we service: allen-bradley ignition c-more wonderware and more << view listing
13,automation engineering panel design panel build automation engineering panel design and build the ul 508a panel design and build process follows a strict and well-structured standard we are capable of ul listing your panel or designing and building it for you types of panels we build: plc and io panel motor control pneumatic control remote io hmi and pushbutton ul listed and more << view listing
14,solution design engineering help jdp automation inc automation engineering solution design the senior engineering staff at jdp automation has over 40 years of experience solving your design challenges meet with our engineers today so we can help find solutions to your problems jdp automation can design and spec the following: plc hardware process measurement equipment temperature level vibration flow humidity etc power control and safety circuitry motor control pneumatic control operator interaction data collection and more << view listing
15,remote support control systems 24/7 support automation engineering 24/7 remote support leveraging vpn technologies jdp automation can provide remote support for your control system we can work with your on site staff to solve basic to complex issues occurring in your control system << view listing
s implementing across a wide range of industries. Robotics Turn-key solutions to your robotic needs!... Read More Vision Camera-based vision systems for parts inspection and more.... Read More Distributed Architecture Faster processing capability and response from the control systems!... Read More QUICK LINKS Technology Production Monitoring Automation Engineering our company About Us Contact Us automation engineering PLC and HMI Programming Panel Design and Build Solution Design 24/7 Remote Support Reach Us 824 Page Dr. Fargo, ND USA Phone: (701)478-6520 Email JDP Automation, Inc Copyright 2023 · All rights ReservedPowered by: Simple Website Creations, LLC"
8,"Production Monitoring | JDP Automation, Inc. Ph: 701-478-6520 Home Automation Engineering PLC and HMI Programming Panel Design and Build Solution Design 24/7 Remote Support Technology Robotics Vision Distributed Architecture Production Monitoring Illuminate Data Gathering and Reporting Our Company About Us Contact Us Career Opportunities PRODUCTION MONITORING Eliminating constraints and bottlenecks in your process can add tremendous value. Changing your maintenance posture from reactive to predicative can prevent costly downtime. In order to achieve these concepts, you need to understand the data within your control system or process. The production monitoring solutions JDP Automation can offer will achieve both. Illuminate Capable of capturing data from manual or automated production lines!... Read More Data Gathering and Reporting Helping you gain insight into your systems!... Read More QUICK LINKS Technology Production Monitoring Automation Engineering our company About Us Contact Us automation engineering PLC and HMI Programming Panel Design and Build Solution Design 24/7 Remote Support Reach Us 824 Page Dr. Fargo, ND USA Phone: (701)478-6520 Email JDP Automation, Inc Copyright 2023 · All rights ReservedPowered by: Simple Website Creations, LLC"
9,"Automation Engineering | JDP Automation Ph: 701-478-6520 Home Automation Engineering PLC and HMI Programming Panel Design and Build Solution Design 24/7 Remote Support Technology Robotics Vision Distributed Architecture Production Monitoring Illuminate Data Gathering and Reporting Our Company About Us Contact Us Career Opportunities AUTOMATION ENGINEERING JDP Automation provides solution design, panel construction, programing commissioning and support. These services can be expanded upon in more detail. Its important to note that not every part of automation engineering is required for a project and pieces can be executed independent of the others. Please enjoy viewing some automation engineering solutions we offer below! PLC and HMI Programming JDP Automation Inc. services PLC's and HMI. Let us help you out. Read More Panel Design and Build With a full UL Panel Shop, we can take care of your panel needs. Read More Solution Design Helping you to achieve your automation goals! Read More 24/7 Remote Support Enjoy our amazing 24/7 remote support hotline. Read More QUICK LINKS Technology Production Monitoring Automation Engineering our company About Us Contact Us automation engineering PLC and HMI Programming Panel Design and Build Solution Design 24/7 Remote Support Reach Us 824 Page Dr. Fargo, ND USA Phone: (701)478-6520 Email JDP Automation, Inc Copyright 2023 · All rights ReservedPowered by: Simple Website Creations, LLC"
10,"JDP Automation | About | Systems Integration Ph: 701-478-6520 Home Automation Engineering PLC and HMI Programming Panel Design and Build Solution Design 24/7 Remote Support Technology Robotics Vision Distributed Architecture Production Monitoring Illuminate Data Gathering and Reporting Our Company About Us Contact Us Career Opportunities About Us JDP Automation is an industry leader in systems integration. We strive to utilize the most current technologies to solve our customers issues. Our Engineering staff have over 40 years of experience in process and production automation. The team at JDP Automation is beyond passionate about partnering with our customers to provide continuous improvement to their automation needs. JDP Automation 824 Page Dr. Fargo, ND USA Phone: (701)478-6520 Email JDP Automation, Inc. QUICK LINKS Technology Production Monitoring Automation Engineering our company About Us Contact Us automation engineering PLC and HMI Programming Panel Design and Build Solution Design 24/7 Remote Support Reach Us 824 Page Dr. Fargo, ND USA Phone: (701)478-6520 Email JDP Automation, Inc Copyright 2023 · All rights ReservedPowered by: Simple Website Creations, LLC"
11,"Contact Us | JDP Automation, Inc. Ph: 701-478-6520 Home Automation Engineering PLC and HMI Programming Panel Design and Build Solution Design 24/7 Remote Support Technology Robotics Vision Distributed Architecture Production Monitoring Illuminate Data Gathering and Reporting Our Company About Us Contact Us Career Opportunities Contact Us QUICK LINKS Technology Production Monitoring Automation Engineering our company About Us Contact Us automation engineering PLC and HMI Programming Panel Design and Build Solution Design 24/7 Remote Support Reach Us 824 Page Dr. Fargo, ND USA Phone: (701)478-6520 Email JDP Automation, Inc Copyright 2023 · All rights ReservedPowered by: Simple Website Creations, LLC"
12,"PLC Programming | HMI Programming | JDP Automation, Inc. Ph: 701-478-6520 Home Automation Engineering PLC and HMI Programming Panel Design and Build Solution Design 24/7 Remote Support Technology Robotics Vision Distributed Architecture Production Monitoring Illuminate Data Gathering and Reporting Our Company About Us Contact Us Career Opportunities AUTOMATION ENGINEERING PLC and HMI Programming PLC Programming JDP Automation provides solution design, panel construction, programming commissioning and support. These services can be expanded upon in more detail. Its important to note that not every part of automation engineering is required for a project and pieces can be executed independent of the others. PLC’s we service: Allen-Bradley Siemens Horner Yaskawa Automation Direct And more! HMI Programming HMI development is the process of creating the interface that operators and supervisors use to control and interact with the process. This development often follows the ANSI/ISA-101.01-2015 standard for Human Machine Interface for Process. The standards to which PLC and HMI development are completed are often driven by customer requirements. HMI’s we service: Allen-Bradley Ignition C-More Wonderware And more! << View Listing QUICK LINKS Technology Production Monitoring Automation Engineering our company About Us Contact Us automation engineering PLC and HMI Programming Panel Design and Build Solution Design 24/7 Remote Support Reach Us 824 Page Dr. Fargo, ND USA Phone: (701)478-6520 Email JDP Automation, Inc Copyright 2023 · All rights ReservedPowered by: Simple Website Creations, LLC"
13,"Automation Engineering | Panel Design | Panel Build Ph: 701-478-6520 Home Automation Engineering PLC and HMI Programming Panel Design and Build Solution Design 24/7 Remote Support Technology Robotics Vision Distributed Architecture Production Monitoring Illuminate Data Gathering and Reporting Our Company About Us Contact Us Career Opportunities AUTOMATION ENGINEERING Panel Design and Build The UL 508A panel design and build process follows a strict and well-structured standard. We are capable of UL listing your panel or designing and building it for you. Types of panels we build: PLC and IO panel Motor control Pneumatic control Remote IO HMI and Pushbutton UL Listed And more! << View Listing QUICK LINKS Technology Production Monitoring Automation Engineering our company About Us Contact Us automation engineering PLC and HMI Programming Panel Design and Build Solution Design 24/7 Remote Support Reach Us 824 Page Dr. Fargo, ND USA Phone: (701)478-6520 Email JDP Automation, Inc Copyright 2023 · All rights ReservedPowered by: Simple Website Creations, LLC"
14,"Solution Design | Engineering Help | JDP Automation, Inc. Ph: 701-478-6520 Home Automation Engineering PLC and HMI Programming Panel Design and Build Solution Design 24/7 Remote Support Technology Robotics Vision Distributed Architecture Production Monitoring Illuminate Data Gathering and Reporting Our Company About Us Contact Us Career Opportunities AUTOMATION ENGINEERING Solution Design The senior engineering staff at JDP Automation has over 40 years of experience solving your design challenges. Meet with our engineers today so we can help find solutions to your problems. JDP Automation can design and spec the following: PLC hardware Process measurement equipment (temperature, level, vibration, flow, humidity, etc.) Power, control and safety circuitry Motor control Pneumatic control Operator interaction Data collection And more! << View Listing QUICK LINKS Technology Production Monitoring Automation Engineering our company About Us Contact Us automation engineering PLC and HMI Programming Panel Design and Build Solution Design 24/7 Remote Support Reach Us 824 Page Dr. Fargo, ND USA Phone: (701)478-6520 Email JDP Automation, Inc Copyright 2023 · All rights ReservedPowered by: Simple Website Creations, LLC"
15,"Remote Support | Control Systems | 24/7 Support Ph: 701-478-6520 Home Automation Engineering PLC and HMI Programming Panel Design and Build Solution Design 24/7 Remote Support Technology Robotics Vision Distributed Architecture Production Monitoring Illuminate Data Gathering and Reporting Our Company About Us Contact Us Career Opportunities AUTOMATION ENGINEERING 24/7 Remote Support Leveraging VPN technologies JDP Automation can provide remote support for your control system. We can work with your on site staff to solve basic to complex issues occurring in your control system. << View Listing QUICK LINKS Technology Production Monitoring Automation Engineering our company About Us Contact Us automation engineering PLC and HMI Programming Panel Design and Build Solution Design 24/7 Remote Support Reach Us 824 Page Dr. Fargo, ND USA Phone: (701)478-6520 Email JDP Automation, Inc Copyright 2023 · All rights ReservedPowered by: Simple Website Creations, LLC"
