,Data
18,"Brand Assets | Trail King Industries 800-843-3324 Solutions Agriculture Materials Hauling Open Deck Commercial Open Deck Construction Specialized Tagalong Services Parts Refurb & Service Warranty & Technical Assistance Paint Process Find A Rep Our Company Our Why Our History News & Events Brand Assets Official Trail King Merchandise Government Contracts Careers Workforce Recruitment Program Employment Opportunities Apply Now Contact Us Customer Survey Get Financing Contact Finance Dealer Portal Brand Assets Questions? Contact our marketing team. Thank you for your interest in Trail King Industries. Contact Us! TRAIL KING BRAND RESOURCES These guidelines are for anyone who wants to use Trail King’s brand assets in their marketing or advertising and briefly covers guidelines for the assets approved use. Consistent use of these assets helps people easily recognize references to Trail King and protects company trademarks. It is important that your marketing materials use Trail King standards and approved assets correctly. LOGOS CROWN LOGO The Trail King crown is our sigil, the main identifier of our brand. Trail King uses only three versions of the crown logo - full color metallic, black, and white. Do not attempt to recreate the logo or alter the provided files. Always size proportionally, but never size the crown so small that it is no longer legible. Avoid stylizing the logo with drop shadows or other effects. Do not change the color of the logo or present the logo with any opacity. Do not place our crown over the focus of the graphic. Download approved logo. LOGOTYPE The Trail King logotype is used in design scenarios in which the crown logo is not ideal. Trail King takes liberty to use the logotype with or without the crown identifier, depending upon the situation. Only white or black versions of the logotype are permitted for use. As with all of our logos, proper spacing around the logo is essential. Download approved logo. Please DO ensure the logo has plenty of space around it Please DO size proportionally Please DO contact our team if you have any questions Please DON'T alter these files in any way Please DON'T change the color of the logo Please DON'T use a light logo on a light background Please DON'T adjust the opacity Please DON'T place the logo over the focus of the graphic OUR COLORS Trail King’s color palette is simple and timeless- white, black, and grey. The “grey” color is very specific to our brand and the guidelines do not allow for other shades. TRIANGLES The registered Trail King triangles are the easiest way to identify a Trail King trailer on the road. Most often, the triangles are used in the format of the ibeam, commonly used as a divider in graphic designs. The ibeam graphic should be scaled proportionally, not too small, or too large. Trail King also uses the triangles without the beam, but they should always be used in groups of 6 or more, and they should never be grouped vertically. These graphics are proprietary and protected under intellectual property laws. Gov Contracts Cooperative purchasing, competitively solicited contracts. Learn More Our History Proudly serving our customers since 1974. Learn More News & Events Sometimes we post photos of co-workers with snapchat filters. Show Me Trail King Merch Get geared up with Trail King apparel and accessories. Go Shop Our Company The mission and values that drive our success and yours. Learn More Get in Touch About Trail King Leading North American manufacturer of trailers for the construction, agriculture, transportation, waste & recycling, and specialized hauling industries. Newsletter Signup Success! You've been added to our email list. GO! QUICK LINKS Solutions Services Find A Rep Our Company Careers Contact Us Get Financing Dealer Portal CONTACT US 300 E Norway Ave Mitchell, SD ,57301 800-843-3324 sales@trailking.com FOLLOW US © 2023 Trail King Industries All Rights Reserved. Privacy Policy Terms of Use Chat with us, powered by LiveChat"
19,"Official Trail King Merchandise | Trail King Industries 800-843-3324 Solutions Agriculture Materials Hauling Open Deck Commercial Open Deck Construction Specialized Tagalong Services Parts Refurb & Service Warranty & Technical Assistance Paint Process Find A Rep Our Company Our Why Our History News & Events Brand Assets Official Trail King Merchandise Government Contracts Careers Workforce Recruitment Program Employment Opportunities Apply Now Contact Us Customer Survey Get Financing Contact Finance Dealer Portal Merchandise Get your official Trail King gear. Clicking “Let’s Shop” will redirect you to our trusted vendor. Let's Shop! GEAR UP, TK STYLE We can’t wait to see our brand on you! New styles are added every 6 months, so check back. Please contact us if you have any questions about our apparel and accessories. Orders will ship directly to you! Get in Touch About Trail King Leading North American manufacturer of trailers for the construction, agriculture, transportation, waste & recycling, and specialized hauling industries. Newsletter Signup Success! You've been added to our email list. GO! QUICK LINKS Solutions Services Find A Rep Our Company Careers Contact Us Get Financing Dealer Portal CONTACT US 300 E Norway Ave Mitchell, SD ,57301 800-843-3324 sales@trailking.com FOLLOW US © 2023 Trail King Industries All Rights Reserved. Privacy Policy Terms of Use Chat with us, powered by LiveChat"
20,"Government Contracts | Trail King Industries 800-843-3324 Solutions Agriculture Materials Hauling Open Deck Commercial Open Deck Construction Specialized Tagalong Services Parts Refurb & Service Warranty & Technical Assistance Paint Process Find A Rep Our Company Our Why Our History News & Events Brand Assets Official Trail King Merchandise Government Contracts Careers Workforce Recruitment Program Employment Opportunities Apply Now Contact Us Customer Survey Get Financing Contact Finance Dealer Portal Government Contracts Choose the quality trailer you want. Sourcewell and GSA contracts save your agency time and money. Contact Us! Trail King is proud to serve our local, state and national governmental agencies with trailer products and services. Through the contracts we hold, customers have the convenience of saving time and money by not having to duplicate the bidding process. We offer an easy way to purchase exactly what you need at an affordable cost. Sourcewell Sourcewell is a national public agency that serves as a member-focused cooperative for over 50,000 member agencies. Sourcewell offers a multitude of cooperatively contracted products, equipment, and service opportunities to the education and government sectors. Become a Sourcewell Member here. Sourcewell – contract number #092922-TKI GSA through trusted partner AMH GSA provides centralized procurement for the federal government, offering billions of dollars worth of products, services, and facilities that federal agencies need to serve the public. GSA’s acquisition solutions supply federal purchasers with cost-effective high-quality products and services from commercial vendors. GSA helps federal agencies build and acquire office space, products and other workspace services, and oversees the preservation of historic federal properties. Its policies covering travel, property and management practices promote efficient government operations. We offer GSA through our trusted partner American Material Handling. US Manufacturing Manufacturing is an essential component of gross domestic product, and the goods comprise half of U.S. export. Trail King Industries has been proudly serving our Midwest communities since 1974, paving the way for longevity of family business, supportive incomes and benefits for families, and professional growth for our employees. With two locations in Mitchell, SD, and one in both Yankton, SD and West Fargo, North Dakota, Trail King is not only the strong back that vital materials are carried on, it’s also a rock-solid foundation for our thriving towns. Our Why Why Trail King The journey is as important as the destination. Your success is our top priority. Tell Me More Our History Did you know Trail King originated out of a garage in Mitchell, SD? Proudly serving our customers since 1974. Learn More News & Events Sometimes we post photos of co-workers with snapchat filters. Show Me Trail King Merch Get geared up with Trail King apparel and accessories. Go Shop Our Company The mission and values that drive our success and yours. Learn More Get in Touch About Trail King Leading North American manufacturer of trailers for the construction, agriculture, transportation, waste & recycling, and specialized hauling industries. Newsletter Signup Success! You've been added to our email list. GO! QUICK LINKS Solutions Services Find A Rep Our Company Careers Contact Us Get Financing Dealer Portal CONTACT US 300 E Norway Ave Mitchell, SD ,57301 800-843-3324 sales@trailking.com FOLLOW US © 2023 Trail King Industries All Rights Reserved. Privacy Policy Terms of Use Chat with us, powered by LiveChat"
21,"Careers | Trail King Industries 800-843-3324 Solutions Agriculture Materials Hauling Open Deck Commercial Open Deck Construction Specialized Tagalong Services Parts Refurb & Service Warranty & Technical Assistance Paint Process Find A Rep Our Company Our Why Our History News & Events Brand Assets Official Trail King Merchandise Government Contracts Careers Workforce Recruitment Program Employment Opportunities Apply Now Contact Us Customer Survey Get Financing Contact Finance Dealer Portal Careers Trail King is building success. There are jobs, and then there are careers. Join our team! Apply Today! Welcome to Trail King Industries! Our goal is to help you succeed in the career you have chosen. At Trail King, a variety of employment opportunities are available, and we need a wide range of personalities and skill sets to continue building success for our customers. We are looking forward to learning about what drives you. We foster a safe environment and treat each other with respect. Employees give so much to our customers, company and community. We invest in our employees so you can realize your full potential both personally and professionally. Your Community Trail King Industries proudly supports our communities - volunteering time, donating funds, and getting involved in various non-profit and city efforts. Your Team Trail King hosts several company events at all locations throughout the year, fostering a family atmosphere and an attitude of mutual respect! Your Life Trail King invests in employees, offering discounts for memberships to keep you healthy and happy! Possibilities include local golf courses, parks and rec and local fitness centers. West Plant Employees - Mitchell, SD East Plant Employees - Mitchell, SD West Fargo Plant Employees - West Fargo, ND Yankton Plant Employees - Yankton, SD District Sales Managers 0 Dedicated Employees 0 District Sales Managers 0 Dealers in North America 0 Trailers On The Road 401K Trail King matches 100% of the first 3% of employee contributions and 50% of the next 2%. Eligible 90 days after hire date. Healthcare Options Trail King offers competitive and affordable healthcare plans. Health Savings Plans are available with contributions from Trail King for Family plans. Vision and Dental plans are also available! Paid Time Off Employees are offered flexible paid time off from work that can be used for any activities of the employee's choice. PTO accrues weekly. Paid Holidays Paid Holidays include New Year’s Day, Good Friday, Memorial Day, Independence Day, Labor Day, Thanksgiving Day, the day after Thanksgiving, Christmas Day, and a Floating Holiday (determined each year). FSA Accounts Set aside before-tax dollars to be used for medical and dependent care expenses not covered by insurance. Eligible after 30 days of employment. Education Assistance After 6 months of employment, you will be eligible for tuition assistance for courses pertaining to your current position or advancement opportunities. Uniform Allowance We’ve got your feet and your back covered! Receive vouchers for steel-toe shoes. Uniforms are provided to you. We even take care of laundering and alterations. Disability Short and Long Term Disability Coverage is available. We understand that sometimes life throws a curveball, and we want you to be well. Referral Bonuses Earn $1500 per referral! Know someone who would be a good fit for Trail King? If they are hired, you will receive your bonus after the new hire’sf first full year of employment. Trail King Industries is an equal opportunity employer. Contact Us! Trail King Industries is an Equal Opportunity Employer of Minorities/Women/Individuals with Disabilities/Protected Veterans and does not unlawfully discriminate under federal, state, or local laws. All qualified applicants will receive consideration for employment without regard to race, color religion, national origin, gender, sexual orientation, gender identity, age, physical or mental disability or protected veteran status. We are committed to working with and providing reasonable accommodations to individuals with physical and mental disabilities. If you need special assistance or accommodations while seeking employment, please e-mail hr@trailking.com with the nature of your request. Employment Opportunities Start your career at Trail King. Multiple locations are hiring TODAY! Take A Look Trail King Merch Get geared up with Trail King apparel and accessories Go Shop Workforce Recruitment Program Get the training and hands-on experience required for your career to hit the ground running. Learn More Apply Today See a full list of open positions at Trail King Industries, and apply online. Go Apply Our Company The mission and values that drive our success and yours. Learn More Get in Touch About Trail King Leading North American manufacturer of trailers for the construction, agriculture, transportation, waste & recycling, and specialized hauling industries. Newsletter Signup Success! You've been added to our email list. GO! QUICK LINKS Solutions Services Find A Rep Our Company Careers Contact Us Get Financing Dealer Portal CONTACT US 300 E Norway Ave Mitchell, SD ,57301 800-843-3324 sales@trailking.com FOLLOW US © 2023 Trail King Industries All Rights Reserved. Privacy Policy Terms of Use Chat with us, powered by LiveChat"
22,"Workforce Recruitment Program | Trail King Industries 800-843-3324 Solutions Agriculture Materials Hauling Open Deck Commercial Open Deck Construction Specialized Tagalong Services Parts Refurb & Service Warranty & Technical Assistance Paint Process Find A Rep Our Company Our Why Our History News & Events Brand Assets Official Trail King Merchandise Government Contracts Careers Workforce Recruitment Program Employment Opportunities Apply Now Contact Us Customer Survey Get Financing Contact Finance Dealer Portal Workforce Recruitment Receive training and reduce your education costs. Check out the resources below to learn more, or get started! Get Started! Our Workforce Recruitment Program is designed to prepare you for a rewarding career with Trail King. Through a scholarship program with Mitchell Technical Institute (MTI) and North Dakota State College of Science (NDSCS), in conjunction with a paid internship while you're going to school, you'll receive training and hands-on experience required for your career in manufacturing. Through this scholarship program, you'll save on your education costs. Trail King also offers a welding training program, taught in-house by our weld professionals. Submit your application by clicking the Apply Today button below. No experience? No problem. Trail King trains welders right on the plant floor! Watch below - a day in the life of a weld training program graduate. Trail King Industries is an Equal Opportunity Employer of Minorities/Women/Individuals with Disabilities/Protected Veterans and does not unlawfully discriminate under federal, state, or local laws. All qualified applicants will receive consideration for employment without regard to race, color religion, national origin, gender, sexual orientation, gender identity, age, physical or mental disability or protected veteran status. We are committed to working with and providing reasonable accommodations to individuals with physical and mental disabilities. If you need special assistance or accommodations while seeking employment, please e-mail hr@trailking.com with the nature of your request. Employment Opportunities Start your careet at Trail King. Multiple locations are hiring TODAY! Tell Me More Trail King Merch Get geared up with Trail King apparel and accessories. Go Shop Careers Opportunities are available. Join a winning team in multiple locations. Learn More Apply Today See a full list of open positions at Trail King Industries, and apply online. Go Apply Our Company The mission and values that drive our success and yours. Learn More Get in Touch About Trail King Leading North American manufacturer of trailers for the construction, agriculture, transportation, waste & recycling, and specialized hauling industries. Newsletter Signup Success! You've been added to our email list. GO! QUICK LINKS Solutions Services Find A Rep Our Company Careers Contact Us Get Financing Dealer Portal CONTACT US 300 E Norway Ave Mitchell, SD ,57301 800-843-3324 sales@trailking.com FOLLOW US © 2023 Trail King Industries All Rights Reserved. Privacy Policy Terms of Use Chat with us, powered by LiveChat"
23,"Workforce Recruitment Program | Trail King Industries 800-843-3324 Solutions Agriculture Materials Hauling Open Deck Commercial Open Deck Construction Specialized Tagalong Services Parts Refurb & Service Warranty & Technical Assistance Paint Process Find A Rep Our Company Our Why Our History News & Events Brand Assets Official Trail King Merchandise Government Contracts Careers Workforce Recruitment Program Employment Opportunities Apply Now Contact Us Customer Survey Get Financing Contact Finance Dealer Portal Employment Opportunities Building the future of Trail King. There’s a spot waiting for you. Explore careers below. Current Openings At Trail King, it takes the entire team, from intern to CEO, to be the leading manufacturer of a complete line of trailers. We are looking for driven individuals with a positive attitude from many trades and disciplines. Join the Trail King team to start building your success today! CAREER OPPORTUNITIES Engineering Our engineers share a passion to redefine what’s possible. To turn dreams into reality. To bring world-class innovation to market. Join us and you can design our next generation of trailers. Whether your engineering expertise is manufacturing, design or electrical, we have opportunities for you to learn, grow and contribute. Apply Now! Assembler You have an aptitude and passion for crafting the best. Join us and build the best trailers in the world. You will be involved in the first and final stages of ensuring the products meet customer expectations. And your opportunities to learn and grow will be numerous. This is where you’ll help create something amazing. Apply Now! Internships For your internship, you will be helping to build success. When you join trail King as an intern, you’ll be a real part of a team that’s working every day to meet and exceed goals. Our internships include Engineering, Business, Marketing & Information Technology. Learn More! Welding You have an eye for detail and are skilled at working with your hands. We are willing to train new welders with our welding training program (see video below) and offer many areas for growth. As part of the welding team, you will find your permanent bond with the team members that all work together to build the best trailers in the world. Apply Now! Trail King Industries is an Equal Opportunity Employer of Minorities/Women/Individuals with Disabilities/Protected Veterans and does not unlawfully discriminate under federal, state, or local laws. All qualified applicants will receive consideration for employment without regard to race, color religion, national origin, gender, sexual orientation, gender identity, age, physical or mental disability or protected veteran status. We are committed to working with and providing reasonable accommodations to individuals with physical and mental disabilities. If you need special assistance or accommodations while seeking employment, please e-mail hr@trailking.com with the nature of your request. Start your career in Engineering Sales Operations Safety Accounting Assembly at Trail King. Workforce Recruitment Program Get the training and hands-on experience required for your career to hit the ground running. Learn More Trail King Merch Get geared up with Trail King apparel and accessories. Go Shop Careers Opportunities are available. Join a winning team in multiple locations. Learn More Apply Today See a full list of open positions at Trail King Industries, and apply online. Go Apply Our Company The mission and values that drive our success and yours. Learn More Get in Touch About Trail King Leading North American manufacturer of trailers for the construction, agriculture, transportation, waste & recycling, and specialized hauling industries. Newsletter Signup Success! You've been added to our email list. GO! QUICK LINKS Solutions Services Find A Rep Our Company Careers Contact Us Get Financing Dealer Portal CONTACT US 300 E Norway Ave Mitchell, SD ,57301 800-843-3324 sales@trailking.com FOLLOW US © 2023 Trail King Industries All Rights Reserved. Privacy Policy Terms of Use Chat with us, powered by LiveChat"
24,"Contact Us | Trail King Industries 800-843-3324 Solutions Agriculture Materials Hauling Open Deck Commercial Open Deck Construction Specialized Tagalong Services Parts Refurb & Service Warranty & Technical Assistance Paint Process Find A Rep Our Company Our Why Our History News & Events Brand Assets Official Trail King Merchandise Government Contracts Careers Workforce Recruitment Program Employment Opportunities Apply Now Contact Us Customer Survey Get Financing Contact Finance Dealer Portal Contact Us We are here to help. Choose a department from the drop down to get started. Choose Department * HR Refurb/Service Finance Parts Warranty Marketing Government Customer Service First Name * Last Name * Company State * Email * Phone Message * Please include VIN # to assist in your request. How did you hear about us? Clickable Ad Website Call Industry Ad Referral Social Media Trade Show Walk-in Our Corporate Office 300 East Norway Ave., Mitchell, SD 57301 (toll free) 800-843-3324 Business Hours Monday - Friday: 8:00 am - 5:00 pm Sales Inquiries For any sales questions or comments, please contact your District Sales Manager. Use our map to locate. Find A Rep Our Manufacturing Locations 2200 South Ohlman St., Mitchell, SD 57301 2130 3rd Avenue NW, West Fargo, ND 58078 1200 Gehl Drive, Yankton, SD 57078 YouTube @TrailKingMan Monthly customer rig showcases, and product features. Looking to see a Trail King trailer in action? This is the place for you! Subscribe today! Watch Videos Facebook @TrailKingInd A little more variety in our posts here. Company news. Customer reposts. Videos. All things Trail King for customers, dealers, and our team. Follow Us Twitter @TrailKingInd Catch info on upcoming trade shows, local trailer action and success stories! Follow Us Instagram @TrailKingInd We re-follow and re-post customer photos! Our Instagram feed is ALL trailers and badass rigs. Follow Us LinkedIn @TrailKingInd A hub for our #TKteam! Here’s where we celebrate our employees, dealers, and customers! Follow Us Get in Touch About Trail King Leading North American manufacturer of trailers for the construction, agriculture, transportation, waste & recycling, and specialized hauling industries. Newsletter Signup Success! You've been added to our email list. GO! QUICK LINKS Solutions Services Find A Rep Our Company Careers Contact Us Get Financing Dealer Portal CONTACT US 300 E Norway Ave Mitchell, SD ,57301 800-843-3324 sales@trailking.com FOLLOW US © 2023 Trail King Industries All Rights Reserved. Privacy Policy Terms of Use Chat with us, powered by LiveChat"
