,Data
25,"Trail King Customer Survey | Trail King Industries 800-843-3324 Solutions Agriculture Materials Hauling Open Deck Commercial Open Deck Construction Specialized Tagalong Services Parts Refurb & Service Warranty & Technical Assistance Paint Process Find A Rep Our Company Our Why Our History News & Events Brand Assets Official Trail King Merchandise Government Contracts Careers Workforce Recruitment Program Employment Opportunities Apply Now Contact Us Customer Survey Get Financing Contact Finance Dealer Portal Trail King Customer Survey Your participation in this survey is greatly appreciated. Your feedback is invaluable in helping us continue to improve our products and services and to BUILD SUCCESS for all of our customers...especially you. Thank you. Customer Satisfaction Survey Name Email * Consent for storing submitted data * Yes, I give permission to store and process my data Model: * Which Trail King model do you have? Ex: HDG, SA, tagalong Last eight digits of serial # (VIN): * Last 8 of VIN What factors influenced your decision to purchase a Trail King trailer? (check all that apply) * Trailer Features Delivery Time Price Advertising Prefer Trail King brand Recommended to you Other (please specify) What was the primary source for information and pricing prior to your purchase of your Trail King trailer? (check one) TK Dealer TK Salesperson TK Website TK Sales Literature TK Advertising Other How satisfied were you that the trailer information and pricing was delivered to you in a timely way? (Check one.) Very Satisfied (5) 4 Satisfied (3) 2 Dissatisfied (1) How satisfied were you that the trailer information and pricing was presented to you in a knowledgeable and professional manner? (Check one) Very Satisfied (5) 4 Satisfied (3) 2 Dissatisfied (1) How satisfied were you with the estimated delivery timeframe you were given? (Check one) Very Satisfied (5) 4 Satisfied (3) 2 Dissatisifed (1) Prior to the start of your trailer’s actual build time, how satisfied were you with your contact with TK sales support personnel? (Check one) Very Satisfied (5) 4 Satisfied (3) 2 Dissatisfied (1) Was your trailer delivered to you on time? (Check one.) Yes No If you answered “No” above, how late was your trailer delivery? How satisfied were you with the explanation and/or demonstration you received concerning the operation of your trailer? (Check one) Very Satisfied (5) 4 Satisfied (3) 2 Dissatisfied (1) Was your trailer built according to your submitted specifications? (Check one.) Yes No If you answered “No” above, please explain? When delivered, was your trailer complete and fully functional? (Check one.) Yes No If you answered “No” above, please explain? When your trailer was delivered, how satisfied were you with its visual appearance? (Check one) Very Satisfied (5) 4 Satisfied (3) 2 Dissatisfied (1) If there were problems with your trailer when you received it, how satisfied were you with the manner in which Trail King addressed these problems? (Check one) Very Satisfied (5) 4 Satisified (3) 2 Dissatisfied (1) How satisfied are you with the Operator/Owner’s Manual for your trailer? (Check one) Very Satisfied (5) 4 Satisfied (3) 2 Dissatisified (1) Since purchasing your Trail King trailer, have you contacted Trail King for parts, service, or answers to any general “Help” questions? Yes No If you answered “Yes” to the question above, how satisfied were you with how your request was handled? (Check one) Very Satisfied (5) 4 Satisfied (3) 2 Dissatisfied (1) Additional Comments * Please enter any other information you feel important. Get in Touch About Trail King Leading North American manufacturer of trailers for the construction, agriculture, transportation, waste & recycling, and specialized hauling industries. Newsletter Signup Success! You've been added to our email list. GO! QUICK LINKS Solutions Services Find A Rep Our Company Careers Contact Us Get Financing Dealer Portal CONTACT US 300 E Norway Ave Mitchell, SD ,57301 800-843-3324 sales@trailking.com FOLLOW US © 2023 Trail King Industries All Rights Reserved. Privacy Policy Terms of Use Chat with us, powered by LiveChat"
26,"Finance | Trail King Industries 800-843-3324 Solutions Agriculture Materials Hauling Open Deck Commercial Open Deck Construction Specialized Tagalong Services Parts Refurb & Service Warranty & Technical Assistance Paint Process Find A Rep Our Company Our Why Our History News & Events Brand Assets Official Trail King Merchandise Government Contracts Careers Workforce Recruitment Program Employment Opportunities Apply Now Contact Us Customer Survey Get Financing Contact Finance Dealer Portal Finance 100% equipment financing competitive rates. Download the Trail King Credit Application below. Get Started FINANCING SOLUTIONS TO MATCH YOUR BUSINESS NEEDS Drawing from our proven industry expertise, TRAIL KING FINANCE offers a full suite of financing structures, including loans, finance leases, and TRAC leases, making it easier than ever to own a Trail King trailer. We also finance trucks and construction or agricultural equipment for our customers. 877-371-0055 kkarcher@trailking.com (Fax) 415-524-4851 866-529-9874 kbruer@trailking.com (M) 612-554-1602 800-963-6619 pwalsh@trailking.com (Fax) 303-841-0722 800-762-5557 rpiotrowski@trailking.com (M) 630-702-0082 800-518-0496 jlittle@trailking.com (M) 303-594-8324 Features 100% equipment financing on most deals. Approval of transactions up to $500,000 with just a completed credit application. Credit decisions usually within 24 hours. Approval on a wide range of credits, from owner-operators to large companies. Details Financing terms from 24 to 84 months. Competitive rates comparable with national leasing and financing companies. No upper credit limit! Minimum financing amount is $10,000. Criteria Completed credit application with satisfactory bank relationship and credit history. D&B, PayNet, or personal credit rating. Start-up companies can be considered with additional information. DOWNLOAD the Credit Application Check out the financing criteria and get started by downloading our Trail King credit application. Download Now! SPEAK with a Trail King Expert Not sure which kind of financing is best for your company? With so many factors to consider, we are here to help you through the process. Contact A Rep! Parts Not sure which kind of financing is best for your company? With so many factors to consider, we are here to help you through the process. Refurb Enhance your trailer’s appearance, extend its useful life, and increase its future resale value. Get in Touch About Trail King Leading North American manufacturer of trailers for the construction, agriculture, transportation, waste & recycling, and specialized hauling industries. Newsletter Signup Success! You've been added to our email list. GO! QUICK LINKS Solutions Services Find A Rep Our Company Careers Contact Us Get Financing Dealer Portal CONTACT US 300 E Norway Ave Mitchell, SD ,57301 800-843-3324 sales@trailking.com FOLLOW US © 2023 Trail King Industries All Rights Reserved. Privacy Policy Terms of Use Chat with us, powered by LiveChat"
27,"Contact Finance | Trail King Industries 800-843-3324 Solutions Agriculture Materials Hauling Open Deck Commercial Open Deck Construction Specialized Tagalong Services Parts Refurb & Service Warranty & Technical Assistance Paint Process Find A Rep Our Company Our Why Our History News & Events Brand Assets Official Trail King Merchandise Government Contracts Careers Workforce Recruitment Program Employment Opportunities Apply Now Contact Us Customer Survey Get Financing Contact Finance Dealer Portal Contact Finance First Name * Last Name * Company State * Email * Phone VIN # Model # Model Year How did you hear about us? Call Clickable Ad Industry Ad Referral Social Media Trade Show Walk-in Website Our Corporate Office 300 East Norway Ave., Mitchell, SD 57301 (toll free) 800-843-3324 Business Hours Monday - Friday: 8:00 am - 5:00 pm Sales Inquiries For any sales questions or comments, please contact your District Sales Manager. Use our map to locate. Find A Rep Our Manufacturing Locations 2200 South Ohlman St., Mitchell, SD 57301 2130 3rd Avenue NW, West Fargo, ND 58078 1200 Gehl Drive, Yankton, SD 57078 YouTube @TrailKingMan Monthly customer rig showcases, and product features. Looking to see a Trail King trailer in action? This is the place for you! Subscribe today! Watch Videos Facebook @TrailKingInd A little more variety in our posts here. Company news. Customer reposts. Videos. All things Trail King for customers, dealers, and our team. Follow Us Twitter @TrailKingInd Catch info on upcoming trade shows, local trailer action and success stories! Follow Us Instagram @TrailKingInd We re-follow and re-post customer photos! Our Instagram feed is ALL trailers and badass rigs. Follow Us LinkedIn @TrailKingInd A hub for our #TKteam! Here’s where we celebrate our employees, dealers, and customers! Follow Us Get in Touch About Trail King Leading North American manufacturer of trailers for the construction, agriculture, transportation, waste & recycling, and specialized hauling industries. Newsletter Signup Success! You've been added to our email list. GO! QUICK LINKS Solutions Services Find A Rep Our Company Careers Contact Us Get Financing Dealer Portal CONTACT US 300 E Norway Ave Mitchell, SD ,57301 800-843-3324 sales@trailking.com FOLLOW US © 2023 Trail King Industries All Rights Reserved. Privacy Policy Terms of Use Chat with us, powered by LiveChat"
28,"Dealer Portal | Trail King Industries 800-843-3324 Solutions Agriculture Materials Hauling Open Deck Commercial Open Deck Construction Specialized Tagalong Services Parts Refurb & Service Warranty & Technical Assistance Paint Process Find A Rep Our Company Our Why Our History News & Events Brand Assets Official Trail King Merchandise Government Contracts Careers Workforce Recruitment Program Employment Opportunities Apply Now Contact Us Customer Survey Get Financing Contact Finance Dealer Portal Dealer Portal Welcome dealers! Find your resources below! Sign up for our newsletter! Click Sign up! Sign Up! Proquote Login Inventory Login Parts Parts Promos Go Shop YOUR TEAM + OUR TEAM = EXCELLENCE We are proud to have a network of incredible dealers included in our Trail King family. They are an extension of our team and a valuable resource for our customers. Trail King dealers are known for their commitment to excellence in parts and service, as well as product expertise and on-hand inventory. Each and every dealer is dedicated to working with our customers to find the perfect solution for their hauling needs. Together we are building success. In order to sell and service Trail King’s product lines, we need dealers that are knowledgeable and trained. Our goal is to provide all the necessary tools to ensure success. Authorized dealers – click the links above to be directed to the appropriate resource. You will need a login to access these resources. If you are interested in becoming a Trail King dealer, please speak with a District Sales Manager in your area. Click “Find a Rep!” above. YouTube @TrailKingMan Monthly customer rig showcases, and product features. Looking to see a Trail King trailer in action? This is the place for you! Subscribe today! Watch Videos Facebook @TrailKingInd A little more variety in our posts here. Company news. Customer reposts. Videos. All things Trail King for customers, dealers, and our team. Follow Us Twitter @TrailKingInd Catch info on upcoming trade shows, local trailer action and success stories! Follow Us Instagram @TrailKingInd We re-follow and re-post customer photos! Our Instagram feed is ALL trailers and badass rigs. Follow Us LinkedIn @TrailKingInd A hub for our #TKteam! Here’s where we celebrate our employees, dealers, and customers! Follow Us Get in Touch About Trail King Leading North American manufacturer of trailers for the construction, agriculture, transportation, waste & recycling, and specialized hauling industries. Newsletter Signup Success! You've been added to our email list. GO! QUICK LINKS Solutions Services Find A Rep Our Company Careers Contact Us Get Financing Dealer Portal CONTACT US 300 E Norway Ave Mitchell, SD ,57301 800-843-3324 sales@trailking.com FOLLOW US © 2023 Trail King Industries All Rights Reserved. Privacy Policy Terms of Use Chat with us, powered by LiveChat"
29,"TKCHT Grain Hopper | Trail King Industries 800-843-3324 Solutions Agriculture Materials Hauling Open Deck Commercial Open Deck Construction Specialized Tagalong Services Parts Refurb & Service Warranty & Technical Assistance Paint Process Find A Rep Our Company Our Why Our History News & Events Brand Assets Official Trail King Merchandise Government Contracts Careers Workforce Recruitment Program Employment Opportunities Apply Now Contact Us Customer Survey Get Financing Contact Finance Dealer Portal TKCHT Grain Hopper 0 1 2 3 TKCHT Grain Hopper Trail King’s durable Grain Hopper trailer has a composite smooth panel construction. It features an aero-dynamic design for easy pulling and maximum load hauling capabilities - from our 41-51' models. The low maintenance composite design and one-piece molded lower hoppers provide an incredibly fast clean-out that is lighter than ever, allowing you to haul more bushels. Find Your Specialized Solution Call our toll-free number 800-843-3324 Request A Quote Financing Parts Photos Videos Specifications Literature STANDARD EQUIPMENT CHT 4166-96 CHT 4172-02 CHT 5172-96 Trailer Length 41' 41' 51' Overall Width 96"" 102"" 96"" Side Height 66"" 72"" 72"" Weight 8,100 lb. 8,263 lb. 11,080 lb. Cubic Foot Volume 1,380 1,631 1,602 Bushel Capacity (Level) 1,109 1,310 1,287 Bushel Capacity (Heaped) 1,194 1,401 1,382 Hopper Clearance 22½"" 22½"" 22½"" Number of Hopper Doors 2 2 2 King Pin Setting 18"" 18"" 24"" The literature and image assets in this tab are digital assets, best for viewing online. To request print literature or media, please contact your District Sales Manager. PRODUCT LITERATURE Download Information Get in Touch About Trail King Leading North American manufacturer of trailers for the construction, agriculture, transportation, waste & recycling, and specialized hauling industries. Newsletter Signup Success! You've been added to our email list. GO! QUICK LINKS Solutions Services Find A Rep Our Company Careers Contact Us Get Financing Dealer Portal CONTACT US 300 E Norway Ave Mitchell, SD ,57301 800-843-3324 sales@trailking.com FOLLOW US © 2023 Trail King Industries All Rights Reserved. Privacy Policy Terms of Use Chat with us, powered by LiveChat"
30,"Finance | Trail King Industries 800-843-3324 Solutions Agriculture Materials Hauling Open Deck Commercial Open Deck Construction Specialized Tagalong Services Parts Refurb & Service Warranty & Technical Assistance Paint Process Find A Rep Our Company Our Why Our History News & Events Brand Assets Official Trail King Merchandise Government Contracts Careers Workforce Recruitment Program Employment Opportunities Apply Now Contact Us Customer Survey Get Financing Contact Finance Dealer Portal Finance 100% equipment financing competitive rates. Download the Trail King Credit Application below. Get Started FINANCING SOLUTIONS TO MATCH YOUR BUSINESS NEEDS Drawing from our proven industry expertise, TRAIL KING FINANCE offers a full suite of financing structures, including loans, finance leases, and TRAC leases, making it easier than ever to own a Trail King trailer. We also finance trucks and construction or agricultural equipment for our customers. 877-371-0055 kkarcher@trailking.com (Fax) 415-524-4851 866-529-9874 kbruer@trailking.com (M) 612-554-1602 800-963-6619 pwalsh@trailking.com (Fax) 303-841-0722 800-762-5557 rpiotrowski@trailking.com (M) 630-702-0082 800-518-0496 jlittle@trailking.com (M) 303-594-8324 Features 100% equipment financing on most deals. Approval of transactions up to $500,000 with just a completed credit application. Credit decisions usually within 24 hours. Approval on a wide range of credits, from owner-operators to large companies. Details Financing terms from 24 to 84 months. Competitive rates comparable with national leasing and financing companies. No upper credit limit! Minimum financing amount is $10,000. Criteria Completed credit application with satisfactory bank relationship and credit history. D&B, PayNet, or personal credit rating. Start-up companies can be considered with additional information. DOWNLOAD the Credit Application Check out the financing criteria and get started by downloading our Trail King credit application. Download Now! SPEAK with a Trail King Expert Not sure which kind of financing is best for your company? With so many factors to consider, we are here to help you through the process. Contact A Rep! Parts Not sure which kind of financing is best for your company? With so many factors to consider, we are here to help you through the process. Refurb Enhance your trailer’s appearance, extend its useful life, and increase its future resale value. Get in Touch About Trail King Leading North American manufacturer of trailers for the construction, agriculture, transportation, waste & recycling, and specialized hauling industries. Newsletter Signup Success! You've been added to our email list. GO! QUICK LINKS Solutions Services Find A Rep Our Company Careers Contact Us Get Financing Dealer Portal CONTACT US 300 E Norway Ave Mitchell, SD ,57301 800-843-3324 sales@trailking.com FOLLOW US © 2023 Trail King Industries All Rights Reserved. Privacy Policy Terms of Use Chat with us, powered by LiveChat"
