,Data
0,windows and doors window and door manufacturer marvin skip to content search support center find a dealer technical specifications careers products windows by collection marvin signature coastline modern ultimate marvin elevate marvin essential by type awning bay and bow casement corner double hung picture picture specialty shapes single hung sliding storefront all windows doors by collection marvin signature coastline modern ultimate marvin elevate marvin essential by type bi-fold commercial entry garage interior lift and slide multi-slide pivot sliding swinging all doors skylights awaken marvin skylight spaces solutions coastal contemporary historic replacement well-being inspiration product design options photo gallery project gallery blog why marvin our story energy efficiency in the news for pros support center find a dealer technical specifications careers search windows and doors built for how you liveview windowsview doors at marvin were driven to imagine and create better ways of living as people spend more time indoors we recognize that our work isnt just about building better windows and doors–its about opening new possibilities for how people live work and play inside a marvin space since the day we opened our doors in 1912 as a family-owned and -operated cedar and lumber company weve looked for ways to help people live happier and healthier lives learn moreexpand your possibilities with the elevate bi-fold door designed to bring air light and expansive views to life our newest innovation is accessible for new build replacement or remodel projects it’s not a door as we once knew it it’s everything a door should belearn more our collections marvin windows and doors are inspired by how people live explore our three product collections organized by degree of design detail flexibility and customization possibilities learn moresignature collection® featuring the ultimate modern and coastline product lines this collection offers our broadest range of product types sizes configurations and design optionslearn more learn moreelevate collection® an ideal blend of remarkable design and superior strenh elevate products strike a perfect balance between enduring style and unmatched performancelearn more learn moreessential collection™ essential products resist fading chalking peeling cracking and are eight times stronger than vinyl simpler features and options streamline the ordering processlearn more view all windowsview all windows windows by type awning picture bay and bow single hung casement sliding corner specialty shapes double hung storefront view all doorsview all doors doors by type bi-fold lift and slide commercial multi-slide entry pivot garage sliding interior swinging learn moredesigned to mix made to match bold timeless alluring gunmetal by marvin is an exclusive hue designed to transcend styles and fit perfectly into your world now available in elevate and essential collectionslearn more learn morereplacement windows and doors whether you’re looking to reinvigorate your home design replace damaged or outdated windows and doors or save money through energy efficiency marvin is with you every step of the way no matter the complexity of your replacement window and door projectlearn more new products at marvin learn moreelevate bi-fold door designed to bring light air and expansive views to life it’s an accessible statement for new build remodel or replacement projectslearn more learn moreskycove® imagine an inviting space flooded in light where you can enjoy a cup of coffee with a close friend or escape into a good booklearn more learn moreawaken® skylight research has shown that natural light improves people’s sense of well-being awaken is the first and only skylight to offer supplemental tunable lightinglearn more learn moreliving well with light air and views the spaces we occupy can have a positive effect on our well-being spending time in spaces flooded in natural light rejuvenated with an abundant supply of fresh air and generously furnished with views of the outdoors can be just as important to our health as exercise and a good dietlearn more marvin experts are experienced in working with architects builders and homeowners to ensure your vision becomes a realityfind a dealer products our collections all windows all doors skylights spaces solutions coastal contemporary historic design replacement well-being design & inspiration product design options photo gallery project gallery blog why marvin our story careers energy efficiency in the news international trustile marvin replacement support support center care and maintenance glossary of terms owners manuals parts manuals warranty professionals aia courses architectural resources drawing and 3d models energy data technical specifications tours and training find a dealer request literature email sign up privacy statement terms of use california users/privacy
1,coastline windows and doors marvin marvin signature® collection coastline designed for the best coastal views engineered for the worst coastal weather part of the marvin signature collection coastline is a versatile product portfolio that combines advanced impact performance with inspiring design flexibility the extruded all aluminum frames and impact-resistant glass are engineered to withstand high winds and flying debris generated by severe storms and hurricanes with the ability to achieve oversized one-of-a-kind designs even the most ambitious visions for coastal homes are possible designed and manufactured in florida coastline products are available in select southeast coastal regions unsurpassed protection limitless possibilities designed for coastal weather coastline windows and doors are high velocity hurricane zone hvhz approved engineered to sustain high winds and flying debris generated by a tropical storm or hurricane made with extruded aluminum and impact-resistant glass coastline products meet stringent miami-dade county and state of florida code requirements premium aesthetics coastline products feature a range of product types sizes configurations and design options narrow sightlines provide a clean shutter-free well-maintained aesthetic to your home made with industrial-grade finishes to withstand corrosion and resist fading so your products retain their color gloss and beauty for years to come dramatically large sizes marvin coastline offers expansive views with big glass and dramatically large sizes to bring your most ambitious projects to life make a statement with a decorative large-scale entry door or show off stunning views with vast expanses of glass on the interior—all customized to give you the freedom to design boldly coastline windows awning awning window sashes are hinged at the top of the frame and swing out at the bottom they are ideal for bringing in a breeze even in damp weatherlearn more casement provide vast unobstructed expanses of glass while providing a clean feel and narrow sightlines perfect for hard to reach areas like over a sink or counterlearn more glider also known as a horizontal roller window a glider features an operating sash equipped with durable brass tandem rollers for easy operationlearn more single hung a traditional design that instills a sense of warmth the single hung window features a stationary top window and a well-balanced bottom sashlearn more picture specialty shapes these windows are available in hundreds of geometric shapes providing design freedom to create unique architectural statementslearn more picture the glass is glazed directly into the frame eliminating the need for a sash which results in narrow sightlines more light and larger unobstructed viewslearn more storefront perfect for any home or business to create massive expanses of glass capture scenic views and blur the lines between indoors and outlearn more coastline doors bi-fold the bi-fold door is a great way to take advantage of the inspiring vistas and abundance of brilliant sunshine that life near the coast has to offerlearn more entry create a statement piece with options such as lead glass a wood grain finish custom color or a one-of-a-kind ornamental wrought iron grill patternlearn more garage a coastline garage door will boost curb appeal and is a perfect complement to any modern contemporary or transitional stylelearn more multi-slide two doors can be designed to meet in the center or at a 90-degree corner angle and the panels can be configured to tuck into a wall pocketlearn more swinging french inswing and outswing coastline french doors offer custom divided lite patterns and finish options which allow for a unique and traditional design aestheticlearn more pivot when open a pivot door panel appears to hover in midair you can choose an all-glass panel or configure a pivot door to match any style or decorlearn more download nowget the coastline product catalogs get detailed information on marvin coastline including types of windows and doors color and finish options sizing hardware and other key detailsdownload now explore other marvin impact rated products learn moreultimate impact products ultimate wood and wood-clad windows and doors are available in our most extensive selection of shapes styles sizes and optionslearn more learn moreelevate impact products a thoughtfully designed collection that balances a beautiful wood interior with a strong fiberglass exteriorlearn more get inspiredsee how windows and doors can transform a home and spark new design ideasvisit the gallery
2,modern windows and doors marvin photograph by spacecraftingmarvin signature® collection modern the spirit of modern design lives on as part of the marvin signature® collection modern brings exceptional design performance and customer experience together—creating a product line that meets the exacting principles and standards of true modern architecture an innovative high-density fiberglass material leading thermal performance consistent narrow sightlines and a modular system all add up to the modern product line—a seamless approach to modern design watch the video see how the modern line is stunning in both its design and engineering letting you take the best of modern design and create a purely modern aesthetic at an even larger scale download nowget the catalog learn more about how the modern product line honors the principle of modern architecture download now modern: innovation inspired by you innovation inspired by you our high-density fiberglass material and proprietary frame design provide unparalleled thermal performance and durability the integrated mull channel a structural cavity within the frame allows you to add up to 1⁄2” of mull reinforcement without compromising sightlines frame recesses accept a drywall return allowing for an easier wall integration and consistent frame reveal a proprietary frame design helps keep interior temperatures comfortable b the frame’s integrated mull channel preserves sightlines and supports structural performance c built-in drywall return for easy wall integration modern aesthetics every modern product is designed to meet the exacting principles and standards of true modern architecture with every critical detail considered low-gloss aluminum interiors—along with black spacer bars and black sealant—minimize visual distractions on the frame and enhance the flow of natural light internal covers completely disguise fasteners and concealing rubber gaskets to help products maintain clean crisp edges clean lines and simplicity in a fast-paced world the clean lines of modern architecture offer respite with its emphasis on simplicity and large expanses of glass modern design can foster deeper connections with the outdoors bringing a greater sense of well-being to your everyday life modular system our modern products are designed to work together visually as a modular system consistent product profiles allow you to design with ease and confidence and maintain narrow sightlines that are less than 3 even on mulled units a variety of mulling options are available to achieve large assemblies with certified performance leading thermal performance we believe modern windows and doors should perform at scale so we developed a new frame that’s strong durable and thermally efficient from exterior to interior the frame is formed from a solid piece of high-density fiberglass and requires no additional material to aid in its thermal performance delivery and installation ease modern was designed with intention from product to process optimal packaging mitigates delivery damage and product weight information is communicated from order to install to help plan for safe handling contained inside every shipment is our new job box which includes all hardware necessary items for installation and documentation in one convenient place all products are designed with prefabricated and pre-configured components to enable an intuitive installation windows in the modern collection modern awningmodern awning push outmodern casementmodern casement push outmodern direct glaze doors in the modern collection modern multi-slide doormodern swinging door get inspiredsee how windows and doors can transform a home and spark new design ideasvisit the gallery also in the marvin signature collection learn more marvin ultimate ultimate doors feature wood interiors with the option of either wood or aluminum-clad exteriorslearn more learn moremarvin coastline coastline window frames and sashes are made with durable and low-maintenance extruded aluminumlearn more explore other collections learn moremarvin elevate® collection elevate products strike a perfect balance between enduring style and unmatched performance the warm wood interiors can be factory finished in clear coat painted white or designer black or choose bare pine to finish as you desire to match your interiors the fiberglass exterior provides strenh durability and high-performing thermal properties that excel in harsh climateslearn more learn more marvin essential™ collection the marvin essential collection has clean lines powerful performance and streamlined options making it easier to achieve design and quality its strong durable fiberglass exteriors and interiors are striking and virtually maintenance freelearn more
3,custom windows and doors signature ultimate windows and doors marvin marvin signature® collection ultimate create more of what you can imagine made for those who care about every detail and simply won’t compromise on their vision the ultimate product line offers beautiful design craftsman-quality construction and a vast selection of shapes styles sizes and options with extensive customization opportunities and versatility across architectural styles ultimate windows and doors can be used in a wide range of projects including traditional contemporary transitional historic craftsman or whatever style inspires you download nowget the ultimate catalog get detailed information on the ultimate product line including types of windows and doors color and finish options sizing hardware and other key detailsdownload now signature ultimate: redefining the standard design possibilities the beauty of signature ultimate is found in every thoughtful detail that when combined can completely transform how a room feels its extensive selection of shapes styles sizes and options means more flexibility to meet any design challenge and if you can’t find what you’re looking for we can help you make nearly anything you can imagine extraordinary innovations you’ll feel signature ultimate quality in every touch it’s in simple and smart breakthroughs like lift lock hardware which allows for easy access to open and lock a window it’s in our lock status sensor: a home automation solution that gives you peace of mind because it indicates if a window or door is closed and locked or if it’s unlocked these are just a few examples of our many industry-leading innovations unmatched craftsmanship signature ultimate windows and doors are available in a range of wood species and a variety of stains and paint options we sand condition stain and oven-cure each individual piece of wood providing a rich interior finish windows in the signature ultimate collection ultimate awningultimate awning narrow frameultimate awning push outultimate awning push out narrow frameultimate bayultimate bow windowsultimate casementultimate casement inswingultimate casement narrow frameultimate casement push outultimate casement push out narrow frameultimate cornerultimate corner narrow frameultimate double hung g2ultimate double hung insert g2ultimate french casementultimate french casement push outultimate gliderultimate pictureultimate picture narrow frameultimate single hung g2ultimate specialty shapesultimate venting pictureultimate wood double hungultimate wood double hung magnumultimate wood single hung doors in the signature ultimate collection ultimate bi-fold doorultimate commercial doorultimate lift and slide doorultimate multi-slide doorultimate sliding french doorultimate sliding patio doorultimate swinging arch top french doorultimate swinging narrow profile doorultimate wood swinging french doorultimate swinging french door g2 get inspiredsee how windows and doors can transform a home and spark new design ideasvisit the gallery also in the marvin signature® collection learn moremarvin modern modern windows are built with a fiberglass exterior and a low-gloss aluminum interiorlearn more learn moremarvin coastline coastline window frames and sashes are made with durable and low-maintenance extruded aluminumlearn more explore other collections learn moremarvin elevate® collection elevate products strike a perfect balance between enduring style and unmatched performance the warm wood interiors can be factory finished in clear coat painted white or designer black or choose bare pine to finish as you desire to match your interiors the fiberglass exterior provides strenh durability and high-performing thermal properties that excel in harsh climateslearn more learn moremarvin essential™ collection the marvin essential collection has clean lines powerful performance and streamlined options making it easier to achieve design and quality its strong durable fiberglass exteriors and interiors are striking and virtually maintenance freelearn more marvin experts are experienced in working with architects builders and homeowners to ensure your vision becomes a realityfind a dealer
4,trustile interior and entry doors marvin trustile interior and entry doors as a marvin brand trustile offers a variety of interior and entry doors all made-to-order get started by finding a trustile dealer near youvisit websitewhere to buy why trustile overview design leadership quality customer service products where to buy premium brands in 1995 trustile set out to create the best interior doors in the industry by using only the highest quality materials and providing the most flexible design opportunities in 2015 trustile was acquired by marvin an industry-leading manufacturer of high-quality windows and exterior doors like marvin trustile has been transforming the industry by artfully joining modern technology with traditional craftsmanship design leadership at trustile design drives our every decision we believe that our customers should not be limited to choosing their doors from a picture in a catalog that’s why we’ve developed state-of-the-art tools to help you design a door to your exact specifications our goal is to make it easy for you to build doors that fulfill your own unique design vision commitment to quality experience how the careful attention to every detail and the highest level of architectural accuracy results in truly exceptional spaces you can see and feel how the beautiful aesthetic of our true stile and rail construction can transform a room and because trustile doors are built with uncompromising precision they deliver many years of worry-free performance customer service our reputation depends on our customers’ experience that’s why our helpful and knowledgeable team works hard every day to deliver more design options the highest quality doors and the fastest lead times in the industry from ordering to installation it’s our mission to provide a customer experience that will exceed your expectations customizable door solutionstrustile products learn more the exceptional entry door trustile entry doors extend the design leadership we pioneered with interior doors to the front entry of the home we are pleased to bring you more choices a higher quality product and a more inspired easier journey to selecting the ideal entry for your home now you can make a statement throughout your whole homelearn more featured interior doors trustile offers an extensive selection of door types sizes styles and options each made to inspire truly exceptional spaces and bring any design vision to life if you can dream it we can build it learn morepanel doors available in both paint-grade mdf and stain-grade wood trustile panel doors offer near-limitless combinations of stiles rails panels and sticking profiles for the perfect solution to any architectural stylelearn more learn moremodern doors creating a modern aesthetic requires exacting attention to every architectural detail our tru&modern collection of modern doors will help you capture your exact design vision learn more learn moreglass doors every door opening is an opportunity to make a design statement transform your space with a trustile mirrored door a door with on opaque panel or an elegant arched glass doorlearn more learn morespecialty doors whether it’s a louvered plank barn or fire-rated door trustile’s innovative manufacturing process allows us to customize doors and transom windows to the highest levels of architectural precisionlearn more get inspiredphoto gallery visit our gallery of inspirational photos featuring our wide range of doors and explore the possibilitiesget inspired find your styleauthentic designs authentic designs® by trustile helps you select the right door for your home’s unique architectural stylefind your style
5,marvin skylight marvin marvin products skylights marvin skylight marvin skylight the marvin skylight available in select markets delivers expansive views of the outside world and allows you to incorporate the benefits of natural light into your home with its unique design-forward sizes narrow sightlines and uncluttered aesthetic the marvin skylight will introduce a beautiful light-filled architectural element into any space bring your skylight vision to life find a dealer interiorexteriorfeatures of the marvin skylight sleek design durable and low-maintenance fiberglass composite frame narrow sightlines provide more visible daylight compared to current offerings from other manufacturers flush glazing sheds debris and prevents pooling the same unit can be installed on either a curb or directly to the roof deck non-venting third party shades can be added maximum sizes up to 48” x 90” learn morewell-being a greater sense of well-being starts with the spaces where we spend the most timelearn more learn morematerials the durable and low-maintenance fiberglass frame will stand up to the harshest elementslearn more learn moreenergy efficiency options that help achieve long-term performance and cost savings in any climatelearn more design options exterior finish exterior fiberglass finishthe marvin skylight is protected with industrial-grade finishes that withstand corrosion and resist fading even after many years of direct exposure to the intense uv rays generated by the sunselected: interior finish interior fiberglass finishthe high-quality interior finish provides years of low-maintenance protection and the stone white color delivers a clean inconspicuous aestheticselected: mounting options each skylight unit is shipped with the flashing and hardware necessary for installation on a curb or directly to the decking this minimizes ordering mistakes which can cost money and cause project delays glass marvin skylights are equipped with dual layers of glazing for your protection the exterior glass outboard is tempered which increases its strenh and ability to withstand impacts the indoor layer inboard is laminated which means the glass will hold together in the event that a severe impact is encountered the glass is also treated in low e3 coatings these microscopically thin essentially invisible coatings on the glass surface help manage the amount of heat radiation that passes through a window pane or reflected away from it reducing a home’s dependence on heat and air conditioning complementary productssignatureawaken® skylight windowssignaturemodern multi-slide doorsignaturemodern casement technical specificationsfor the pros find technical documents for this product including installation instructions sizes and elevations 3d drawings architectural detail manuals and moretechnical specifications
