,Data
37,coastline garage door marvin marvin products window and door collections signature collection marvin signature® coastline coastline garage door exterior view exterior view coastline garage door the coastline garage door is a perfect complement to any contemporary style showcase the contents of your garage with clear glass or obscure the view while preserving the natural light with tinting or a decorative glass coating made with durable and low-maintenance extruded aluminum and impact-resistant glass available in widths over 18 and heights over 14 with a max area of 229 square feet meets the most stringent hurricane impact code requirements in north america single lite section widths up to 12 wide; multi-lite section widths over 18 wide 2 or 3 tracks with low standard high and vertical lift options find marvin products in your area and request a price quote connect with a dealer near you to get started find a dealer why youll love it protection from coastal weather engineered to sustain high winds and flying debris generated by a tropical storm or hurricane premium aesthetics narrow sightlines provide a clean shutter-free well-maintained aesthetic to your home dramatically large sizes offers expansive views with big glass and dramatically large sizes to bring your most ambitious projects to life high-quality materials made with extruded aluminum and impact-resistant glass design flexibility features a range of product types sizes configurations and design options additional features: ten colors and wood grain finishes; custom colors also available made with finishes that withstand corrosion and resist fading so your products retain their color gloss and beauty for years to come high velocity hurricane zone hvhz approved meets stringent miami-dade county and state of florida code requirements residential side or ceiling mount and commercial side mount openers available 3 panel thickness solid panels available custom colors available stainless steel hardware glass options include 5/16 laminated pvb 7/16 laminated sgp 11/16 insulated pvb and white interlayer watch the video a coastline garage door will boost curb appeal and is a perfect complement to any modern contemporary or transitional style design options exterior finish exterior optionshigh-quality windows and doors deserve a dependable low-maintenance interior and exterior finish that will resist fading peeling and chalking even under the most extreme coastal conditions our palette includes five wood grain finishes that will deliver a natural warmth and beauty to your favorite spaces we also offer custom color options to meet your project’s requirements no matter how unique your coastal window and door design vision may beselected: custom colors: see your marvin coastline dealer for details and special pricing interior and exterior finish must be the same american architectural manufacturers association aama 2605 certification interior finish interior optionshigh-quality windows and doors deserve a dependable low-maintenance interior and exterior finish that will resist fading peeling and chalking even under the most extreme coastal conditions our palette includes five wood grain finishes that will deliver a natural warmth and beauty to your favorite spaces we also offer custom color options to meet your project’s requirements no matter how unique your coastal window and door design vision may beselected: custom colors: see your marvin coastline dealer for details and special pricing interior and exterior finish must be the same american architectural manufacturers association aama 2605 certification glass decorative glasscoastline windows and doors are built with impact resistant glass that is engineered to stand up to the punishing winds and flying debris generated by tropical storms and hurricanes and you don’t have to sacrifice design flexibility for strenh there are a wide variety of decorative patterns available to meet the unique needs of each project including rain glue-chip and obscure we offer several interlayer laminated tinting options that will increase privacy reduce solar heat gain and meet the requirements of the sea turtle conservation codes coastline products can be fitted with insulated glass to help conserve energy we can also provide specialty impact resistant glass solutions for specific project needs like sound managementselected: not all decorative and insulated glass is compatible with all products check with your marvin coastline dealer for a recommendation on which glass is right for your project images may not be an accurate representation color tint images represent color tint example only please inquire about obscure glass treatments separately divided lites divided lites replicate the look of individual panes while maintaining the advantages of a single pane of impact resistant glass which is stronger and more energy efficient than multiple panes separated by muntin bars available in custom configurations to meet an extensive range of design possibilities simulated divided lites are available on doors with non-insulated/single glazed glass in ogee square and flat combinations in varying widths depending on the product type additional design options are available on the pivot door grilles-between-the-glass are available on products with insulated glasssimulated divided lite sdl not all simulated glass profiles and configurations are compatible with all products check with your marvin coastline dealer for a recommendation on which profile is right for your project download nowget the coastline product catalogs get detailed information on marvin coastline including types of windows and doors color and finish options sizing hardware and other key detailsdownload now learn moremarvin signature coastline impact-rated products designed to protect homes from tropical storms and hurricaneslearn more learn morematerials both the interior and exterior feature low maintenance and durable extruded aluminumlearn more learn moreenergy efficiency options that help achieve long-term performance and cost savings in any climatelearn more more from this product linecoastline awningcoastline bi-fold doorcoastline casementcoastline entry doorcoastline glidercoastline multi-slide doorcoastline picturecoastline picture narrow framecoastline pivot doorcoastline single hungcoastline specialty shapescoastline specialty shapes narrow framecoastline storefrontcoastline swinging french door technical specificationsfor the pros find technical documents for this product including installation instructions sizes and elevations 3d drawings architectural detail manuals and moretechnical specifications find a dealermarvin experts are experienced in working with architects builders and homeowners to ensure your vision becomes a realityfind a dealer
38,sliding patio doors marvin marvin products door types sliding doors sliding glass doorssliding doors have one or more panels opening on either a sliding track or hanging rollers they are space saving and help open up a room signaturecoastline multi-slide doorsignaturemodern multi-slide doorsignatureultimate lift and slide doorsignatureultimate multi-slide doorsignatureultimate sliding french doorsignatureultimate sliding patio doorelevateelevate sliding french doorelevateelevate sliding patio dooressentialessential sliding patio door what are sliding doors sliding doors consist of one or more door panels that either glide open on a bottom-mounted track or on hanging rollers mounted from above the different styles of sliding doors include multi-slide doors french doors barn doors pocket doors lift-and-slide doors and patio doors sometimes called a sliding glass door unlike swinging doors that need extra space for the panel to open the sliding door’s panels stack this makes them ideal for living rooms or balconies that may have furniture in the way exterior sliding doors are typically two or more large glass panels earning them the nickname “panoramic doors” sliding doors make for massive openings that can open up a room and create a stronger sense of connection to the surrounding nature this design is also ideal for high-traffic areas like the passageway leading to the backyard or patio during a get-together explore sliding door photo galleries view detailstraditional home for coastal livingview details view all doorsview all doors find a dealerfind a dealer
39,swinging patio doors hinged patio doors marvin marvin products door types swinging doors swinging doorsthe most common style of door swinging doors feature one or multiple-hinged panels that swing open and closed signaturecoastline swinging french doorsignaturemodern swinging doorsignatureultimate swinging arch top french doorsignatureultimate swinging narrow profile doorsignatureultimate wood swinging french doorsignatureultimate swinging french door g2elevateelevate swinging french door what are swinging doors swinging doors are the most common style of door they feature side-hinged panels that swing open and closed swinging doors are available in single or multiple panel designs the direction a door swings either to the right or left is known as its “handing” exterior swinging doors are also differentiated by whether they open into the building or out of it termed “inswing” or “outswing” explore swinging door photo galleries view detailscoastal french door patioview details view all doorsview all doors find a dealerfind a dealer
40,exterior window and door finishes and colors marvin product design optionsexterior finish marvin products design options exterior finish high-performing windows and doors deserve a dependable finish our product lines feature low-maintenance exterior materials meant to be as long-lasting as they are beautiful with varying degrees of color and material options that can help boost your curb appeal for years to come marvin elevate® and essential™ exterior color optionsa strong alternative to vinyl our ultrex® pultruded fiberglass exterior finish is applied through a proprietary process to provide a superior consistent finish the american architectural manufacturers association aama awards certifications to materials that pass numerous rigorous tests these tests simulate the harsh conditions that a finish will encounter throughout the life of the window or door passing these specification tests and achieving aama 624 verification gives independent verification that the ultrex finish is best in class among fiberglass products built for durability and low-maintenance our ultrex finish is 3x thicker than competitive finishes with a smooth consistency and strong finish that resists fading chalking peeling and cracking even in the darkest colors if a design change calls for a new color down the road our material can be painted without voiding our warranty six colors are available in neutral and dark tonesselected: finish samples are approximate and colors on screen can vary visit your local dealer to see actual color samples marvin signature® ultimate clad color optionsour low maintenance clad-wood products feature an extruded aluminum exterior finished in commercial-grade high performance pvdf fluoropolymer paint because our finish meets the toughest american architectural manufacturers association aama 2605 standard you can expect even our richest and boldest hues to resist fading and chalking even in harsh sun or extreme weather conditions a palette of nineteen color options spans from muted earthy tones to bold rich colors and three pearlescent finishes custom color matching is also available to meet any design vision the american architectural manufacturers association aama awards certifications to materials that pass numerous rigorous tests these tests simulate the harsh conditions that a finish will encounter throughout the life of the window or door passing these specification tests and achieving aama verification provides independent verification that our finishes are best-in-classselected: finish samples are approximate and colors on screen can vary visit your local dealer to see actual color samples exterior wood optionsfor projects that call for the natural or historic beauty of wood exteriors we offer a selection of high-quality exterior wood options including pine vertical grain douglas fir mahogany and primed pine that have been factory-treated with a carefully tested wood preservative to help protect against moisture and the elementsselected: finish samples are approximate and colors on screen can vary visit your local dealer to see actual color samples marvin signature® modern exterior color optionscarefully curated to meet the exacting principles and aesthetic standards of true modern architecture marvin modern offers a color palette inspired by the elements choose split interior and exterior color finishes or matching finishes designed to coordinateselected: finish samples are approximate and colors on screen can vary visit your local dealer to see actual color samples marvin experts are experienced in working with architects builders and homeowners to ensure your vision becomes a realityfind a dealer
41,elevate bi-fold door bi-fold patio doors marvin marvin products window and door collections marvin elevate elevate bi-fold door elevate bi-fold door the elevate® bi-fold door effortlessly glides and stacks open so you can enjoy your own scenic view and invite maximum airflow into your home when completely closed the door is designed with narrow profiles to fill your home with light wood interior and ultrex® fiberglass exterior fits openings up to 22 wide by 8 high choose from 28 configurations fiberglass sill stands up to foot traffic and weather find marvin products in your area and request a price quote connect with a dealer near you to get started find a dealer why youll love it indoor outdoor living the elevate bi-fold door opens a home to true indoor/outdoor living made of durable material exterior is made with ultrex fiberglass which is 8x stronger than vinyl virtually maintenance free exterior resists fading bends dents and cracks rich wood interior bare pine interior can be painted in our factory or can be stained in the field to match your interiors design options choose from 28 configurations and up to 7 panels additional features: bi-part from the center or stack panels to one side optional quick access panel available top-hung design for effortless operation integrated multi-point locking system performance sill available in beige or bronze weathertight seal for thermal performance rating of lc-pg30-fld screen available to keep insects and debris out introducing the elevate bi-fold door it’s not a door as we once knew it — it’s everything a door should be see more details on the elevate bi-fold door design options exterior finish a strong alternative to vinyl our ultrex® pultruded fiberglass exterior finish is applied through a patented process to provide a superior consistent finish the american architectural manufacturers association aama awards certifications to materials that pass numerous rigorous tests these tests simulate the harsh conditions that a finish will encounter throughout the life of the window or door passing these specification tests and achieving aama 624 verification gives independent verification that the ultrex finish is best in class among fiberglass products built for durability and low-maintenance our ultrex finish is 3x thicker than competitive finishes with a smooth consistency and strong finish that resists fading chalking peeling and cracking even in the darkest colors if a design change calls for a new color down the road our material can be painted without voiding our warranty six colors are available in neutral and dark tonesselected: finish samples are approximate and colors on screen can vary visit your local dealer to see actual color samples interior finish the elevate collection features rich wood interiors in bare pine that can be stained to match your interiors or finished in our factory with popular designer black painted interior finish clear coat or painted white factory finishing means you can expect consistent quality and aesthetics that come from our carefully-perfected finishing process selected: hardware door handles for our elevate collection are available in two distinct hardware collections: the cambridge collection or the northfield collection finishes in brass oil rubbed bronze and satin nickel are available with a physical vapor deposition pvd finish meaning the hardware has undergone a process that adds a layer of toughness to resist fading and discoloration by direct sunlight humidity and most other environmental factors even in coastal areas choose exterior and interior handle colors in either a color that matches complements or contrasts with the exterior color and the interior finish of your door a concealed locking system is built within the door panels for a clean look effortlessly rotate the interior twin bolt handle up 180 degrees to unlock and open the door; rotate down to lock and secure magnetic door catches come together to protect the panels when open selected: hardware styles shown are available in all finish options below finishesselected: hardware finish samples are approximate please visit your local marvin dealer to see hardware finish samples glass decorative glassa variety of decorative glass options are available to meet the unique needs of each project and laminated glazing is also available in clear bronze gray or green with tinted interlayersselected: not all decorative glass is compatible with all products check with your dealer for a recommendation on which glass is right for your project images may not be an accurate representation color tint images represent color tint example only please inquire about obscure glass treatments separately energy efficiency glass is an important aspect for managing the energy efficiency of your home our standard glazing is dual pane: two panes of glass with low e coatings and argon insulating gas we offer variations to help meet climate and code requirements across the country described in more detail on our glass page specialty glass options our specialty glass options include glass for unique project needs like sound management stc/oitc high altitudes sea turtle conservation codes and california fire zones we also offer laminated glass in products designed specifically for hurricane zones screens when fresh air flow is a priority multiple screen options are available to keep insects and debris at bay the scenic door screen is a retractable screen thats unobtrusive and concealed when not in use it spans up to 1475 feet wide as a single screen that moves in one direction or up to 2625 feet wide with two screens that meet in the middle of your scenic door with screen heights up to 98 feet a comfortable handle pull grip makes operating the screen easy and comfortable the screen folds tightly to the jamb when not in use for an uninterrupted view outside selected: divided lites the look of multiple individual panes of glass is popular in a wide range of architectural styles simulated divided lites and grilles between the glass mimic the look of these individual panes of glass without sacrificing energy efficiencygrilles-between-the-glass gbgsgrilles are permanently installed between the glass panes for a low-maintenance smooth exterior and easy cleaning choose from 6 exterior colors and 3 interior colorssimulated divided lite sdlan energy-efficient way to create the look of authentic divided lites sdl bars are permanently adhered to both sides of the glasssimulated divided lite with spacer bar sdlspaired with sdl bars on the exterior of the glass a spacer bar is installed between the glass creating an even closer match to the authentic divided lite look patternschoose from simulated divided lites grilles between the glass or removable grilles in a selection of pre-designed patterns for added character these are examples of some of our most popular patternsselected: these are some of our most frequently-requested divided-lite patterns exterior trim get the performance of ultrex® fiberglass in convenient factory-cut exterior trim made for easy installation and superior performance over time exterior trim is available in colors to match our exterior window finish and several trim styles choose flat-style for a clean simple look or brick mold-style for a more traditional aestheticselected: sills our scenic door sills are designed for function and beauty with options to complement your lifestyle the performance sill is made of durable thermal efficient fiber reinforced polyurethane and is achieves exceptional performance ratings choose from beige or bronze color options selected: coastal performance marvin offers windows and doors specifically designed for the requirements of coastal and impact zone construction from nor’easters on the cape to hurricanes down south that bring extreme rain salt and wind the windows and doors you choose are critical and can help preserve a homes structural seal our hurricane-rated product options are certified for energy efficiency and rigorously tested by third party agencies to meet or exceed the most stringent coastal codes learn more about marvins coastal solutions that help protect the longevity of your product and the structural integrity of your home download nowget the elevate catalog get detailed information on the elevate collection including types of windows and doors color and finish options sizing hardware and other key detailsdownload now learn moremarvin elevate a thoughtfully designed collection that balances beauty and strenhlearn more learn morematerials our proprietary durable fiberglass exterior paired with warm pine wood interiorslearn more learn moreenergy efficiency options that help achieve long-term performance and cost savings in any climatelearn more more from this collectionelevate awningelevate awning narrow frameelevate bayelevate bowelevate casementelevate casement narrow frameelevate double hungelevate double hung insertelevate gliderelevate pictureelevate round topelevate sliding french doorelevate sliding patio doorelevate specialty shapeselevate swinging french door technical specificationsfor the pros find technical documents for this product including installation instructions sizes and elevations 3d drawings architectural detail manuals and moretechnical specifications find a dealermarvin experts are experienced in working with architects builders and homeowners to ensure your vision becomes a realityfind a dealer
42,window and door collections marvin marvin collectionsinspired products for your homemarvin collections are organized by degree of design detail flexibility and customization options find your inspiration belowdownload comparison chart our collections imagine design and create spaces that incorporate light fresh air and amazing views with the marvin collections learn moresignature collection® featuring the ultimate modern and coastline product lines this collection offers our broadest range of product types sizes configurations and design optionslearn more learn moreelevate collection® an ideal blend of remarkable design and superior strenh elevate products strike a perfect balance between enduring style and unmatched performancelearn more learn moreessential collection™ essential products resist fading chalking peeling cracking and are eight times stronger than vinyl simpler features and options streamline the ordering processlearn more download comparison chart the marvin difference beautiful design innovative solutions built around the way people live superior quality products made to stand the test of time with quality you can see and feel thoughtful support a commitment to providing expert service to help you at every step
