,Data
15,professional resources for marvin windows & doors marvin resources for professionalsmarvin has the resources information and assistance you need to specify configure and install our products easily get startedtechnical specs get product sizing elevations drawings architectural details and more get started get starteddrawings and 3d models explore detailed 3d models and technical drawings of all marvin productsget started get startedcompare collections get all the details on marvin window and door collections and download the comparison chart with materials color options and more get started improved lead times for marvin elevate® and essential™ collections elevate® and essential™ collections now have lead times as low as 5 weeks and are shipping complete and delivered as promised professional support connect with an architectural expertconnect with an architectural expert architectural resourcesarchitectural resources product brochures and catalogsproduct brochures and catalogs support centersupport center view all windowsview all windows installation resourcesinstallation resources energy dataenergy data historic solutionshistoric solutions warrantywarranty view all doorsview all doors additional resources view detailswhat you need to know about window nailing fins we explain the different types of nailing fins and clarify some common misconceptions as to what their real purpose isview details view detailsa guide to understanding glass performance and types this article will give you a better understanding about window glass optionsview details view details10 most common window installation mistakes avoid these window installation mistakes to prevent expensive callbacksview details
16,find a window & door dealer for your project marvin marvin dealer locator find a dealer get pricing and learn more about window and door design and performance optionsselect a dealer type that matches your needs get startedall dealersvisit a showroom or consult an expert about your new construction or remodel projectget started get startedreplacementcontact an experienced marvin partner about replacing your existing windows and doorsget started get startedcoastalconnect with a marvin expert who specializes in hurricane-resistant windows and doorsget started international customers
17,technical specifications marvin for the pros technical specifications find technical specifications for window door and all marvin products including installation instructions sizes and elevations 3d drawings architectural detail manuals and more simply select your product and refine your search to access the support you need windowsdoorsskylightsspaces refine collection/product line signature ultimatesignature modernsignature coastlineelevateessential product ultimate awningultimate awning narrow frameultimate awning push outultimate awning push out narrow frameultimate bayultimate bowultimate casementultimate casement inswingultimate casement narrow frameultimate casement push outultimate casement push out narrow frameultimate cornerultimate corner narrow frameultimate double hung g2ultimate double hung insert g2ultimate french casementultimate french casement push outultimate gliderultimate glider 4 panel bipartingultimate hopperultimate pictureultimate picture narrow frameultimate single hung g2ultimate specialty shapesultimate tilt pac double hung sash replacement systemultimate tilt turnultimate venting pictureultimate wood double hungultimate wood double hung insertultimate wood double hung magnumultimate wood single hungultimate wood product modern awningmodern awning push outmodern casementmodern casement push outmodern direct glaze product coastline awningcoastline casementcoastline glidercoastline single hungcoastline picture narrow framecoastline picturecoastline special shapescoastline special shapes narrow framecoastline storefront product elevate awningelevate awning narrow frameelevate bayelevate bowelevate casementelevate casement narrow frameelevate double hungelevate double hung insertelevate gliderelevate pictureelevate round topelevate specialty shapes product essential awningessential casementessential double hungessential glideressential pictureessential round topessential single hungessential specialty shapes product ultimate bi-fold doorultimate commercial doorultimate lift and slide doorultimate multi-slide doorultimate sliding french doorultimate sliding patio doorultimate swinging arch top french doorultimate swinging doorultimate swinging french door g2 product modern multi-slide doormodern swinging door product coastline pivot doorcoastline bi-fold doorcoastline swinging doorcoastline entry doorcoastline multi-slide doorcoastline glass garage door product elevate sliding french doorelevate sliding patio doorelevate swinging french doorelevate bi-fold door product essential sliding patio door product skylightawaken product skycove documents drawings architectural detail manualsconstruction specificationsflorida product approvalhow-to videosinstallation instructionsowners manualsparts manualssizes & elevations archicadautocad dwgautocad dxfchief architectrevitsketchupsoftplan sizes elevations signature ultimate awning title 2 files typeperformance sizes elevationsultimate awning and ultimate awning push out elevations sizes elevations sizes elevationsultimate wood awning and ultimate wood awning push out elevations sizes elevations × how-to video
18,signature collection windows and doors marvin marvin signature® collection imagine nearly infinite possibilities the marvin signature® collection offers our broadest range of product types sizes configurations and design options you’ll experience the difference in every thoughtful detail with the highest level of architectural precision and beautiful aesthetics featuring the ultimate modern and coastline product lines the signature collection is a hallmark of marvin’s design leadership and customer-focused innovation made to inspire truly exceptional spaces explore the marvin signature collection learn morecoastline signature coastline windows and doors are designed for beauty and built for protection the diverse style and feature options allow you to deliver on a wide range of project demands and all coastline products are engineered to withstand the challenges of coastal weather like driving rains and hurricane-force windslearn more learn moremodern inspired by the needs of architects and builders our modern product line emphasizes the simplicity and large expanses of glass that homeowners seek in a modern home with its innovative high-density fiberglass material leading thermal performance and consistent narrow sightlines it’s a smart and seamless approach to modern designlearn more learn moreultimate the ultimate product line features beautiful design exceptional craftsmanship and nearly limitless opportunities for customization so you can add style to any space ultimate wood and wood-clad windows and doors are available in our most extensive selection of shapes styles sizes and optionslearn more the marvin signature collection difference beautiful design every detail is thoughtfully considered in stunning designs with the highest levels of architectural correctness innovative touches windows and doors in the marvin signature collection make your life easier by providing people-first technology compatible with popular smart home systems wide range of options the marvin signature collection offers our most flexible range of product types sizes configurations and design options explore other collections learn moremarvin elevate® collection elevate products strike a perfect balance between enduring style and unmatched performance the warm wood interiors can be factory finished stained or painted to match a wide range of architectural designs the fiberglass exterior provides strenh durability and high-performing thermal properties that excel in harsh climateslearn more learn more marvin essential™ collection the marvin essential collection has clean lines powerful performance and streamlined options making it easier to achieve design and quality its strong durable fiberglass exteriors and interiors are striking and virtually maintenance freelearn more
19,elevate collection windows and doors marvin marvin elevate® collection strike the perfect balance of beauty and strenh the marvin elevate® collection is an ideal blend of remarkable design and superior strenh bringing balance to your style and performance needs proprietary fiberglass exteriors stand up to all elements outperforming and outlasting vinyl roll-form aluminum and other composites warm wood interiors add timeless beauty while resilient long-lasting fiberglass stays strong in even the toughest conditions learn moredesigned to mix made to match bold timeless alluring gunmetal by marvin is an exclusive hue designed to transcend styles and fit perfectly into your world now available in elevate and essential collectionslearn more improved lead times for marvin elevate® and essential™ collections elevate® and essential™ collections now have lead times as low as 5 weeks and are shipping complete and delivered as promised download nowget the elevate catalog get detailed information on the elevate collection including types of windows and doors color and finish options sizing hardware and other key detailsdownload now elevate: beauty meets strenh proven strenh the facts speak for themselves our proprietary fiberglass is eight-times stronger than vinyl and three-times stronger than vinyl/wood composites it resists fading chalking peeling and cracking stylish design warm wood interiors and on-trend styles are just the start we’ve carefully considered every feature and option so that your windows and doors can make a statement or blend into the decor powerful durability marvin is the leader in fiberglass which outlasts vinyl windows by 38%1 our pultruded fiberglass remains stable in extreme temperatures and expands at nearly the same rate as glass so elevate windows stay strong and true even in harsh conditions 1life cycle assessment of windows for the north american residential market case study by the university of british columbia scandinavian journal of forest research 2008 windows in the elevate collection elevate awningelevate awning narrow frameelevate bayelevate bowelevate casementelevate casement narrow frameelevate double hungelevate double hung insertelevate gliderelevate pictureelevate round topelevate specialty shapes doors in the elevate collection elevate bi-fold doorelevate sliding french doorelevate sliding patio doorelevate swinging french door get inspiredsee how windows and doors can transform a home and spark new design ideasvisit the gallery explore other collections learn moremarvin signature® collection the marvin signature collection features the ultimate modern and coastline product lines and is characterized by thoughtful detail the highest level of architectural precision and beautiful aesthetics our signature collection is inspired by the way you want to live and designed to inspire you to live welllearn more learn moremarvin essential™ collection the marvin essential collection has clean lines powerful performance and streamlined options making it easier to achieve design and quality its strong durable fiberglass exteriors and interiors are striking and virtually maintenance freelearn more
20,essential collection window and doors marvin photograph by hygge custom homes chad gould and ashley avilamarvin essential™ collection design and performance made easier the marvin essential™ collection brings together design quality and performance in one streamlined offering strong durable fiberglass exteriors and interiors are both striking and virtually maintenance-free simplified options make the order process straightforward while clean lines and versatile styles make it easy to meet project demands learn moredesigned to mix made to match bold timeless alluring gunmetal by marvin is an exclusive hue designed to transcend styles and fit perfectly into your world now available in elevate and essential collectionslearn more improved lead times for marvin elevate® and essential™ collections elevate® and essential™ collections now have lead times as low as 5 weeks and are shipping complete and delivered as promised download nowget the essential catalog get detailed information on the essential collection including types of windows and doors color and finish options sizing hardware and other key detailsdownload now essential: straightforward and tough proven strenh the facts speak for themselves our proprietary fiberglass is eight-times stronger than vinyl and three times stronger than vinyl/wood composites it resists fading chalking peeling and cracking powerful durability marvin is the leader in fiberglass which outlasts vinyl windows by 38% our pultruded fiberglass remains stable in extreme temperatures and expands at nearly the same rate as glass so essential windows stay strong and true even in harsh conditions streamlined details with narrow profiles clean lines and simpler features and options essential makes it easier to choose and order windows in the essential collection essential awningessential casementessential double hungessential glideressential pictureessential round topessential single hungessential specialty shapes doors in the essential collection essential sliding patio door get inspiredsee how windows and doors can transform a home and spark new design ideasvisit the gallery explore other collections learn more marvin signature® collection the marvin signature collection features the ultimate modern and coastline product lines and is characterized by thoughtful detail the highest level of architectural precision and beautiful aesthetics our signature collection is inspired by the way you want to live and designed to inspire you to live welllearn more learn moremarvin elevate® collection elevate products strike a perfect balance between enduring style and unmatched performance the warm wood interiors can be factory finished in clear coat painted white or designer black or choose bare pine to finish as you desire to match your interiors the fiberglass exterior provides strenh durability and high-performing thermal properties that excel in harsh climateslearn more
21,awning windows marvin marvin products window types awning awning windowsawning windows open outward from a top frame hinge this style of window is energy efficient great for ventilation and able to stay open in wet weather signaturecoastline awningsignaturemodern awningsignaturemodern awning push outsignatureultimate awningsignatureultimate awning narrow framesignatureultimate awning push outsignatureultimate awning push out narrow frameelevateelevate awningelevateelevate awning narrow frameessentialessential awning what are awning windows awning windows have a single sash hinged at the top of the frame their sash swings outward from the bottom using either a folding hand crack or manual handle awning windows are often installed higher up on a wall for privacy or space concerns they may be placed above doors or larger windows to provide discrete natural lighting and ventilation as well as an expanded view awning windows are also energy efficient as breezes and high winds blowing against them serve to tighten their seal when open awning windows are perfect for inviting in a cool breeze and ushering out stagnant hot air their top-hinge design allows water to shed out and away from the opening awning windows can keep your spaces comfortable and dry sometimes even when open in wet weather explore awning window photo galleries view detailscontemporary micro homeview details view all windowsview all windows find a dealerfind a dealer
22,picture windows venting windows marvin marvin products window types picture picture windowspicture windows are large fixed windows that frame their scenic outdoor view like a painting this type of window can be assembled with or without a sash signaturecoastline picturesignaturecoastline picture narrow framesignaturecoastline storefrontsignaturemodern direct glazesignatureultimate picturesignatureultimate picture narrow framesignatureultimate venting pictureelevateelevate pictureessentialessential picture what are picture windows picture windows provide expansive views of the outdoors and are non-operable meaning they cannot be opened they are often strategically placed in living rooms dining rooms and other areas where a large window is desired for its aesthetic appeal and to increase the amount of natural daylight when to use picture windows picture windows are best used in conjunction with other operable windows and doors to create a larger window system they are designed to match profiles and sight lines of operable windows creating a cohesive look and a larger expanse of glass to maximize views and natural light what are direct glaze fixed windows direct glaze windows also known as fixed windows are a popular choice for modern homes the glass is set directly into the frame without a sash and held in place with an adhesive creating a simple clean profile with more glass area for an expanded view direct glaze windows are non-operable and they are often used in areas where an unobstructed view is desired when to use fixed direct glaze windows direct glaze windows are a good option for a standalone window or direct glaze only assembly the profile is unique and thoughtful consideration needs to be taken when mixing with other product types from the collection direct glaze windows come in a variety of shapes which can be utilized to make assemblies that follow a roof’s pitch or to create unique statement pieces picture specialty shape windows picture specialty shape windows are available in hundreds of different geometric shapes customized for your project for a perfect fit every time learn more explore picture window photo galleries view details modern homesview details view detailswarm wood living spaceview details view all windowsview all windows find a dealerfind a dealer
23,bay windows and bow windows box bay windows marvin marvin products window types bay and bow bay windows and bow windowsbay and bow windows have three or more windows that angle out beyond the exterior wall of the house they are perfect for a reading nook or extra room space signatureultimate baysignatureultimate bow windowselevateelevate bayelevateelevate bow learn moremarvin skycove® marvin skycove is a projected glass structure that creates an intimate nook to enjoy natural light and expansive views of the outdoorslearn more what are bay windows and bow windows bay windows are most often one large center window with two narrow windows installed on either side the narrow windows angle to project beyond the exterior wall of the house creating a three-dimensional view bow windows also project beyond the outside of the building but are usually composed of four or more near-identical windows as a result bow windows have a curved effect rather than an angular one and may need more space than a bay window both bay and bow windows can be installed in individual rough openings in the wall or the factory can mull connect them together and then ship and install them as one large unit bay and bow windows are popular for their ability to open a room maximize natural light and provide a unique view they also make for cozy reading nooks with discrete storage built under the seat explore marvin skycove view detailsmaking the marvin skycoveview details view detailsthe minne stuga by the faux marthaview details view detailsmaking the most of history light and a really tall treeview details view all windowsview all windows find a dealerfind a dealer
24,single hung windows marvin marvin products window types single hung single hung windowssingle hung windows have one fixed upper sash and one movable lower sash this traditional design is energy efficient and cost effective signaturecoastline single hungsignatureultimate single hung g2signatureultimate wood single hungessentialessential single hung what are single hung windows single hung windows look almost identical to double hung windows both have an upper and lower sash traditional aesthetics and are easy to operate and clean the key difference between these styles is that both the top and bottom sashes of a double hung window are movable only the bottom sash operates on single hung windows single hung windows are ideal for areas where the top sash might be difficult to reach because of their fixed top sash single hung windows prevent more air infiltration than similar double hung windows and are more energy efficient additionally single hung windows may be less expensive explore single hung window photo galleries view detailscontemporary black frame kitchen windowview details view all windowsview all windows find a dealerfind a dealer
25,casement windows crank and push out casement windows marvin marvin products window types casement casement windowscasement windows open from a side frame hinge their large single sash lends them a modern feel with tons of natural light signaturecoastline casementsignaturemodern casementsignaturemodern casement push outsignatureultimate casementsignatureultimate casement inswingsignatureultimate casement narrow framesignatureultimate casement push outsignatureultimate casement push out narrow framesignatureultimate french casementsignatureultimate french casement push outelevateelevate casementelevateelevate casement narrow frameessentialessential casement what are casement windows a casement window has a single sash hinged on either the left or the right of the frame most casement windows are operated with a folding hand crank on the bottom of the frame this easy operation makes casement windows a top choice for spaces like kitchens or bathrooms where cabinets or large bathtubs may block access to upper portions of a window casement windows typically give off a modern aesthetic but you can add window grids or divided lite bars for a more traditional feel thanks to their single sash design these windows can offer a wide uninterrupted view top-notch ventilation and painless cleaning casement windows are also a great choice for safety and security concerns in case of emergency the sash can open 90-degrees out to serve as a secondary exit for residents explore casement window galleries view detailsmodern farmhouse black and white exterior homeview details view detailssunny laundry roomview details view detailsa singular take on scandinavian styleview details view all windowsview all windows find a dealerfind a dealer
26,sliding windows glider windows marvin marvin products window types sliding sliding windowsalso called gliders sliding windows feature one or more operating sashes that move left to right this style of sash is ideal for high-traffic areas signaturecoastline glidersignatureultimate gliderelevateelevate glideressentialessential glider what are sliding windows sliding windows or “gliders” are windows with one or more operating sashes they slide left or right rather than up or down like a double hung window the moveable sashes on sliding windows can swing in tilt in or pull out altogether for easy interior and exterior cleaning sliding windows give a room full uninterrupted outdoor views and excellent ventilation these windows are perfect for large horizontal spaces near high-traffic areas like decks or walkways because their sashes don’t open past the plane of the wall sliding windows save space and won’t damage landscaping that may be close to the house explore sliding window photo galleries view detailsa kitchen remodel centered on well-beingview details view detailsemily henderson mountain home transformationview details view all windowsview all windows find a dealerfind a dealer
27,corner windows panoramic windows marvin marvin products window types corner corner windowscorner windows are single units made of two or more sashes meeting at a corner they need special framing but offer an unbeatable panoramic view signatureultimate cornersignatureultimate corner narrow frame what are corner windows a corner unit consists of two or more stationary sashes that span both sides of a building and meet at a corner this style of window requires a special structural frame that can accommodate a large rough opening with no corner support corner windows have a clean and modern aesthetic with minimal visible frame these windows can give your space a dramatic wall-to-wall panoramic view explore corner window photo galleries view detailsurban multi-family with corner windowsview details view all windowsview all windows find a dealerfind a dealer
